id,uid,title,score,date,content
,,must do,5.0,,"We book well in advance, and asked for certain dietary changes is no mayo. We were welcomed and taken to our table. The food was of a very high standard and well presented. We also had Champagne, to add to the occasion.On balance the whole was great but overpriced, but when in Singapore its something you have to do.We also had a Singapore Sling in the Long bar, again the cost 38 pounds for 2 drinks was overpriced."
,,Had to go and see.,4.0,,We had been put off going by lots of comments about it being overpriced and just catering to tourists. But I am glad we went. Of course we had a Singapore Sling and also a couple of beers. Upstairs in the Long Room they had a live band on that were very good and we took some time to walk around the grounds afterwards. We were late so the shops in the Arcade were closed but it is a historic building and we enjoyed our visit.
,,Wonderful architecture,5.0,,"You just must go see the Raffles Hotel in Singapore. It's an Institution. At least go and have a picture in front of it, even if you're not staying ;)"
,,Spent some time walking around th building and taking in some of the splendour and history of it,5.0,,"Awesome building well worth a visit, there is a dress code for diners but visitors are allowed in the building"
,,Raffles Tour,5.0,,Raffles afternoon full buffet was excellent at $103 per person was magnificent with so much to chose from and unlimited. Take the afternoon all inclusive tour including Raffles; part city tour and bum boat cruise
,,This is the best of what is left from the Colonial period,4.0,,There are several shops and a nice out door cafe with excellent pizza. But beware the drink prices are very high. The original Raffles bar has been restored and has the original billiard tables. It is located between the Arcade and the hotel.
,,Just more shops,3.0,,"Of course the iconic Raffles Hotel deserves to be on any itinerary when visiting Singapore. But the arcade itself is really not that special - just a selection of fairly standard shops. It's interesting to walk around and admire the architecture or to have a drink at the Long Bar, but otherwise nothing really special here."
,,Another must visit in Singapore,4.0,,"What to say, the most famous hotel in Singapore and probably all of SEA so you need to at least have a Singapore Sling in the Raffles Long Bar and walk through the grounds of the hotel and Shopping arcade."
,,Shopping with a platinum card.,3.0,,Worth the walk around this historic shopping centre. Everyone rushes for a drink at the long bar. Famous for the peanut shells on the floor but not for anything else. The boutiques in the shopping area are very upmarket and not for those on a budget. It can get very hot and humid as the whole area is open air.
,,You cannot go to Singapore and not at least see The Raffles,5.0,,"You cannot go to Singapore and not at least see The Raffles. More a city landmark than a hotel, the arcade is good to walk through and the hotel good for afternoon tea, although I have never stayed there despite pleading with my wife!"
,,evening visit,5.0,,"Our party of 40 went to Raffles one evening after a city night tour and had our Singapore Sling in the Raffles Bar, and the monkey nut shells were thrown on to the floor. Great Live Music as well."
,,Sling in the Long Bar,5.0,,We had a Virgin Sling & some Wine in the Long Bar with some Chicken wings & had a interesting walk around the hotel . Well worth a visit
,,Nice shopping arcade close to the hotel,4.0,,"Walked through here on my way to a business meeting, have shopped and eaten here before, nice and convenient if you have a meeting in Raffles Tower with IE or if you have a business meeting in the Raffles Hotel"
,,"Lovely architecture, lush gardens, nice for a walk",3.0,,"Super-modern architecture getting you down? The Raffles Arcade is a nice place to go for a stroll, soak up a bit of ""how it must have been back then"" atmosphere. Bakery a bit sterile and disappointing, though."
,,"Singapore sling, just for the hack of it",3.0,,"Stopped in the long bar for an original Singapore sling, which was OK. Not really being a long-drink person it was more because of traditions than anything else. Service and atmosphere was good."
,,Went for a drink,3.0,,When in Singapore you have to have the authentic Singapore sling. We sat and had peanuts and a sling and finished off with a cocktail. The bill for 4 drinks came to AU$106.
,,Great Atmosphere and service,5.0,,A must see and do if in Singapore . Great slings live music and service. The long bar is the place to go to .
,,Old days of Singapore,4.0,,"This is an iconic hotel built in colonial style, probably the first one in Singapore. If it was in Europe, you'd probably pass it without stopping, but here it has character and history. You feel it from the moment the doorman opens a door for you.
Very pricey, but free to go in and look around for yourself."
,,A must!,4.0,,"I said a must because of the history of Raffles, mainly tourists trying the Singapore sling 31$ plus service and tax, and of course all the monkey nuts you can eat, drop the shells on the floor , the reason for this is because the oil in the shells polished the floor?
I went for a pint the most expensive pint I have had $20 + service and tax. Recommend for the experience!
Credit cards accepted!"
,,a wonderful place,5.0,,my partner and I been to Singapore twice and all ways go to raffles just to sit in the long bar just as it was when sir raffles was there you must have a gin sling bit costly we shared one as we do not like gin . but the grounds are great easy to find right next to the war memorial for cilvilians killed during w w 2
,,Must go to Long Bar,4.0,,Yes you will pay $32 for your Singapore sling but the bar and hotel is definitely worth it! The food menu leaves much to be desired but the cocktails are great!
,,A bit boring really,2.0,,"O.K you go because it is ""Raffles"" but there really isn't that much to keep you there. The buildings are pleasant but the atmosphere is dull and a bit life less."
,,Dreaming doesn't cost you anything,4.0,,"Raffles is open to the public and is always neat and clean. Lots of shops and just like Orchard Road, there are no price tags, and in the evenings, the shop windows are emptied; this stuff must be absolute REAL. If you are staying at Raffles, you probably could afford some of these goods; but not on my budget, which starts with a B; that is Bugis Street.

Aside from the shops, there is outdoor dining and I seen some delicious pizza being made; we did end up though having dinner in the Long Bar (see separate review)."
,,Singapor slings at Raffles Hotel,5.0,,Had Singapore slings at the historic Raffles Hotel -Lovely but pricy at £18 each! went back to Pan Pacific Hotel and had them free! Well kept Hotel have to visit the Long Bar and throw nut shells on the floor.
,,pleasant evening,5.0,,we spend amazing evening in the court yard. Food was excellent.Singapore sling was delicious but i really enjoyed chilled red Italian wine.
,,Colonial History epitomized,4.0,,"Raffles is the definition of English Colonialism in the far east and as such no trip to Singpore is complete without a vist to Raffles.
the forecourt is about as close as most people get to the place these days other than the long bar which is now out the back in the extension. Dissapointly we were unable to view the foyer on this vist as it was closed off to the public and for guests only. However I was fortunate enough on a previous vist to be able to walk the grand staircase. hey, if you can get in do so. the smoking rooms, old bars and comfortable leather lounge chairs are straight out of an old english gentlemens club aka Sherlock Holmes, deepest darkest jungle explorer types.
i love it for the history but I could never afford to stay there."
,,A must visit,5.0,,Anyone and everyone visiting Singapore is required to visit Raffles to sample the very enjoyable 'Sling' not necessarily cheap but worth a try!!
,,A visit and reminder of the Colonial Past.,4.0,,Raffles itself has been rebuilt and enjoys a return to the past of ladies and gentlemen Enjoying afternoon tea and no jeans allowed. The shops are opulent and the jewellery is fabulous and service is superb . Singapore Sling was not to my taste but the Raffles fruit punch in the garden bar was fab.
,,Raffles is Singapore,4.0,,It may be a tad pricey to stay at but Raffles has to be visited when you visit Singapore. It's the ultimate Singapore experience having a drink in the bar and seeing the colonial mementos on display in museum
,,Conventional shopping and a world famous bar,3.0,,"The highlight in the Arcade is the bar where visitors by the seeming hundreds venture in order to enjoy a Singapore Sling. The room can get very crowded as people try to drink up the atmosphere and imagine what things were like in the Colonial days before the War. Maybe nostalgia for some, but a curiosity to the new comers. Don't be shocked at the prices."
,,very special,5.0,,highly reccomennd this location as it brings back the opulence and quality of Britains old colonial days a must see hotel and afternoon tea at raffles a big must
,,Must go here when in Singapore,5.0,,Had a lovely evening here with other travellers. Enjoyed the music.and of course THE SINGAPORE SLING. Great evening.
,,Back in the Centuries,5.0,,Perfect choice if you are looking for some shopping in a precious atmosphere. It is a great place to walk around and immagine how Singapore has been in the past.
,,Have your Singapore Sling here!,4.0,,Went here for a Singapore Sling and some high tea. Very nice hotel just passing through. The waiters were great and the location is perfect!
,,"Must do, of course",4.0,,"Visit more for the history, the experience and if it's on the bucket list. Shops here are as you would expect very high end."
,,pretty much oversold,3.0,,"The Raffles is a wonderful old building. The Arcade is a bunch of totally overpriced, snobbish stores. We didn't stay for a Singapore Sling because it was crowded. We though we could do better elsewhere, so we went into the Chijmes complex across the street, where there are many restaurants. It was much less crowded and also a very nice atmosphere."
,,A great place to visit,5.0,,"This is a must do place in Singapore. History seeps from this place. A large hotel with lots of places for tourists to wander. Lovely courtyard for drinks. Sadly the long bar was closed when we visited, but coffee shop served excellent coffee and croissant."
,,Walking into history !,5.0,,"This was one of my must do things for many years, and I was not disappointed ! To see and touch the history of this building was incredible !"
,,Doesnt live up to the hype,2.0,,We were really let down by this hotel in general. Had so many expectations and it didn't live up to any. We had drinks which were so expensive and a rip off. Would not go back nor recommend.
,,Go there for a drink in the courtyard.,4.0,,We always take visitors there for a drink in the courtyard. You can also walk around certain parts of the hotel and the gift shop is also very nice and very big. They have many interesting cocktails on offer in the bar. A classic must go.
,,afternoon tea,5.0,,"afternoon tea was great value for money, the staff were very friendly and attentive. good choice of food and the Singapore slings are amazing"
,,Guess you have to visit if you're in Singapore....,3.0,,I guess you have to visit if you're in Singapore and you're curious about the history. I just stuck around for a quick look and a few photos and left
,,lovely absolutely brilliant,5.0,,This was brilliant and we thoroughly enjoyed our meal experience there. the staff were so attentive and the food was excellent. If you get the chance go. Worth the money.
,,A Singapore legendary location,5.0,,Shopping was special but the big attraction was the Long Bar and it's world famous Singapore Slings. Delicious but ridiculously expensive. $36 CD or $25.00 us but we had to do it!
,,Singapore ICON,5.0,,"When in Singapore one must at least dine and shop at Raffles an icon in itself . This is the hotel in the city, rich in history, bathed in luxury and an experience not to be missed. Stopped by for a quick bite at Ah Teng's Bakery---tasty sandwiches with small salads fit the bill. Shops are expensive but worth a walkthrough before spending your $ elsewhere. There are no bargains here."
,,Worth a Wander,4.0,,"If you love old buildings and what they represent, this place is worth the walk through but the shopping is expensive. Go anyway just to see what all the fuss is about."
,,Must do'ish,5.0,,"Raffles is a piece of history that must be visited and the obligatory Singapore Sling must be consumed. I have no idea what I had tasted before but this drink here, in Raffles, was easily drinkable. They do, however, provide the customer with the smallest peanuts I have ever seen."
,,A Singapore sling or two,5.0,,"We took the bus to Raffles and enjoyed an afternoon sipping on Singapore slings, bags of complimentary nuts, and some lunch. Very beautiful place to see, old world, nostalgic."
,,losing its ambience,3.0,,"been back again to raffles, and it feels more touristy with shops, i suppose i am thinking nostalgically about when it was a real hotel first rather than tourist trap."
,,Raffles Hotel is a must-see site,5.0,,"I always visit Raffles Hotel when I stay in Singapore. It's a hotel with a history with colonial architecture of a by-gone era. Visit Raffles shop with a variety of goods, or Jim Thompson's shop for bags, stylish 't' shirts, and a range of other goodies. Just absorb the atmosphere of Rafflesover a main meal or afternoon tea. All at a very reasonable price in a conducive environment."
,,A Must Go Place,5.0,,Wonderful to be met by the Concierge in all his finery. This is something everyone to Singapore must do. I found the corridors and waterfall and the beautiful foilage and seating areas outside Raffles Hotel outstanding. The shop was full of wonderful items and would have liked longer to look at all the rest of the shops. However a Singapore Sling at the outside bar is a must to Singpore. What decadence!
,,Gorgeous original features,4.0,,"We had to visit for a Singapore Sling ... Staff were great and very friendly, the prices are very high but for a once in a life time run by its a definite visiting place"
,,A Classic Stay,5.0,,"My wife and I spent a romantic weekend here. Its a classic 'must do' experience. Anyone entering the hotel feels like Royalty.
We found ourselves dressing up just to go down to breakfast (after an early morning rooftop swim). Walking through the white stone corridors passed the tall french windows where walls are lined with celebrity guests from another era, Charlie Chaplin, JFK, Churchill, Gatsby, Marylyn Monroe and hundreds more.
The Long Bar and the Singapore Sling could be given a miss but everything else lives up to the hype. Which is rare these days.
Stunning architecture and beautiful internal gardens."
,,What a place!,5.0,,"Spent half of the day in this paradise inside the heaven - from breakfast in Teng Bakery to lunch with Singapore Sling in the Long Bar. Shopping was also interesting, my favorite - Jim Thomson shop."
,,Not worth the money,3.0,,The gift shop is very nice brought some nice gifts.Had tea in the courtyard very dissappointed large thick heavy canteen style cups in red and white.Raffels trades on the name we almost stayed here glad we choice the Pan Pacific much more upmarket also serves tea in bone china cups.
,,As you'd expect,5.0,,"Went for world famous cocktails and wasn't disappointed. Beautiful building, very unique and classic English gent. Extremely classy"
,,"A must, once.",5.0,,"This is a must when in Singapore. The hotel looks beautiful and is a super reflection of the colonial past. You will not be allowed in the hotel itself (unless you are staying there of course) but will be allowed in the gift shop! And you also have access to the Long Bar where you can enjoy a Singapore Sling, surely the main reason most people visit. We both really enjoyed our visit and the Singapore Sling was much better than others we had tried. Would we visit Raffles for another Singapore Sling if we visit Singapore again? Probably yes."
,,Where they invented the Singapore Sling,5.0,,The place is full of history and character. The courtyard is beautiful. i can only imagine what this was like when it first opened.
,,Lunch in the Courtyard,4.0,,This is a very pleasant setting with good Italian food. You will not get access to the other parts of the hotel if you eat here but you can certainly get a feel of the colonial past. The Gin Sling is of course overpriced but worth it for the experience. We were slightly disappointed with the service here- we waited in vain for someone to take our order for dessert and in the end didn't bother. It was about to rain and maybe the staff had other priorities e.g. moving tables.
,,One to Cross Off the Bucket List,4.0,,"How can you go to Singapore and not go to Raffles? The Singapore Sling was 100 years old last year and still costs a fortune. The hotel itself looks amazing and has some great shops within the complex, but 'the sling's the thing'. Not cheap at $29, about £14.50, but an absolute must. Do NOT miss it if you are there!"
,,Full moon at Christmas viewed from the inner courtyard!,4.0,,"Such was my experience, and it was charming because of the elegant surroundings that honor the history of the hotel and the style it is trying so hard to keep - and succeeding at it, fortunately! I had dinner there in the open upon my arrival in Singapore, an Italian dish of pasta and pesto: I could not expect it to be inexpensive, and I was right. The location and the full moon made it memorable, but even without the full moon this is a place to visit when you are in Singapore."
,,Afternoon Tea at Raffles,5.0,,We enjoyed afternoon tea as part of a sightseeing tour. A visit to Raffles is a must and the afternoon tea is lavish and served in a very ornate dining room. A perfect reminder of the colonial past of the city. Smart casual dress is required and most people present had made the effort to pay respect to the elegant surroundings. The gift shop is useful for those 'special' souvenirs not found in the everyday shops but prices are high.
,,Inspiring,4.0,,Inspiring Nice with open court yard in the fresh air Has restaurant in the yard Great shops and many yards Lovely fantastic plsce
,,Beautiful historic buildings,4.0,,lovely place to wander in the gardens and along the wide cool verandas. Lots of small shops with all kinds of interesting wares.
,,Essential to visit,4.0,,Iconic to visit with beautiful surroundings. Went to the Long Bar and drank a Singapore Sling but I think $32 is a bit expensive
,,Had cocktail dinner at The Raffles Hotel,5.0,,"Witnessed the preparation of The Singapore Sling, an exotic cocktail by the Master bartender at The Raffles..I didn't drink it though.... Ha ha !"
,,Take your wallet - full!,3.0,,We visited here as part of a Singapore by night tour. Interesting history and famous for the Singapore Sling drink. I don't like gin so I opted for the beer instead. I bought two Tiger beers and it was $47.00 Singa. You do the math!
,,You just have to go see!!!,5.0,,"What a wonderful experience we had, a Singapore sling in the Long Bar, could make out what all the mess was on the floor,but the give you a bag of monkey nuts with your drinks, in the end you join in and put you're shells on the floor!!"
,,"Got to have a sling or two,",5.0,,"Not a cheap thing to do but when in Singapore we went to raffles for a singapore sling. They now come in a variety of flavours but all are around $30+ which hurts a bit! Enjoyed a sling and then went down to the courtyard to have lunch. There some good deals here for sharing a meal and keeping the costs down. Make sure that you are Hungary as this is a plentiful deal and we were stuffed when we left. The food is Italian and there is something for everyone. Try it, you might like it."
,,long bar,4.0,,we had to go for the famous singapore sling expensive but well worth it you have to wait to be seated and then shown to your table we asked to sit at the bar and had to wait a bit longer gets busy worth a visit
,,So wanted to get to Raffles and totally loved it!,5.0,,"Have wanted to get to Raffles for a long time so now been there and done that and delighted we did!
Highly recommend going to the Long Bar and drinking on a Singapore Sling - the only place to drink it where it was invented. The hotel is glorious with fabulous patios and palm trees.
If you want to purchase souvenirs there is a wonderful gift shop with amazing items to purchase - from relatively inexpensive all the way through to dearer items.
Staff and service was excellent. We visited just before Christmas so it was fabulous to see all their Christmas decorations even though the weather was 34 degrees outside!"
,,LOVELY OUTSIDE ARCADE - WORTH THE EXPERIENCE,4.0,,"Stopped for a Singapore Sling and a cuppa tea just to experience Raffles though you are not able to go into the hotel unless you are a guest. The garden and arcade are delightful. Expensive drinks (we expected it!) and a pricey souvenir shop with everything Raffles but if you are looking for that little different gift, this is the place to shop. So glad we went."
,,Grand Architectural aspect,5.0,,A must visit if you are in marina Bay area. The architectural aspect of the building is well-preserved and you can imagine it's grandeur as Old Post office during Colonial time.This is the one of the few remaining heritage buildings amongst Marina Bay
,,Beautiful building,4.0,,Lovely building and especially at night when it is all lit up. The shopping arcade is very quiet with top brand shops. Worth popping in if you are around the area.
,,Interesting but overrated,3.0,,Quiet colonial retreat. No longer a hotel but a shopping arcade full of expensive outlets. Singapore Sling was twice as expensive as in our hotel. You pay for the location.
,,lovely at night all lit up,5.0,,"raffles hotel is lovely at night, was all lit up, long bar was surprisingly quiet, i was a bit disappointed that some slings were unavailable, the one i had was nothing special and very pricey at 34sd, but the ambiance was good. Lots of shops in the grounds."
,,I loved the old Raffles,4.0,,"We went in the old Raffles in1978 and we loved it,,the new Raffles is nice you must have a look round visit the Long bar,still its to modern for me, give me the old long bar. out in the court yard you can order food and have a drink under the stars its in a beautiful setting"
,,Worth a visit,5.0,,Definitely pop in for a Singapore sling !! or partake of an excellent evening meal. You get a real atmosphere of its colonial past and steeped in Singapore's history
,,Raffles hotel,4.0,,"A must see, although tourists are directed towards the souvenir shop first. Lots of empty spaces, lovely decor. We saw a wedding taking place in the grounds. No shade outside once you have finished the tour so make sure you have transport it is extremely hot to walk."
,,Stylish Singapore Slings and shopping,5.0,,"We enjoyed appropriate refreshment in the Long Bar, obtained souvenirs in the shopping arcade and enjoyed our visit. Unfortunately, non-residents cannot just walk in to the actual hotel but that did not detract from our visit."
,,Step back in time,5.0,,Beautiful building and Singapore Sling is a must in the bar. Not cheap but worth the experience. Recommend the gift shop- good quality and lots of choices- make sure you visit all the rooms as the souvenir glasses are hidden down the back.
,,More designer shops,3.0,,After a drink in the long bar we mooched around the arcade. Shops are upmarket designer units that were lacking customers. The best bit was the arcitecture and wonderful staircase.
,,Nice arcade,3.0,,Good variety to the all day activities in Singapore during daytime. Expensive for European standards.
,,Tourist trap,3.0,,"Raffles has the name, but unfortunately that was a long time ago. Bad service and the bar is one big tourist trap for mostly old people."
,,Worth a visit!,4.0,,I visited Raffles Hotel on our last day of our trip. My wife & I had drinks & lunch in the Long Bar. Lunch & the Singapore slings at the Long Bar were excellent. It is well worth visit!
,,Raffles hotel arcade,5.0,,These are small designer shops inside the famous raffles hotel. You get all good high quality items here .
,,"Old Structure, Not Worth a Visit Unless You Have Spare Time",3.0,,"Just an old, historic structure, currently being used as a hotel. Visitors are allowed to visit the shopping arcade (and maybe buy some expensive things). Some areas of the hotel are out of bound for tourists."
,,For the top 1% only ... except to look,4.0,,"This arcade is beautiful and caters to the ""beautiful"" people. Expect to see gorgeous shops with outrageous prices. High quality, higher prices. Orchard Road is just as good and far more reasonable (well maybe not ""far"")."
,,Interesting,4.0,,"It's ships , but set within the colonial age building of raffles so slightly more interesting than some , we did find a good Taylor which we used jacks , it's just more ships though , there is no end of them here"
,,Many Great Shops,5.0,,Great place to shop on rainy day. Many wonderful shops and the hotel shop is the best of all. Lots of souvenirs. Super bakery and open court for pizza and lunch. Of course the bar is perfect for a Singapore Sling (about $26) Wanted to learn more about Raffles so bought a book on the history. Even bought some Christmas presents you would not find elsewhere.
,,A must visit place,5.0,,Raffles does not disappoint.Great to see that the place is alive with cultural activities. beautiful gardens are being well maintained and fully utilised. well done Raffles!
