id,uid,title,score,date,content
,,Raffles,4.0,,Not the pre war Raffles as most including the Long Bar have been moved over time. Tiffin Rest.t still in same place. Singapore Sling OK but ask for one to be made up in front of you.
,,A taste of the Old,4.0,,This arcade offers the visitor a glimpse of what the old Singapore hotels are like. A pleasure to walk around in with all the little shops inside. Prices in these shops aren't the cheap - but you can always get a Raffle Hotel umbrella for $30.00 .
,,A lovely building,5.0,,We enjoyed our time visiting the arcade. and the hotel amazing to think it has been there so long when you see all the new hotels around
,,We stayed at the Carlton Hotel next door but always go to Raffles to experience the Long Bar.,4.0,,"I recommend that when visiting Singapore, you take time to visit the Long Bar at Raffles, it is a unique experience, stepping back in time to the Colonial days. Enjoy a point of the best or the house Singapore Sling as only they can make it. The basin of peanuts on the tables with shells underfoot is novel as is the topping up from a sack!!"
,,part of a tour visit,4.0,,"We visited Raffles, The Long Bar in particular, as part of a Singapore by Night tour. It was quite an experience. The music from the live band was excellent. We spent an hour or so there before leaving. We didn't have a Singapore Sling as it cost $72, just too much."
,,A glimpse of the past!,4.0,,"The beautiful old Colonial building is well maintained and allows you to imagine what life was like in Singapore a century ago. If you get a chance, stop for a Singapore Sling in the Long Bar."
,,Great Arcade has everything,5.0,,We stayed at Swissotel the Stamford in Singapore and it is attached to the Raffles Hotel Arcade so you dont need to go far for shopping you just walk through and you are there it has everything from Brand name shopping to a local food hall on one of its levels we ate at the local food hall a couple of time it was great and so cheap and interesting place to visit.
,,"Great shopping ,",5.0,,Raffles Arcade has great shopping and Great restaurants . Such a big place . Staff are very helpful and they see you get into a taxi ok.
,,No visit Singapore is complete without a visit to Raffles,5.0,,"surrounded by busy roads and tall buildings Raffles hotel is an oasis of calm. Staffing within the walls of this hotel is like stepping into a different world it's a good examples of poor and no visit to Raffles would be complete without a Singapore sling in the long bar, and the chance to throw your peni and the chance to throw your peanut shells on the bar floor. The shop is worth a visit but it's not pocket money prices. I was happy to sit and watch people go by and just take a step out from the busy world."
,,Gotta sling it,5.0,,"This hotel is everything you have read or heard...a grand old beauty and yes you really must have a Singapore Sling in the bar....just keep in mind that while the bar is casual, you are not allowed into the hotel or its upscale restaurants in anything less than business casual. This hotel provides a real glimpse into the world of British colonialism!"
,,Raffles,4.0,,"Beautiful historic building and grounds.
I followed my Dad's advise to go there for a Singapore Sling, which is a drink that originated at Raffles. This was a 31 Singapore dollar Drink, but probably worth the expenditure to try it and be able to say you did it. Raffles rooms were going for over 2k a night when I was there so I opted for other lodging, but was happy to explore this historic hotel."
,,Singapore Sling,3.0,,Went for a visit during our stay in Singapore. $163 for a round of Singapore Slings which is even well over the top but has to be done....Cheers
,,Definite historical visit you should see,4.0,,Home of the famous Singapore sling and icon bar. If you stop to have a drink be aware it will come at a very hefty price to say you had a sling at Raffles. I got on a night tour that included a video sot to the bar and a drink. Less expensive this way
,,"Historic, Raffles Hotel",3.0,,The Raffles Hotel shopping arcade is full of interesting designer stores and gift shops. Stop in at the Hotel for a traditional Singapore Sling and sit amongst the tropical garden surrounds.
,,Raffles in its Glory Days,4.0,,A walk around the quadrangle at Raffles brings out many surprises as to how many shops there are hidden away. it is worth exploring but not in the evening as many are closed
,,Amazing place,5.0,,"Wow - what an amazing place to visit. Of course you have to have one of their famous ""Singapore Slings"" but make sure that you are ready for a surprise when you get the bill. $72.95 for 2 drinks."
,,"Fascinating, brings you back to past",4.0,,"IT is really fascinating to see how was the architecture in the past, brought from one side of the world to the other. You can recall British spirit and mood but in an environment and among a nature of a kind so far away from England that looks quite impossible. It is allowed to walk in the gardens, in the patios and take pictures freely, and it's quite strange to see so few people there. It can happen you are the only person around and can start to dream to have been send back to past .. Very delightful"
,,A must visit,5.0,,Cannot go past the historical Raffles Hotel. It still has the grand feeling of yesteryear. Sit in the Long Bar and have a Singapore Sling. Very overpriced but a must do!
,,Singapore sling,3.0,,Beautiful hotel. Drinks mega expensive. Great one time visit for the Singapore sling. The bar was beautiful seating is limited so before 5 you have a chance of getting a seat.
,,Pricey Experience,3.0,,"The home of the Singapore Sling! Had to have one drink at the bar that invented it in 1915. Thought it might be a little pricey, but did not expect $36 Singapore Dollars each, without the souvenir glass."
,,Singapore Sling is a must,5.0,,"You simply cannot go to Singapore without visiting the world famous Raffles and tasting a Singapore Sling, even if it does cost €31 - outrageous price but how many times do you get the chance to do it!! If you think that the hotel is what you see in the photo then think again, the place is huge, but the area you are looking for is the Long Bar. Dont be surprised by the husks from monkey nuts on the floor either"
,,Lovely old hotel,4.0,,Large old hotel with the long bar on the first floor where there is a live group singing popular songs and where of course you can partake in the traditional Singapore Sling.
,,Adsorb the atmosphere of Singapore both modern and historic,5.0,,"This is a great place to capture the atmosphere of modern Singapore and understand how it has developed over the years, you can also understand how the city stare has developed around the river and see many key old and new buildings."
,,Tourist trap,2.0,,"Raffles Hotels own shop is overpriced and just trades off the 'marque'. Other shops are just upmarket boutiques - Rolex, Jewelers etc. Give it a miss"
,,SIngapore sling,5.0,,One of the must do's and the long bar did not disappoint. Lovely bar and fantastic service by very gracious staff. Decided against the high tea in the afternoon simply down to cost ($72 per person)...grab a singapore sling instead
,,Sling yourself into here,5.0,,"If you want to see a bit of historical elegance just visit this arcade - not just the Long Bar. It is a beautifully constructed and elegant (as well as cool) arcade with some unique shops (too expensive for us), gardens.

The Long Bar? A chance to experience that times-gone-by ambience (lots of wood, the fans gently swaying on the ceiling - now mechanically driven) - and of course, the famous Singapore Sling (and other cocktails). Yes - it's pricey but you may only be here once."
,,Raffles,3.0,,"We arrived at Raffles by taxi as it was raining. The lovely concierge dressed in his Indian outfit from the Raj era opened the taxi door and escorted me in under his umbrella even tho I was just going to have a look and not staying there. Then he went and escorted my husband in. I asked him if it was possible to have my photo taken with him and he happily obliged.
It was lovely seeing how the colonial Britains lived in oppulance.Nowadays it lives on its colonial past and has expensive shops in the arcade."
,,Home of the Singapore Sling,5.0,,Besides being a beautiful building in a great area it is home to the famous Singapore sling. You need to just try one to realize how good it is. Great atmosphere a little pricey but I've seem worse.
,,Trip of a life time,5.0,,"Immersed in history you can imagine what is was like in bygone years opulent and indulgent ! Pricy but worth every penny treat yourself to afternoon tea dress to impress and sit back in another era .service second to non food out of this world do not eat anything else before had to ensure you get your money's worth .There are savouries to start sandwiches hot courses .fresh fruit .cakes all shapes and sizes ,deserts and continual tea or coffee served on silver plates ,as you finish one plate it is removed and you help yourself to the next .Must do book well in advance as it gets very busy and you could be disappointed and turned away at door .Something you will remember for the rest of your life"
,,Singapore Sling,5.0,,We had the traditional Singapore Sling at the Raffles Bar which suprisingly wasn't too overpriced. This is iconic after all and you're there for the atmosphere. Food wasn't bad either ;)
,,A wonderful relict of the colonial era,5.0,,"A symbol of the colonial luxury, a huge hotel complex, Fine dining, a drink in The bar - it completes the atmosphere. The accommodation does not correspond with my budget, but it is the place in Singapore which we should visit."
,,The history of Raffles,5.0,,"You can't be in Singapore without a visit to Raffles opened by the founder of Singapore and used in a number of films.
Visit the bar for the famous Singapore Sling, you may have to que but it's worth the wait. Take time to explore the building on the top floor are lovely painted murals on the outside walls, there are shops set within the hotel however these are very expensive but lovely to see."
,,Bean,5.0,,Awesome place Well worth the trip even the cost of the famous Singapore sling was worth it A must visit !!!!!
,,When in Singapore you MUST visit Raffles Hotel!,5.0,,"We visited Raffles Hotel on our last day in Singapore. We looked around a little bit and visited the Gift shop. There are some great items in the shop, but it is a little $$$. We also visited the Long Bar - but chose not to purchase a drink prices are super expensive. So having a look around was enough for us!"
,,Not worth the cost,3.0,,"If you have not been there before it is probably worth having a drink,but if you have already done the above ,I think $30 for a beer is too much"
,,Things to buy at Raffles Gift Shop,4.0,,"** (Readers and reviewers, please note that this space is for reviews of Raffles Hotel Arcade only - you will find hotel reviews in a separate entry.)**

Unless you are planning to shop for a new Rolex or Tiffany jewellery at Raffles Arcade, I suggest you check out the Raffles Hotel Gift Shop for souvenirs of your visit. There is something for everyone: among the usual (rather overpriced) key rings, coasters and fridge magnets, you will also find a lot of quality gifts. I can recommend the reproductions of vintage travel posters - there is a good selection for sale. You can also get the famous Kaya jam, a Singaporean speciality.
I bought a fascinating book ""Memoirs of a Raffles Original"" by Mr. Leslie Danker, the Resident Historian at Raffles, and was lucky enough to meet the author and have the book autographed! I recommend Mr Danker's book if you are curious about the history of the hotel, and if you are wondering what the phrase ""a Raffles original"" means...."
,,"Great experience, walking around Raffles",5.0,,Great experience walking around raffles Impressive architecture with the old english traditions A must do if you're in Singapore
,,Long weekend,5.0,,Raffles is a must visit to enjoy a cool drink - Singapore Sling or Tiger Beer - teh old world style is well worth the visit
,,A real treat.,5.0,,"We spent an afternoon at raffles, obviously we visited the long bar for a Singapore sling, which was lovely, we had previously booked online for afternoon tea in the tiffin room, and we were asked why we were booking ? We added that it was to celebrate a special birthday. Much to our surprise I was given a beautiful birthday cake and all the staff stood around and sang happy birthday to me . It was a lovely end to a day I will never forget."
,,Singapore sling,3.0,,Everyone should visit Raffles and have the famous Singapore Sling and don't forget to visit the museum at the hotel and find out who had stayed there in its payday
,,Nothing to recommend it except the history,5.0,,"You do this because of the history. The Long Bar is part of the Arcade and full of tourists. The S Sling is at a tourist rip off price and they don't even make it for you, comes ready made and they just pour it. Have a quick drink and throw the peanut shells on the floor and get out fast. The rest of the arcade is deathly quiet. How do those shops exist ? It's a mystery to me how these places survive on their history, I felt I was in a time warp horror movie."
,,Sadly not quite as special as it was.,3.0,,Over the years the shops here seem to have been a bit downgraded and now there isnt really much here that you cant find elsewhere sadly.
,,A Must Do!!,5.0,,"We went here just specially to experience the Long Bar where you have a small hessian sack full of peanuts and you crack them open and throw the shells on the floor as is the tradition!
We also had a ""Singapore Sling"" just for the sake of it as this is where it was born,..only the one mind as they were Singapore $31 each!
Anyway now I can say been there ,done that and totally enjoyed it.
Mind your feet on the way out , can be slippery with all those shells!"
,,You Just 'Have' to try a Singapore Sling!!!,4.0,,"This is the iconic place to visit in Singapore, worlkd famous as the birthplace of the Singapore Sling!!! So we went to the long bar and ordered one! Great experience, which you pay over the odds for, but worth it for the ambiance!"
,,lovely hotel,5.0,,Enjoyed afternoon tea followed by a Singapore Sling in the Long Bar. If you are in Singapore this is a must do.
,,Quintessential Old World deluxe hotel,4.0,,"After sipping a Singapore Sling in the Long Bar upstairs, a friend & I walked around the Raffles Hotel arcade to check out the grounds, the courtyard and shops. It's a lovely grand Old World hotel with lush landscaping that appears to be maintained quite well. Due to it's historical significance, visiting the Raffles Hotel is usually on the top of a visitor's list of Things To See in Singapore."
,,A step back in time,5.0,,"The arcade allows access all around the historic Raffles Hotel as well as to all 3 floors. You can imagine what life was like in the days of empire. As might be expected, the shops are the expensive types. You can also stop off at the famous long bar or drop in to the courtyard."
,,What a disappointment !,3.0,,The old bar has been moved upstairs and definitely lacks atmosphere. Prices were steep 32 SD for an old fashioned Singapore Sling and 42 dollars for a glass of champagne. Nice to say we had visited but certainly not value for money.
,,Worth a visit,5.0,,Raffles was across the street from the Carlton hotel and therefore easy to get to. Cocktails are pricey but you need to try one and price foes not include the glass! Food looked good and reasonably priced.
,,Magnificent Charming Hotel,5.0,,"We had to visit this hotel during our 3 days visit to Singapore and sample the original home of the famous Singapore Sling. This did not disappoint and although it was nearly $100 for 2 cocktails, was worth it just to experience a little piece of history where so many famous Film Stars and Royalty have stayed in the past decades. It is very Art Deco and all of the walls have quotes and photographs of those that have stayed there! The courtyard rooms are still as they were when the hotel was constructed but obviously have been refurbished to standard and the fabulous Shopping Arcade at Raffles is like a walk back in time so quaint yet fabulous! Another great experience not to be missed when you visit this great City!"
,,Singapore Sling,5.0,,"Well had to do it, even though it is expensive S$36 the thing to do is throw the peanut shells on the floor allegedly! Anyway had to be done"
,,Popped into the Long Bar for a Singapore Sling,4.0,,Like most tourists when visiting Singapore a visit to Raffles for a Singapore Sling is a must. When we visited there were queues lined up waiting to get into the Long Bar. Wait was approx. 15 minutes as most ventured inside to have a sling and then leave. Cost of two Singapore Slings set us back $Sg 73 inclusive of taxes. The Long bar is the only place in Singapore where littering is permitted when the throwing of peanut shell on the floor is a long handled tradition
,,Colonial hotel at its best.,5.0,,"Called for afternoon tea. Beautiful variety of sandwiches and cakes served by uniformed waiters and waitresses. Very colonial. Expensive even by Singaporean standards
(£140 for two people) including a glass of champagne each but a must do if you travel to Singapore. The hotel is fabulous but with an addition of a gift shop can appear a bit touristy. Nevertheless an amazing hotel which I would love to return to."
,,A must do in Singapore....Singapore Sling perhaps?,5.0,,This is an iconic hotel with so much history and so much to see and learn about its history. You must have a Singapore Sling and spend time looking around and buying some souveniers from the gift shop
,,Long bar - Singapore Slings!,5.0,,Very quirky and has a high class feel to the location. Quite pricey however most places are in Singapore. Great Singapore Slings which is what the bar is famous for($31 each bar snacks between $25-$40 + 17% service charged added). Look out for the peanuts on the floor! :)
,,Beauty,5.0,,Today all we can make are tall buildings with weird shapes but this hotel is a true beauty to the eye. made in that age and time the such delicate detailing love every bit of it
,,Have to visit,5.0,,"This is lovely to wander around. You must have a Singapore Sling in the Long Bar. It's not cheap but it's all about the experience and you've done it! Also, the high tea is terrific. Once again not cheap, but the food is great and it's a great exeperience"
,,Raffles hotel arcade,5.0,,rAffles hotel is one of the best hotels in Singapore . ...it is very popular with the Britishers and famous personalities . They have made a nice shopping arcade with all the famous Brand’s and expensive items .
,,"Brunch at Raffles, singapore sling and peanut shells",5.0,,"Everybody seems to know about Raffles, an icon for British people for sure so we had to go. Residents valued the brunch which is exceptional - I doubt there is anything anybody would miss on that spread. Expensive for sure, if you include the champagne, cheaper with the wine and without both but still expensive as there's a limit to how much you can eat although just about everything is available. I loved the oysters, all 6 types of it, plus all the sea food, right down to lobster. Couldn't manage much of the rest! The building is iconic and lovely, the long bar, which apparently has changed it's original place twice if my memory serves me right, is really cute with all the peanut shells on the floor. Weird for Singapore, the fine city, with fines for everything! I wasn't impressed with the Singapore sling. Tried it once and never again - watery, sweet, not to my taste but we have gone back to the brunch and have another one booked for December. If you can manage to eat all they offer, then it's worth the money you pay for it - we never came close! Prices are high at the shop as well but Singapore isn't cheap although that brunch is the best I have ever come across - for a price. It is not a cold day activity as there are no cold days in Singapore, apart from the air con"
,,A touch of style,5.0,,"Innitially, when I felt the crunching of peanut shells under my shoes, I was shocked, then I observed other discarding them so casually. I was promptly advised that ""this is was you do here"". We were quickly seated and provided with a small hessian bag of peanuts, order our Singapore Slings and a variety of satay dishes... a couple of hours later, having enjoyed several cocktails and satays, we were on our way. I did take a little stroll around the main bar to enjoy the artworks hanging around the room and despite being roped off, I was invited by one of the staff to take a look up the gorgeous timber spiral staircase in the centre of the room to the bar above where the band was warming up for later that evening. This truly must be on your list of things to do for couples or adult friends when visiting Singapore - a stylish step back in time."
,,Vintage Singapore,4.0,,great atmosphere to see the Singapore of days past. Must try the Singapore Sling. The hotel's signature drink.
,,Raffles shop - rip off prices for rubbish gear,2.0,,"I bought some souvenir trinkets from the Raffles shop and noticed the following: they are massively overpriced, many of the items are exactly the same as when I last bought from there in 1992, the apron I bought for myself had a button that fell off 1st time I tried to use it - so appealing quality control. Well done Raffles management, you must be very proud of the way you charge top dollar for branded tat. What a reflection on your ideas of customer service. Avoid."
,,"Raffles, the brand",2.0,,"Raffles, from nearly closing at the end of the last century has become a brand. And boy do you pay for that brand. The Long Bar is wonderful; enjoy a Singapore Sling and throw peanut shells on the ground. But you pay 31 Singapore Dollars per Sling for the privilege, Go to the Raffles shop. The prices there are quite extraordinary. OK - you've got to have a Singapore Sling at Raffles - it's on your bucket list - but the shop? You've got to be joking."
,,great old building,4.0,,love walking around historic buildings such as this one.lots of shops and places for a drink or something to eat. ken
,,Slowly losing it's olde world charm with extensions.,4.0,,"Firstly let me say that I am lucky to have seen Raffles in the 1980's when the ""Long Bar"" was in its' original and famous location. Nowadays it is just a very upmarket bar with outrageous prices for a Singapore Sling, which I reluctantly paid AUD$75 for just one for myself and my partner; yes it was good, but ... Last time I was there I paid around $25 but got to keep the souvenir glass, now all I got to take away was an empty wallet :-) ... Still a great place to experience, the peanuts were copious and free and of course the Sarkie's Brothers experience of dining/drinking in an exclusive location, lives on; but oh those Sling prices???"
,,Memories of the past,5.0,,"A must place to visit when in Singapore and sample the delights of this historic building. High Tea is recommended but very expensive. Drinking Singapore Slings in the Long Bar as the rich and famous did in the past. Essential!
Monkey nuts to nibble and throw the shells on the floor."
,,Interesting Visit,4.0,,We stayed just a couple of blocks away so just had a stroll around here by ourselves. Beautifully restored. Lots of little expensive shops to see. The gift shop had some great gifts in and I did not think they were badly priced.
,,The home of the singapore sling.,4.0,,Nice place to walk around with a lot of history. Very high end shops and of cause the best Singapore sling in town.
,,Beautiful building,4.0,,"Went to Raffles as part of an evening tour. This is such an iconic place, with all it's past history. It's definitely for this rich and famous. Even the Singapore sling come complete with 10% and VAT !!!"
,,back to the past of yourSingapore!,4.0,,"as an nostalgic building lover, this place like an old friend met. charming atmosphere and many memoirs from the past may give you an exotic moment like a walking pass personal time machine!"
,,Epitomizes colonialism and elegance ...at a price !!!!,3.0,,"A must see while in Singapore , just for the facade alone. Great to explore too ,but very disappointing to find the bar where the Singapore sling was invented only to find it was extortionately expensive. Couldn't even afford a fridge magnet !!!!"
,,So much history but very expensive,4.0,,"we were told that we had to visit the Raffles Hotel and have a Singapore Sling. When we got there, it was quite lovely. The hotel itself was so historical and where you walked inside it, you saw the history on some billboards it had. Everything was quite expensive and I didn't buy any souvenirs, as they were expensive to other places, but we did have a Singapore Sling at the outdoor restaurant and it was very nice to have a historic drink. Tasted nice, but be weary it costed $28."
,,You have to pop in and experience it.,5.0,,"It was just as imagined, you can have a Singapore Sling alcoholic or non alcoholic or just eat the peanuts and throw the shells on the floor as was the custom. Pop in the shop depending on your budget you may just want a key-ring they call them Key-Chains."
,,A great place to experience a bygone age,5.0,,I really enjoyed walking around raffles arcade. You really do get a feeling of a bygone age definitely worth a visit.
,,Soaked in History,4.0,,This place is soaked in history the little shops are lovely as you walk through the lovely architecture. The shops are varied and makes for a nice stroll.
