id,uid,title,score,date,content
,,Go to enjoy the ambience and gradeur of Singapore's Old Lady.,3.0,,"Now this is one of those situations on Trip Advisor where many people post a review in the wrong place so I'm not going to do that but hopefully my review may prevent it happening in the future...

So here on Trip Advisor you will find listings for both the ""Raffles Hotel Arcade"", that is this listing, and then there is the ""Long Bar"" which is a separate listing so it bugs me as to why people post about the Long Bar and their drinking experience here on a listing for a Shopping Arcade!?! I will review the 'Arcade' here and the 'Long Bar' where it should ne reviewed... Anyway off my soap box and on with my reviews!!

This being my Third visit to Singapore I thought it about time to pay the famous 'Raffles Hotel' a visit. I entered by the front of the Hotel as I wanted to see the famous exotically dressed Sikh doormen (See photo), the doorman I met had been at Raffles for 25 years! I then walked the labyrinth of tropical courtyards and verandas taking in some of the Arcade Shops which were all high class and high cost affairs and many were closed but it was a Sunday. As I am not a shopper to me just being in this iconic 'Old Lady' of Singapore was floating my boat... Walking along the same passageways as some of its old day celebrity guests such as Rudyard Kipling, Somerset Maugham, Charlie Chaplin, Noel Coward and Elizabeth Taylor. The only shop I did spend some time in was the Hotel Gift Shop... No purchases made though as it was all over priced as you'd expect. Visit and enjoy the hotel ambience, the gardens and the grandeur."
,,Afternoon tea !!,5.0,,"We decided to visit Raffles as it's an iconic institution and although expensive for tea, it's much more than tea, it's an experience not to be missed if you have time when in Singapore"
,,A long time dream,5.0,,Visited the famous Long Bar and enjoyed a Singapore Sling. Although it wasn't cheap it was something I've wanted to do for a long time & I wasn't disappointed. We threw are peanut shells on the floor & laughed with other customers and listened to a live band playing. Would have liked to stay longer. Loved it!
,,Raffles Hotel,5.0,,A taste of old Colonial Singapore with a Singapore sling in the long bar Walking on peanut shells and adding to them as we sipped our drinks
,,Old Lady of Singapore,4.0,,"The Raffles Hotel is probably the oldest Hotel in town and you can feel the old times inside the arcade. It is really beautiful and you should at least try a singapore sling inside the arcade. We didn't because it was very very expensive, but also if you ain't got Money, a look inside the arcade costs nothing."
,,Brilliant,5.0,,"What a lovely experience,we visited the famous Long Bar and had a lovely evening although a little costly,well worth an evening visit.The staff are excellent and the atmosphere relaxed."
,,Colonial old world charm for a price amidst high rise bustle,4.0,,"The hotel is preserved in its glorious past, once right near the sea, now further inland due to land reclamation. A stroll through the corridors gleaming with golden light, passing by diners in the softly lit dining room will have you heading back in time, ready for a Singapore Sling in the garden courtyard. The drink itself is pretty sickly and sweet but a chilled gin and tonic and daquari for my friend accompanied by cocktail nibbles over Chinese New Year allowed us to pretend we were living in a more gracious slow paced time in this city of high rises and bustling traffic. Service is discreet and though pricey, it delivers on old world charm"
,,Bucket list,4.0,,"When visiting Singapore, how could you not call into the world renowned Raffles for a Singapore Sling?!! Always difficult to stop at one - so why bother - after another all your cares begin to fade away! - Bit pricey, but hey, once in a lifetime you have to follow the crowd!!"
,,High Tea,4.0,,"WE very much enjoyed our High Tea, not the cheapest but did also have a Dim Sum buffet included. The hotel itself is an experience & the concierge very helpful even though we weren't actually staying there, we wish !!"
,,Leche vitrine,5.0,,"Gorgeous shops, adjacencies and brand mix. If it's good enough for Madonna and the Queen it's good enough me. Great for buying in privacy. If you are looking for a place to be seen, it won't work here."
,,A MUST,5.0,,No visit to Singapore would be complete without a visit to the Long Bar and a Singapore Sling at the Raffles Hotel. It is a tradition to shell the peanuts and drop the husks on the floor. It is advisable to book a table although it is possible to get one if you arrive on spec. The hotel is a through back to the past glories. See for yourself.
,,When in Singapore,4.0,,Raffles i suppose is a name most assossiated with Singapore no visit is complete without a visit to the long bar for a singapore sling it is touristy but a must visit
,,Historic Icon,5.0,,"Like many, we weren't staying at Raffles, but instead came to look at an Asian icon and historic building. We we'rent disappointed.
From the outside the clean white exterior and orange, clay tiles, surrounded by tropical trees is an oasis in the high-rise Singaporean CBD. Walking around (outside) the building and exploring the many courtyards and balconies is a delight. From the Indian-dressed concierge, queues for 'high-tea' and small numbers of elite label shops... Raffles oozes affluence for a different time in history, particularly since the Singaporean skyline is now dominated by modern glass and concrete towers.
There seemed to be no general access into Raffles, but daresay you could access some of the many different bars and restaurants inside. Meanwhile the $14 price tag for a beer in the Courtyard bar would ensure a fitting experience opportunity to people watch while relaxing in this unique setting.
Very accessible by the MRT system, and not far from shopping malls or Boat Quay and Clarke Quay. The Hop On, Hop Off bus stops here too."
,,Not as expensive as you would think.,4.0,,"Our second visit here and it is still value for money. OK, you pay for the name but that is expected. The hotel is now a major tourist attraction and you can see it is geared towards this but still a beautiful place to visit. The world famous Singapore Sling is delicious!"
,,It had to be done,4.0,,"We felt we had to visit the origin of the Singapore Sling. The Long bar was still kept in Colonial style with wicker fans from the ceiling moving the air conditioned air around. The monkey nuts are free and plentyful. Shells should be cast to the ground in traditional style. The Singapore sling was $28! but was nice. I asked if I could have the glass as a souvenier, but was told that they used to give the glass, but it is now available in their shop to buy (of course) - which was not open at night!! think they have missed a trick here, also, I think the high price included the glass originally, but has not been reduced - . Mass produced by one guy behind the bar in view. The beer was surprising, it was $20 !!! way overpriced. There was food to be had but was very expensive I feel.We enjoyed the visit to be able to say we had done it, but would not go back."
,,Good Shopping but not cheap!,4.0,,"Lots of shops to explore! Always find the food courts! These are so much cheaper and generally as good if not better than some restaurants!

We tried the Raffles Bar, where they serve you monkey nuts with your cocktails and you can just throw the shells on the floor! The music played was pretty good too! We had some bar food and enjoyed these too! They were fairly pricey but tasted good!"
,,A bit of a disappointment,3.0,,Only hotel guests are allowed in the lobby so we could only visit the Long Bar. The bar was decorated in the old colonial style. Wooden bowls of peanuts in their shells were put out on the tables and it was the tradition to throw the shells on the floor. We were served with the traditional Singapore Sling which I found unimpressive compared with the cost. There was an entertaining group of musicians with a good female singer in the bar.
,,When in Singapore.......,4.0,,"No trip to Singapore can be complete without doing the typically tourist stop-off at Raffles. Well, being typical tourists we duly stopped-off and enjoyed the obligatory Singapore Sling in the Long Bar. Quite expensive, not surprisingly, but was actually very nice...... A wander round the whole Raffles complex was a very pleasant experience, well worth a visit."
,,Very expensive and touristy but fun,4.0,,"Singapore slings might be better and definately are cheaper elsewhere but the atmosphere is wonderful. The hotel gardens are lovely with old colonial style. Since the drinks are outrageously expensive, the hotel could keep the bottles in a fridge to make them cool at least."
,,One off the bucket list...,5.0,,"I always wanted to have a Singapore sling at raffles and got my wish in November!

Yes it's expensive and yes its a tourist spot but its iconic and I'm glad we did it.

The hotel itself is a lovely ""old world"" building and I really enjoyed the experience!"
,,Doing the obvious,4.0,,Really impressive place expensive shops but interesting. Did the obvious tourist activity in the long bar.
,,Sling-Ho,4.0,,"Old worldly feel with the brown solid wood stairways, whitewashed walls & palm leaf shaped cane ceiling fans. A little more expensive than anticipated but the food was lovely & the slings were delicious."
,,Tourist Trap.,4.0,,"I will start by saying the Raffles Hotel complex is a wonderful, iconic building in Singapore. You can wander around the wide verandas and reminisce about days gone by. Many high end shops in and around the hotel, catering for the clientèle that would stay here. But, all the tourist want to go to the Long Bar at the hotel, and that is where the trap is. Apart from it always being crowded, the prices of drinks are a little steep, even for Singapore. The ""iconic"" Singapore Sling is what everyone wants to sample, but at $35 a glass, it really isn't worth it. Especially seeing that they are made in a mass produced way, 12 - 15 at a time, sort of takes away the mystery of it all. If you do go, expect to part with at least $100, but if it is one of the places that are a ""must do"" then you will enjoy the experience. Easy to get to via the fantastic MRT train system that they have in Singapore."
,,Expensive,3.0,,"Visiting Raffles Hotel Arcade is just for the rich. Good for browsing. And if you decide to have a Singapore Sling at the Long Bar, be prepared to pay $68.25 for 2!! I find that extremely expensive and should have checked before ordering. Service was good though, as was the Sling!"
,,"superb afternoon tea, with harp accompaniment",5.0,,"Superb afternoon tea in gorgeous surroundings. A very elegant room, very professional staff, tasty food choices, lashings of tea and coffee."
,,Dissapointing,3.0,,"I was really looking forward to seeing the renowned Raffles Hotel but was bit disappointed when i seen it. Its a lovely hotel and obviously done in colonial style but compared to the Fullerton and Marina Bay Sands hotel it looked average.

You cant get into the hotel unless your a guest. We had a wander around the arcade which is full of pretentious shops. We had pics taken at the front of the hotel and its an icon of Singapore so worth a visit and doesn't cost anything."
,,Nothing special,3.0,,Raffles is a beautiful Hotel but the arcade shops are only average and not selling much you would want or need. The only thing I liked was the Raffles souvenir shop selling very expensive merchandise that must be in the Hotel itself. I bought some Breakfast tea bags but the rest is very expensive.
,,Fairly average,3.0,,"You really have to visit the Raffles Hotel whilst in Singapore, but the arcade is really nothing special. Be warned that you'll be in for some fairly serious gouging if you decide to have a drink in the Long Bar, but it's one of those things you really have to do whilst in Singapore."
,,Tired and worn venue,3.0,,A must see but be prepared for a hefty bill at the end. Nothing spectacular and peanut shells all over the floor and about 28$ for a glass of wine
,,If you want a sling you better be patient,1.0,,"Stopped in the bar for a Singapore Sling (you have to don't you). Were shown to a table by a waiter, given a menu and waited. Despite all our efforts to get somebody to take our order ... no takers. After 20 mins worked out why they are called Waiters and left. Can see why the Raffles hotel USEd to be the place to stay ... No longer!!"
,,"Well, you have to, don't you?",4.0,,"Stopped off at the long bar at Raffles after a business meeting (only one stop on the East-West MTR from Raffles Place).

After walking around the block (guests only at the Beach Road front door) I found my way in to the courtyard. Service was a might slow, but I wasn't in a particular rush. Most people there seemed to be curious visitors like myself, with a few seemingly more local.

A minor detail, but I hope the toilets were in a better state when Raffles was around.

I don't think I would dash back, but it was good to say I had been and seen."
,,Sadly greatly over rated,3.0,,"There is some wonderful romantic ambiance to be sucked in here, however the iconic Singapore Sling is horribly expensive, often poured from a vat and not really as special as you'd hope. This is an utter tourist trap, some people might claim that you haven't been to Singapore until you've had a sling in Raffles. I'd disagree, there are much better places to go and spend your money in this wonderful country but that's just my opinion!"
,,What at evening....,5.0,,"Raffles Hotel lovely and elegant place...pick up a couple of souvenirs in the gift shop...if you close your eyes, imagine a time gone by...at a slow elegant pace....
The Long bar is atmospheric, whilst sitting at the bar watching the bar attendants whiz around, tip go early, as around dinner time, it's full and you have to wait, we went before the fashionable cocktail hour. Alfred is one the bar attendants, we felt very special sitting chatting with him whilst he was whiz zing around making the "" famous singapore slings"" and anything else on the cocktail list.
Highly recommend a must see.
But, do not take trishaw from Raffles Hotel....we paid $78sng for a 15 min ride to Bugis street markets...even when I ask the price first... Don't feel sorry for little old men...sucker born every minute.. I just had mine..."
,,Expensive but Iconic 'must-do',4.0,,"Yes the Singapore Slings are expensive, but as long as you go in expecting this, you are more likely to enjoy yourself. We still had a lovely time moseying around, taking in the colonial romance of Raffles, then enjoying our iconic Singapore Sling and throwing peanut shells on the ground. Glad we stopped in, despite the crazy bar bill."
,,Don't be fooled,3.0,,"Although the outside displays the colonial times well, inside it has become a building filled with shops and art galleries that don't resemble the glorious past of the building. Only a small part of the immense monument is still used as a hotel.
At the Long Bar one can drink an overpriced Singapore Sling. Moreover there is a massive queue outside the bar."
,,Pricey but has to be on to-do list.,4.0,,"Raffles hotel and arcade is a lovely old building. For most (like me) I suspect it's a must see (rather than pay to stay) and tick off the list. They definitely trade off the name. Having said that it was great to pop in, have a look around and have a Singapore sling. Actually a refreshing break from the heat."
,,Colonial memory,5.0,,"If you are a little into the colonial past, than you will rnjoy that building. You can walk a little around and have the feeling you are back in time....Once hungry from walking, around the corner is the longest bar & steakhouse..."
,,Come here if you enjoy throwing your money away,1.0,,"I have reviewed the appalling tourist trap that is the Long Bar separately. Is it really worth $28 for a single drink and disgraceful service to throw a couple of peanuts on the floor. Personally, I didn't think so. This semi-indoor/outdoor arcade is attached to the side of the hotel. Do not try to enter the hotel lobby if you are not a guest. There is security and they do not want you in there to have a look unless you've paid your $600-800 a night. The surrounding arcade is pleasant enough to walk through. It contains tailors, art galleries, antiques and luxury labels like Tiffany's and Louis Vuitton. There is a Raffles Boutique Store if you want to throw your money at overpriced souvenirs. This place completely trades on its name and history. There are so many choices in Singapore that do things better than this place for food, drink and shopping now. We went here because we were drawn in by the historic association but will now always associate this place as one of the worst things we did in Singapore."
,,Visit to the Raffles Hotel complex,5.0,,"We did the touristy Singapore Sling drink in the Long Bar in Raffles a Hotel at £16 a go. This will be just once in a lifetime at this price ,however you have as many peanuts as you like and you must throw the shells on the floor. We also visited the Raffles shopping arcade, which was a bit pricey but we bought a few fridge magnets and posted cards ."
,,Visitors are welcome too,4.0,,"Raffles is synonymous with Singapore, and rightly so. It's an institution that has maintained impeccably high standards for years. This is just to note that even if you're not a guest in the hotel it's still possible to visit the original building on Beach Road and walk around some of the well-manicured grounds. From the front of the building go around the left hand side and you'll discover a selection of shops selling what could well be the highest quality souvenirs of Singapore you'll ever find. Lots of lovely things to look at and purchase, including some branded 'Raffles' which will be conversation-starters when you get home. When we were there one morning there was a high tea going on in the dining room so we couldn't call in for a cuppa, but it looked like those inside were being catered for royally. Maybe next time."
,,You want how much for a Singapore Sling!!,2.0,,"$50SG for a real Singapore Sling and a kids one. A bit too pricey for the chance to have one.

And there isn't much in one either, a gulp and a bit and it's all gone.

Recommend make one yourself and have as many as you want at your own leisure. We did when we got home to Australia and still do."
,,Afternoon the time,5.0,,"Exceptionel afternoon The arrangement, service in absolutly in top. The whole atmosphere in this historical place should be experienced. Do not forget to visit Raffles when in Singapore."
,,You have to do it!,4.0,,"Yes, it cliché, but of course we went to Raffles and drank a Singapore Sling! We probably wouldn’t have made the special effort but we’d used the “Hop on Hop off” tourist bus and there was a stop right outside Raffles. We nipped in to cool down and nibble on the peanuts, and we were surprised by the lovely decor- still in a colonial style- and lovely gardens. It was a very pleasant way to spend an hour or two (nursing a £13.50 cocktail!) and people watching."
,,Required destination,4.0,,"Obviously you have to visit the Long Bar for the obligatory Singapore Sling. Interesting hotel with colonial atmosphere. Quite commercial now, but, worth the visit."
,,Best high tea ever,4.0,,"We booked high tea from our hotel and we were not disappointed. It was great to get dressed up for a change and be waited on.

We were in a group of six and the staff replenished the sandwiches plate several times without asking for it. A nice surprise.

A little expensive at $68, however well worth it."
,,wonderful,5.0,,shops here are exquisite the hotel amazing wonderful piece of architecture great history a real wonder experience must have a Singapore sling in the famous raffles bar
,,Shops and rides,5.0,,"Outside Raffles there is a parade of shops ..... All high end goods. It fun to window shop. If you are lucky you will see Oliver and his rickshaw ...... Let him take you for a spin around the city, it,s worth it just for the banter and terrible jokes. He is lovely and makes the ride really enjoyable."
,,Historical Building/Hotel,5.0,,"Again, this is a must do experience for walking around and have a drink in the courtyard bar - before going upstairs to the 'Long Bar' for another drink and peanuts! Great photo's can be taken."
,,Only if you're in the vicinity or going to Shinji,4.0,,"It's not a mall per se, but a smattering of shops in the raffles hotel. There are some interesting ones, like some art galleries and a Molton brown store, but apart from those, nothing better than what you can find on orchard road

The only outstanding part of the arcade is the best Japanese/sushi restaurant in the country, Shinji. You have to eat it to to believe it"
,,Worth a visit,4.0,,"Beautiful hotel, certainly showed how it was years ago. However, if you want high tea or a drink, you need deep pockets. Close to S$30 for any alcholic drink!"
,,Old World Beauty,4.0,,"While in Singapore for a few days my sister and I decided to check out this beautiful old hotel where so many famous movie stars had stayed so long ago.
Raffles has kept it's style and beauty and I think still looks as grand today as it was so many years ago.
I must say tho that I gasped when told the price of a Gin Sling, and when I opted for a Coke instead, still went cross eyed when told around $20. All in all a lovely place to visit and felt sad when having to leave to catch the last M R T of the night to return to our more down market hotel to sleep.

went crossed at the price"
,,unacceptable site and service,1.0,,"Difficult to navigate the less-than-glitzy arcade and property. Did not find any of the glory of yesteryear that we expected. We booked a tea with a tour group, but after getting separated from our group (taking a picture) an officious doorman barred us from the lobby, and wouldn't listen to our request to rejoin the group. Looked in at the long bar - nothing special. Expected a superb shopping arcade - not. Dark, many spaces closed, no great windows - and understandably few window-shopping patrons. Definitely not fun. The Stamford next door is joined to a fun arcade with excellent food court. Give Raffles a miss."
,,faded glory - disappointing site and service,1.0,,"Not the experience we expected, actually a bit ratty in appearance. Snobby doorman would not allow us to enter when we'd gotten separated from our tour - which meant we did not get seated for the much touted tea event we'd paid for. Explanations had no effect on officious personnel. Indoor and outdoor bar areas, again much touted, were unexciting, hard to access. The so-called shopping arcade is a joke. Many stores vacant or closed; again hard to access. Nothing like the glitz of the Peninsula in Hong Kong. Big time, money and experience loss; we have yet to get a refund for the tea."
,,"Raffles hotel - do it once and move on, unless you have $$$",4.0,,"I was on my way back from a business trip and had 48hrs in Singapore, so made it to Raffles for High Tea. I was not made to feel odd for being their solo, and was kindly provided with a copy of Tatler to read.

As it was a once off champers was in order, and very nice it was if a little expensive by the glass for UK standards, but not too bad by Singapore pricing.

The staff were lovely, the food delicious and I left very full, in a happy frame of mind"
,,"""Pricey'..But a must see",5.0,,"Take your time to stroll around and soak up some history & a visit to a wonderful venue. After a while you just have to experience the original ""Singapore Sling"" & peanuts, or if not into the ""Sling"" enjoy one of their many Beers or refreshing juice........our group of 17 certainly had a wonderful couple of hours just soaking up the atmosphere..."
,,A bit of history - worth the visit,4.0,,Used the Hop On Hop Off bus to get there which was really easy. Had the obligatory Singapore Sling and peanuts which were pretty expensive. It is worth looking around the building and getting a feel of times gone past.
,,Raffles Hotel,5.0,,"Great place to visit, loved it had the peanuts on the floor and drinks, would love to go back very soon."
,,expensive,2.0,,"Although having visited Singapore before never bothered with the Raffles thing, I decided to take it in as I belive you should just to experience where the Sling originated but after my wife and I had a Sling each followed by a sml beer and a gin was presented with a A$100 bill so I understand why I had not previously bothered, building is gorgeous but that's where it stops."
,,Historic,4.0,,We have been there on other occasions and have brought some items. Be aware that shopping here can be very expensive but costs nothing to look. It is a very marvelous building and when in Singapore it's worth the visit. Very handy location to most of the attractions in Singapore
,,Great if you are staying there,4.0,,Shops are quaint but expensive. Nice gift shop which means more if you are actually staying at the hotel.
