id,uid,title,score,date,content
,,Excellent and beautiful trail,5.0,,"I started the trail at Kensington Ridge SMRT station. Via Singapore Science Park I entered Kent Ridge Park which has the canopy walk as its main attraction. The next adjacent park is Hort Park with its beautiful little gardens. The uniquely shaped Alexandra Arch pedestrian bridge connects Hort Park with Telok Blangah Hill Park. The latter park is crossed via amazing elevated skywalks until the amazing Henderson Waves pedestrian bridge. The trail is continued via Mount Faber Park, Faber Peak and then via the Marang trail ending at Harbourfront SMRT station. Total length is ca 7 km and provides awesome far views of the city, harbour, Sentosa island, unique design bridges and beautiful nature. Highly recommended!"
,,Close to Nature,4.0,,Enjoy the greenery and the connecting bridges. 3 parks are connected to each other.one of the best spot to enjoy the panoramic view of the city
,,Beautiful !,5.0,,"This is a great place to escape to if the city has got too much – it’s wonderfully relaxing and it’s hard to believe you’re still so close to the city. As with everything in Singapore, it’s clean and well maintained – but it gets extremely hot, so make sure you wear loose/light clothes!"
,,A nice walk near to the city,3.0,,"The Southern Ridge is a relatively easy walk. It is a nice experience if you want to mix in a bit of nature during your holiday. It was a nice experience with the mixture of trails, bridges and walkways (treetop walk). There wasn't a wow factor for me, but I enjoyed the peace and quiet.

Start near Harbourfront MRT Station, this is the easiest walk as you start with a 10 minute climb and the rest is either level or descending. There are plenty of places to stop along the way. I recommend you do this early though as it starts to get pretty hot in the afternoon.

Completed in 2 hours at a slow pace."
,,Beautiful,5.0,,Very pretty. A nyc experience to walk among the tree tops . It’s just a walk among the trees but very enjoyable. Not to mention it’s free . It’s was a better experience than little India and China town . It was different and beautiful
,,Great outdoor activity,5.0,,"Facing the exit of the MRT station is the beginning of this wonderful trail. One has to be mindful that the first 15 minutes of the walk is the equivalent of walking up 24 storeys to reach to the top. There is also a cable car ride in place of the semi energetic start of the trail. The whole trail is well signposted. Rest rooms and cold drinks vending machines are strategically located. The look and sound of nature is obvious as one walk, jog or run along the trail. The Henderson Wave and Hilltop walks were interesting."
,,An amazing walk!,5.0,,"My partner and I recently walked the Southern Ridges from Hort Park to Harbourfront and loved every minute! Most of the guidebooks recommend walking the route from Harbourfront (which is harder as it’s steeper!) but we loved that when we finished the walk at Harbourfront we could continue walking around Marina Bay (where Harbourfront is the closest MRT). The scenery along the walk is fabulous - green, lush ‘bush’ with the occasional skyscraper in the background! Whilst we loved being in the city during our stay it was great to get out into nature... we highly recommend this walk to all (ages and fitness levels - it’s pretty easy, apart from the heat!!)."
,,A true Singapore experience - but come prepared for the weather,5.0,,"The Southern Ridges walk is an excellent Singapore experience, offering some special moments, as well as being a great way to get some exercise. All up the track is about 10 km in length, starting from the Harbour Front MRT station and ending at the Kent Ridge station, although there are one or two spots along the way you can bail out if you so desire. Our highlights were the superb views from Mt Faber, the wonderful forest trail through the rainforest canopy and Henderson Waves bridge, seeming to tower (36 m) over the busy highway below. Hort Park was also interesting, and proved very useful place to shelter from the torrential downpour we encountered. Of course, Singapore is hot and humid so don some sunscreen, wear a hat and bring an umbrella - we had a couple of drenching downpours with not much shelter nearby. Bring water too, though there are a few drinking water fountains (as well as public toilets) along the way, as well as drink vending machines. Despite all the signs about wild monkeys along the trail (and not to feed them etc) we were a bit disappointed we didn't see any."
,,"Best place for runner, nature lover and photographer",5.0,,"My favorite for morning running and jogging! Love the nature, cleanness, and runner friendly! Start stairs climbing from Mt. Faber, Henderson Waves, and Forrest Walk. Continue to Labrador Park when still have energy.

Transportation: Taxi, MRT : Harbour Front (Mt. faber), Labrador Park, or Public Bus.

Come early around 6-7 am to see sun rise from Henderson Waves.

During weekend, would be more crowded with runners but will motivate you to run further.

Bring water, hat, and use proper running shoes. Toilet and water could be found at Mt. Faber. Make sure your stamina is good."
,,Get away from the crowds!,5.0,,"When you need a break from the hype of Sentosa or the bustle of Chinatown , definitely give this walking track a try. Get off the MRT at Habour Front and take the underpass to come up at Marang Trail. There are a whole heap of stairs ahead but getting them out of the way early is best and then the rest of the trail is mostly downhill. The track is very well maintained - you could do this in stilettos if ankles could cope! Taking water is a must, although there are vending machines at various points that sell bottled water and other snacks. I did Marang Trail to Mount Faber, the Henderson Wave to Alexandra Rd and stopped and started to take in the views and photos over about a 2.5 period which was a leisurely pace. Definitely worth doing early as I looked like I'd been thrown in the bay by the end (which was then good excuse to come back to my accom for a swim and a Singapore Sling). There were further trails to explore but I know my limits.

From Alexandra Rd, I walked another 15 minutes back to the MRT, but there are also plenty of buses on this route if you've had enough sweating for one day.

Fair warning...although the track was fairly quiet and I was happy to gently nod good morning to the few passers by, it was mid week. There were still lots of buses taking big crowds of tourists to the top of Mount Faber, so this bit was a little overwhelming if you're trying to avoid the hoards."
,,Great way to be close to nature,5.0,,Very well planned walkways make you feel you are in a forest and away from the hustle bustle of the city. We had a walk right up to Mount Faber and it was very refreshing!
,,Forest forreals,5.0,,Really great place if you’re a nature lover! You can bring your boyfriend/girlfriend along although I don’t have one!
,,Nice hiking trail!,5.0,,you will be surprised there is a beautiful hiking trail in the dense Singapore. I saw a lot of wild life on this trip. Be sure to bring some bug spray with you and try to do the hike in the morning. It does get hot up there.
,,worth a visit,4.0,,"I started the trail from the harbour front MRT station, and went through the various landmarks.
The Alkaff mansion was impressive, Henderson wave and the Alexandra arches were interesting.
The entire trail was well marked out and easy to follow, except the last part which was queerly named the canopy walk, when there was hardly any canopy. The sign for the canopy walk was also not clear at some points. Several hikers including us had to hunt for it."
,,Great Walk,5.0,,"We recently spent a few days in Singapore and we did some of The Southern Ridges walk. You can enter and exit out of the 10 klm walking tracks at different point, we finished up at the gondola so we could catch it down to Sentosa Island. Would highly recommend doing this and would suggest morning before it gets too hot."
,,Tired but rewarding walk,4.0,,"Shame to say that as a Singaporean, I didn't try walking this till the event organized by CCF. It could be a little tiring for those who are not use to long walk. But it's definitely a very good and rewarding experience worth going at least once."
,,View was worth the hike,4.0,,"View was spectacular at the top! But i must say, the hike upwards from Habourfront MRT exit at Marang Trail was pretty tiring, but once you get to the top is all worth it. You’ll be able to get a bird’s eye view of many buildings at the top and even hop on a cable car at Mount Faber Peak, before walking towards Henderson Wave, and eventually making your way to the elevated pathway which can actually lead to hortpark. It’s definitely a great way to exercise and catch up with your friends!"
,,Nice place to have a long walk enjoying nature and singapore,5.0,,"Ideal place to start your day if you love walking or jogging. My advice is to start from Marang trail near harbor front as it better and less strenuous as you go towards the end point. it may take about 2-3 hours. Carry water, as you are in the sun for quite some time but the nature and sky line of singapore is worth seeing."
,,Great hike,4.0,,"We started all the way up, and walked our way to the city crossing three parks. Good escape from the busy city."
,,The canopy walk is amazing,5.0,,"We took the MRT to Harbourfront and walked out Exit D and found the road up to Mt Faber. The first 15 - 20 mins are up steps and uphill but after that it is either fairly flat or slightly downhill so make sure you go this way and not the reverse.
The Henderson Waves bridge is an interesting design. The Canopy walk in particular is amazing. I think it is at least 2km long. We saw Scarlet-backed Flowerpecker birds along with a number of other interesting birds. A lot of the walk is in shade of the trees but it is still hot so bring water. We exited down to Hort Park and then took a bus back. The next time we go to Singapore (and there will be a next time!), we will continue on the rest of the route. The walk we did took around 2 hours but we stopped lots of times to look at birds, bees, flowers and trees. As it was mid morning, mid week, there were very few other people on the walk."
,,Lovely walk,4.0,,"Lovely walk but very busy, we went at the weekend so maybe that is why there was not a huge variety of bird life. Pleasant walk though."
,,Breath-taking!,4.0,,"It was a very nice experience to be walking around. Away from the bustling city. With the sweltering heat, be sure to bring drinks and a towel."
,,A pleasant walk but you don't really escape the city,4.0,,"This is a really nice area to go for a walk; Kent ridge park is quiet and relaxing, Mount Faber offers some lovely views and the treetop walk is a different experience to what you would get elsewhere in Singapore.
The main disappointment is that there is never an illusion that you are out of the city; the walk is quite busy (especially Henderson waves) and the city is always in view."
,,The treetop walkway is too short.,3.0,,"This is well known to provide a tree top view around the area, but the bridge is too short and it is always crowded with people taking selfie. It is a little disappointing after walking all the way to reach there and you only get to spend less than 5 mins there. After we waited for the people in front of us finished their photo taking, the security is always telling us to move along. It is quite disappointing that we need to move on before we really take in and enjoy the view."
,,Hidden Gem,5.0,,Really enjoyed our afternoon walk through this walking trail. Elevated above and in the treetops and had some great views.
,,Relaxing,4.0,,"A piece of green heaven in the center of just Singapore, and definitely a better walk compared to the usually very crowded East Coast Park. I started walking from Kent Ridge Park and it was indeed a nice, and peaceful one. You can get to experience the secondary forests of Singapore and know a bit more about the WW II history of Singapore."
,,A delightful 10 km walk!,4.0,,"We climbed up a hill from the carpark opposite Vivocity, next to a food centre. We walked by a shady forest with many seeds on the ground. We passed by the Mount Faber Cable car station and ticketing office, and continued walking toward Telok Blangah Hill. Henderson Wave was amazing! It curved around tree tops and soared above roads. We continued up steel treetop bridges, and crossed over to the Hort Park. From there we proceeded to Kent Ridge Park, and enjoyed walking through the forest. Highly recommended for the views - a good way to appreciate nature."
,,Walk on the wild side!,5.0,,"If you want to escape downtown Singapore in favour of nature for a few hours then head to the Southern Ridges, a fabulous linear park running parallel to the ocean along the hills to the south of Singapore. There are beautiful gardens, treetop walks, wildlife and fantastic views!"
,,Wonderful views,5.0,,"An exhilarating walk from Vivocity mrt to Hort Park! You need to climb some rather steep stairs to get on the trail to Mt Faber Park but that's only about 10 minutes uphill for a reasonably fit person and you can always stop to catch your breath, there are railings to cling on to if you're elderly. Enjoy the leaf-litter communities at both sides as you go up. You're rewarded with a wonderful view of Sentosa and the cable cars once you reach the top of the stairs with the boat-like structure. A kind of Singapore hanam is visible on the treetops but I stead of cherry blossom you have local flowers. The vegetation is lush with colorful flowers, even bamboo and angsana in their pods as you walk on the sturdy steel path at the same height as the treetops. Looking down into the valley as you exit Henderson, you see banana trees and plenty of foliage. Colourful boards provide useful botanical information and pictures of birds you can spot if you're lucky. We saw one monkey, boldly resting against the rail and scratching his vitals but it was well-behaved and didn't attempt to snatch anything but we kept our distance, obeying the warnings posted everywhere.
A wonderful two hours well-spent. We appreciated the clean public toilet halfway but refilled our water bottles only when we got to Hort Park where there's a water fountain.
From Hort Park we took a bus, 61 if I recall correctly to Queensway and then to the Food Village, a large hawker centre where we dug into the prawn and pork rib noodles! IKEA is nearby so you may want to drop by for their soya ice-cream and coffee, both at 50 cents!"
,,Tropical jungle within sight of soaring skyscrapers,4.0,,"This will get you out of the shopping centres and the high-rises of the CBD. Walk as many sections as you wish but be sure to go through the greenhouses and gardens of Hort Park and then on to the treetop level of the Forest Walk. What makes this really fascinating is that you are walking at tree height through jungle but always with glimpses of Singapore's myriad of high buildings, both commercial and residential. If you descend after crossing the Henderson Waves bridge you can easily catch a bus on the road below that will have you back in the Colonial District and the River within 15 minutes or so. Take water as it can be pretty hot in the forest."
,,What a wonderful place to go for a walk,5.0,,"We went here in the early morning and spent a couple of hours walking the trails. I believe we could easily have spent another hour or more exploring. The trails and nice with nice views along the way. There are also a number of great things to see along the way like the little gardens, etc. We had a great time and really enjoyed it. There are no entry fees and the paths are very nice and well maintained. My only wish is that we had a bit more time to explore the area. Very peaceful and pretty. We started off at Kent Ridge Park and walked through to Henderson waves. The paths were very easy to walk and probably good for anyone with reasonable mobility (i.e. do not need to be in great shape to walk this one)"
,,Lovely walk!,4.0,,"We spent a few hours towards the middle of the day after it had finished raining. We started from Habor Front MRT and began walking a large amount of stairs. It didn't take long, the trail is well maintained and easy. Next we headed towards My Faber which was filled with 2 large tourist buses. We quickly continued walking along to wander Henderson Waves which wasn't too busy and walked through following signs to the tree top/earth walk. We ended at Hort Park as we were short on time but hope to do the whole thing next time with a run involved (we were doing some shopping in Vivo City first to avoid the rain. On the way to Hort Park we spotted a paradise tree snake which was pretty cool! The paths can be confusing on first look, but any direction you go leads back so just keep that in mind if it is your first time!"
,,Great place,5.0,,We went here for a Sunday morning walk. It is lovely. You forget you are in a big city when you walk here. You are surrounded by nature. There are lots of people out walking and exercising. What a great place. Wish I lived next to it. I would go everyday.
,,Unexpected Pleasure,5.0,,"What a fantastic place to visit. There are four parks that all connect. Mount Faber Park and Telok Blangah Hill Park, two of the four nature parks along The Southern Ridges. There are also HortPark and Kent Ridge Park along the ridges. Each offering a different nature experience. My favorite was the Forest walk in Telok Blangah Hill Park. It has elevated walkways through the forest. If you like unusual architecture, the Alexandra Bridge, at the end of Telok park, is really unique. There are also the Henderson Waves, just down from the cable car trails at Mount Faber Park."
,,Walk atop a forest!,4.0,,"A nice brisk walk above the trees via winding walkways suspended above the trees. Pleasant walk in the early morning, but gets progressively hot and humid in the later morning and afternoon. But if you are there for the exercise and sightseeing, how fast ro slow you cover the ridges depends on your walking speed and time to slow down to take in the scenery! Part of a series of connected parks in the garden city."
,,Superb trail,5.0,,"Easy walking, great views and feel of tropical rain-forest in city center. Not so much as animals, but it was OK as we so many animals in wild Central Water Catchment trails. To cover all track will take 1-2 hours max"
,,Great green space,4.0,,"Great space to get away into some nature. Directions are a bit obscure at times, & we had maintenance work to contend with (we were unable to go into certain areas which meant a lengthy alternative route or just as lengthy double back). Great views from Mt Faber & the Hederson Waves. Can easily spend 4-5 hours walking this track. Have a look through Hort Park as well, nice garden sections, and a market if you go on a Saturday. Take plenty of water. Also take a picture of the map at the start of the trail, is not perfect but gives some guidance along the way. We got off at Pasir Panjang MRT & was quite a walk through the ‘suburbs’, but felt it may have been better to get off at Kent Ridge MRT."
,,Beautiful views of the Ridges,5.0,,This is a good walk in the heat of Singapore but it si rewarding due to the sights and sounds of the forest below
,,If in need of exercise the Southern Ridges has the perfect scenery,5.0,,"Staying on Sentosa Island the Southern Ridges walks are close, located just near Vivo City Shopping Centre. Due to the heat it is advisable to start early. We walked to Mt Faber and then down to the wave bridge taking the same route back. There is georgeous scenery & views all the way with lots of shade from the tree canopy’s. I recommend on bringing plenty of water & dressing lightly. Overall a most enjoyable morning."
,,Worth it. Great experience,5.0,,"A free activity for friends and family and great for couples too!! It may get hot and humid during summer, so dress light!"
,,Spectacular walking trails,5.0,,"Leave the urban jungle behind for a day and explore this truly inspiring amenity right just minutes from the heart of the city. I took the cable car from Sentosa to Mt Faber and followed the well marked paths all the way to the pond at Kent Ridge. Highlights along the route included the Henderson Waves bridge walk, canopy boardwalks and Hort Park. Avoiding the mid-day heat is advisable and taking plenty of water, snacks and head cover is strongly recommended."
,,What a pretty area,5.0,,"Started at Telok Blangah MRT, walked up to Henderson Waves pedestrian walkway, then through forest walk and finally canopy walk ended at Kent Ridge MRT. Gorgeous scenery and views. A lot of paths were shaded. About a 5 mile walk."
,,Wonderful walk great views,5.0,,We did the full 10k route. The start a little confusing but if you head into the science park you find the footpath. The walk is varied from tropical elements to parkland and forest canopy. Saw a couple of monitor lizards. The views are wonderful and the end at the cable car is excellent. If you want the cable car I suggest you book tickets in advance.
,,Beautiful scenery,5.0,,It was recommended to take a walk to Henderson wave and continue to Southern Ridge. The view was great and you can see the southern part of Singapore. The walk was tiring but its worth every minute.
,,"For walkers and country lovers,this is a treat",5.0,,"This is a well constructed route with some metal path ways in the trees and spectacular foot bridges. Great views , of course"
,,Very surprisingly connected parks in Singapore,4.0,,"The Southern Ridges parks are all very well connected by nice wooden bridges, pedestrian walk ways.

We started the walk from the Telok Blangah Park near the Sentosa Cable car and walk our way slowly and nicely through the various parks. We even found wild banana tree along the way!

The bridge linking the parks was very well design and won an architectural award.

We took half a day to walk all the 6 linked park stretches about 10km."
,,Walk above the trees,4.0,,"If you want to get some silence in the middle of Singapore, start the trip from Alexandra Road and walk to Harbour front. You will get rest for your ears, amzing views for your eyes and your body will be a bit exhausted. Take enough water with you"
,,Nice walk,4.0,,"The walk varies from steel platforms above the trees, through parks, over bridges, before walking down from Mt Faber cable car station to the welcome air conditioning of Vivo City."
,,AN AMAZING WALK,5.0,,We walked from Alexandra Road to the Cable Car Station for Sentosa and can definately recommend this lovely walk. It is varied and accessible to all it took us just over 1 hour. Lovely views and easy walking
,,Must do in Singapore to enjoy the rainforest right in the middle of the city,5.0,,"I started off at bus station Aft Hortpark. Even though it was around 5PM, it was very quiet on the treetop walk and I very muched enjoyed the views, the scents and all the sounds from the wildlife. It took me about 20-30 minutes to make my way to Henderson Wave bridge where I watched the sunset. It is very well signposted, so you cannot miss the way. After the sunset, I went up to Mount Faber viewpoint. From there you have a wonderful view of the skyline of the city. By the time I went back, it was already dark. I still took the stairs down through the jungle. There were no lights, so I used my cell phone as a torch. It was a bit scary going down there at night alone, but it only took about 5-10 minutes until I reached the exit right in front of Harborfront MRT. Definitely a must do for a nice sunset."
,,Canned jungle walk,3.0,,"A well graded, well laid out and clean walk between a few tiny secondary remnant forest patches still to be found in Singapore. Some glimpses of what the island of Singapore must have looked like at the start of the last century."
,,The Southern Ridges Singapore,5.0,,"A very enjoyable walk above the trees,watching the birds,looking at the amazing views. The Henderson Waves pretty good too,great workmanship.Not too arduous walk for a hot morning."
,,Fabulous walking,5.0,,"High above the trees you would never know you were in a city. The path is well marked with cold drink vending machines and water fountains along the way. Much of it is in shade and there is plenty of bird song and you may just catch sight of monkeys. Yes
it is humid but take your time and read the information boards as you walk along"
,,Lovely walk,5.0,,"Do this in the morning. Start at Hort Park and enjoy the foliage and flowers. Take your binoculars so you can bird watch. It is not a difficult walk, suitable for children and older adults. Just adjust your pace. There are places to stop and admire the scenery and take a seat. Do bring your own water bottle."
,,Amazing views,5.0,,"Walked the whole Ridge walk (10 km). Very enjoyable with lots to see. Fantastic views of the city and the green parks. Part of the walk is a Canopy walk and also through Hort Park (botantical gardens). Well worth the effort, but wear good walking shoes!! There are very few tourists and the air is much cooler than the city, fabulous."
