id,uid,title,score,date,content
,,Wonderful Walk,5.0,,"Stunning experience in the middle of a major city
Pack your drinks, take the MRT and start at Mount Faber Park or the other way around.

Great views in those wonderful parks connected via stunning bridges and walkways.
No tourists crowds, no expensive admissions, far away from the stress of the city"
,,Afternoon Delight!,4.0,,"The Southern Ridges is an interconnected system of four parks: Kent Ridge Park, Hort Park, Telok Blangah Hill Park and Mount Faber Park. Get off at Labrador Park MRT and walk up Alexander Rd. The greenery amidst a major city completely surprised me. There is a fair chance of seeing tropical birds and, yes, some spiders of the bigger kind. If you have seen enough buildings, museums and temples go there! Henderson Waves is great, not only as a viewing point but also the construction as such: Between 60 and 70 meters above sea level... If your are prepared to spent some three hours walking you can end up at Vivo City: Either for shopping or the MRT back to your hotel."
,,Morning Sunrise,5.0,,Excellent place for the morning walk or runs around this southern ridge. A place to visit anytime with family and friends. This place is very well connected and has good directional signs to direct you to mount Faber and also all the way to National University Singapore.
,,Worth the visit,5.0,,We saw the Henderson waves on our local map however on most maps the location is not on them.Go find them the waves are stunning
,,Nice day walk,4.0,,"The walk itself is really nice, whenever in Singapore definitely go for it! To bad that it's not a loop, i thought it was, but then you just have to walk next to the highway, no problem walked to the mrt at labrador and took it back."
,,Amazing run,5.0,,"I like to go for a run whenever I'm travelling as it allows me to see places that I would otherwise not go and/or a lot more of somewhere. This was a recommended run and it was absolutely amazing. Mainly high off the ground through the trees, this is an urban oasis outside of Singapore's skyscrapers, with amazing views and gorgeous nature."
,,Great way to get off the beaten path and see a different side of Singapore,5.0,,"I never would have done this trip on my own, but so glad I did. My friend who recently moved to Singapore introduced me. It's a 10 k walk thru multiple parks and sky bridges they the trees. Beautiful views of Singapore. Perfect photo op places. No time limit and great exercise. Be prepared to sweat and take lots of water with you on the hike."
,,See a different side of Singapore,5.0,,"A refreshing 10km walk although you can stop at several points along the walk if you wish. Start early in the morning, bring sunshade and sunblock to protect yourself, plenty of drinking water to keep hydrated and binoculars to spot the birds and you are set for an interesting morning. The route is well marked and maintained. You do need to be reasonably fit as there are a lot of stairs to climb up and down."
,,Nice & Safe Trail,5.0,,"Started at 10am from Menang trail at HarbourFront and took about 2hrs to finish off. At Kent Ridge. Plenty of nature to see and the trail was very well designed and maintained. If u start at Manang, u would need to climb a fair bit of steps. It'll be less strain on your muscles if u start at Hort Park so when u end at Menang trail, you are walking down the steps instead. Go early cos it can get hot and drink plenty of water. It's a trail that's suitable for the young and old."
,,Greening Singapore,4.0,,"The Southern Ridges is a 10 km chain of tropical parks and forests connecting Singapore's Mount Faber, Telok Blangah Hill Park, Hort Park, Kent Ridge Park and Labrador Nature Reserve.

The whole chain is of immense value in the greening of Singapore, and is popular with nature lovers, bird watchers, history lovers, and walking enthusiasts.

Along the way there are observation points overlooking parts of the City, out to sea, and along rain forest canopies.

If you are really keen you can walk the whole chain in one go, but most people do a section at a time."
,,Very nice walks through the city jungle,4.0,,"We joined the trail at Alexandra arch and had a nice afternoon walking through the canopy on the Forest Walk, and enjoying the spectacular Henderson waves and parks all the way to Mt Faber.

We worth the time and effort to do this, and recommended to see a different side of Singapore with some great views thrown in."
,,Good place to watch birds,5.0,,Nice paved walkway in between trees and very good for jogging and bird watching. Make sure you have sunscreen with you as not many tree shades along the walk.
,,Well-maintained brisk walking/small hiking trail,5.0,,"This is a great way to traverse across the western side of Singapore. The trail is very well-maintained with many folks exercising during the weekends, and it takes you through the forested areas of the west part of Singapore. As with any other trail, please make sure to wear a hat and plenty of sunscreen. Bring lots of water too, because I don't remember seeing a convenient place to stop and get water (Though resting spots are aplenty)."
,,Nice walks,3.0,,Nice to spend some time there. You can escape the city noises a little bit. You can reach the cable cars from here.The touristic buses make it a little bit too crowded though.
,,Beautiful place,5.0,,"Easy to walk, don't need special shoes or worry about uneven paths. Very clean and well laid out. You can connect to a few spots from here. Be sure to bring water, sunblock and mosquito repellent. Also something to shade you from the sun, maybe a cap or wide brimmed hat. Best to go in the early mornings, cooler."
,,Great walk and good views throughout,4.0,,"We did the whole walk late last year and really enjoyed it. Plenty of nice scenery and wildlife to see. You do need to be ok with heights as there are several high bridges and suspended walkways. Make sure you take lots of water, sun cream and bug spray. Good to end of vivocity and grab a snack and a cold drink too. Stay away from the monkeys if u see them."
,,A lovely walk,5.0,,Ensure you get off the correct MRT stop when visiting this as we didn't so ended up going far out of the way. When we eventually reached the correct area we thoroughly enjoyed the walk through the treetop walkway. Take a spare top though as the humidity is high in December and you will sweat buckets during this walk. We walked all the way to the Cable Car station and caught a taxi back to Orchard from there. The views are really good.
,,Good exercise & enjoyable outing close to nature!,5.0,,"We walked from Alexander Arch, passed through Henderson Wave and continued walking to Mt Faber. Took us about 2.5 hours walking with 5 kids with us ranging from 5-11 years old. We took our time to walk and enjoy the view. Plenty of resting spots along the way. We had lunch at Spuds & Aprons and took the cable car down to Harbourfront. Great exercise for everyone and the air was clear of smoke, traffic fumes etc. I think Spore government has done a great job incorporating nature trails like this in the midst of all the skyscrapers and hustle and bustle of the city!"
,,Peaceful and scenic,5.0,,"I cannot believe that there is such a lovely hike/trail area in SIngapore! You will really feel close to nature. The park is well maintained even though some paths are in between tall trees. Simple exercise facilities are scattered all throughout as well as benches and viewing decks. Best of all, the attraction is free. I struggled a bit to find the place but for those who take the MRT like me, alight at Harbourfront station and go to Exit D. You will find yourself entering the Marang trail. Properly labeled paths and street signs help you navigate through this massive park. If you have enough energy, you will find yourself on the other end - near Kent Ridge. Make sure to use sunscreen, wear comfortable shoes and clothes, and bring water."
,,My favorite outing route,5.0,,Walking from the back of science park drive through horpark then climbed up the path or these bridges on top of these forest trees is a unique experience all the way to Henderson wave and then onto mount farber park before heading down to harborfront MRT station to head home. It took a few hours of sweat but was manageable. A group of us of approx 30 people started at 9 and then end at noon. Horpark is a good stopping point halfway.
,,"a calm, peaceful place to go!",5.0,,"The walk is amazing, tranquil and gives you a chance to stroll and admire green spaces in Singapore. Didn't see any monkeys though (a good tip is to refrain from noise pollution, such as speaking loudly or blasting music), but there were quite a few infographics on bird species found (excellent for bird watchers) where I had walked which is really helpful since you could hear and see them every now and then."
,,Nice for a weekend hike.,5.0,,"If you are looking for a nice weekend getaway, this is one of the best places to do so. You get to have a view of southern Singapore, while experiencing nature. Defintely a must-visit destination."
,,Easy to walk,5.0,,The route is very well maintained and lit so we are able to walk there at night without any problems.
,,Highly recommended city walking trail,5.0,,"I recently trekked the Dragon's Back in Hong Kong and the Southern Ridges walking trail is absolutely better. There is a lot of useful information found in NPark website. I started early morning from Kent Ridge Park, walking towards Hort Park, across Alexandra Arch, through Telok Blangah Hill Park, crossed the excellent Henderson Waves & to Mount Faber Park. We then walked down Marang Trail and back up again to back-track to Alexandra Arch. We then walked to Labrador Park and back to Hort Park where we continued back to visit the Reflections at Bukit Chandu (and to cool off).
The walking trail is in excellent condition with useful signposts, informative maps, clean functional toilets and interesting views.
The disappointing features are Alkaff Mansion and almost the entire Labrador Park. The museum Reflections at Bukit Chandu is small and has too little interesting exhibit. These low points are too minor to overshadow the overall excellence of the Southern Ridges.
A few tips - bring water, hat, small umbrella; extra clothing to change. There is a mall along Alexandra Road on the way to Labrador Park where you can buy cheap bottled water or patronise the restaurants there. At the start of Marang Trail, there is the cheap Seah Im hawker centre or across the road to the mall, Vivocity."
,,Great nature workout,5.0,,Looking for a workout and a view to enjoy. This is the perfect blend to give you both on a morning. Also enjoy the time with squirrels and local birds. Great walk.
,,Architectural Bridge,4.0,,Great for some different views of Singapore. You can catch the cable car to Sentosa from here. The bridge was nice to walk across more locals than tourists.
,,A lovely walk,4.0,,"One of the few place sin Singapore where you feel you are at least somewhat near nature. not the greatest walk I've done but so well put together, safe and perfectly maintained."
,,Wild Side in the City,5.0,,"If you don't like walking, I don't even know why you're reading about the Southern Ridges. This is for people (like myself) who love to get lost in the trees and unmanicured pockets of wild areas in Singapore. But trampling on the grounds does disturb the animals so this is a great place to walk because of the elevated bridges which are engineered for easy access and maintenance as well as eco-friendly to the vegetation below."
,,Walk on trees!,5.0,,"I went there 3 times...first time i went with friends...second time i went there with my mom...3rd time with my entire my family.
This place is not only attraction of Singapore...its a good place for morning or evening brisk walk..You can see many trees,birds life...some times monkey too..its a forest in the heart of city,...So you can get a different feel of it.. no fees to enter...very nice place...but nothing to eat there...so better buy something prior to your trip.."
,,👍,5.0,,"Wow, wow and wow. It was a real pleasure to walk across the track and enjoy staying on the same level with trees tips. The trip took me a couple of hours. It is definitely the place i would like to return from time to time."
,,Lovely stroll away from the crowd,4.0,,You will find plenty of green and tranquility when you walk along the Southern Ridges of Singapore. Some of the architecture such as bridges across highways and skywalks above the treetops is world class
,,Walking Trail above the trees,5.0,,A great relaxing walk on a hot afternoon is the most ideal way of enjoying it as you don't feel the heat while nature watching :)
,,A long walk with so much to see.,5.0,,"If you like to walk, the Southern Ridges series of connected walks (parks) is a beautiful experience. The walks are all well marked and easy to follow. You can break from the walk at many points if you get tired. Start at the National University of Singapore and wend your way to the top of Kent Ridge Park. The path rises to a lovely panorama looking south over the coast. Take the elevated Canopy Walk (~16m) to the top of Pepys Road. Cross the road and visit Reflections at Bukit Chandu a World War II museum. Small but interesting and housed in an old colonial Black & White house. You are on the former Opium Hill where the old opium factory buildings still sit at the bottom of Pepys Rd. Take the path down to Hort Park where there are lots of birds, flowers and displays. (A diversion here to see the Black and White houses in Alexandra Park is worth the effort.) The path leads to Alexandra Arch and the start of the elevated walkway ( ~18m). The walkway brushes the tops of trees and takes you through Telok Blangah Hill Park and down to Henderson Waves which is a bridge to Mount Faber Park. This wave-like construction has breathtaking views from an elevation of about ~36m. Its eerie. The cable car station awaits your climb to the top of Mount Faber. From there you can take the cable car down and to Sentosa Island. If not, take the path down to the bottom where Vivo City Mall offers a myriad of food choices for lunch. About 12 to 15km depending on what you do. Take lots of water."
,,National Day!,4.0,,"It was an early 9 August!

Planned a last minute trekking to The Southern Ridges of Singapore, knowing the majority of the places would be crowded.

A morning work out with the nature was taxing at first as not much training was done before that. But having someone who know abit more on the direction plays a major part too. Spent the first half of the day trekking from Henderson Waves, through Forest and Canopy Walk and to Hortpark, last stop at Kent Ridge Park. It was quite a tough one as I grew blister on my toes along the way.

Exited at Kent Ridge Park and walked to the bus stop nearby. Unknowing we sat there for almost 10 minutes and realised that there will not be any bus service on Sundays and Public Holidays. So we walked for about 15 minutes more and finally we saw Kent Ridge MRT Station.

Trekers to note:
Do bring enough water as there is limited water cooler stops for you to refill your water
Wearing a good pair of shoes is a MUST
Do not carry heavy

A good burn out I had!

Cheers,
Jazlyn"
,,A good walk,5.0,,"You know you've had a good walk when you go from Hort Park to Mount Faber, and it's probably going to be hot, but there are stunning views and it's a good way to spend an afternoon. Probably not for this who want a gentle stroll, but we had a family group with a young baby in a stroller, and it was beautiful and good exercise. Just don't be in a hurry."
,,Nice walk on weekend,4.0,,If you have been living in Singapore and happen to have a free sunny day to kill. The Southern ridges are a great to kill time with. The road are diverse and the views are beautiful. The hike itself is easy but be prepared for the heat and bring a lot of water.
,,A really great walk or run in nature to escape the city,5.0,,"This is one of my favorite weekend runs in Singapore. Very nice views from many angles.

You can take the whole course - start from the entrance to Mt. Faber and make your way all the way to Hort park and Kent Ridge. It's about 5km and a very nice afternoon course."
,,Great city hiking,5.0,,"Well maintained, if not particularly well signed, paths in lush nature. Henderson walk is very cool. Trails cover many kilometers so plan accordingly."
,,Perfect for Early Morning & Strolls at Dusk,5.0,,"Ideal for early morning and evening strolls all the way across the well-crafted wooden corridors overhanging the canopy of tall trees after parking one's cars at the car parks at the Peak via South Bona Vista Road ! The air is fresh and breezy, and the view of the City and seafront etc., is just too spectacular to be ignored."
,,Great Way to Spend Afternoon,5.0,,Very well-designed walking park. The parks are connected together and offer amazing views from the elevated walkway.
,,walking in the clouds,5.0,,we were here a beatyfull day warm soo take a lot of wather but it was fantastik to walk in the air in the treetopps i lost a fju kg
,,Allocate at least half a day,5.0,,"We did some of this walk after a day at sentosa. Our plan was to start at Hort Park and walk east to Mt Faber. We caught the MRT to Pasir Panjang and walked up Pepys Rd to Hort Park and turned right at what we thought was the right spot but alas it was the wrong way and somehow we ended up heading west, anyway if you try this way don't head through the treetops, head down to the nursery. It would have been nice to see a lot of the park in daylight as there looks like there is much to see. It is a beautiful way to spend a few hours, take some water!"
,,ALONE SURROUNDED BY NATURE,4.0,,"Highly recommended to see the different side of Singapore.

Easy trek with good indication and map, best to go on week days and bring a lot of water as the sun can really drain our energy. There is no place to buy lunch/ food therefore it is advisable to bring light sandwich or fruit as it can be a very long walk however enjoyable.

Getting there is very easy:

Marang Trail (leading To Mount Faber) - this is where I started.
By MRT: alight at Harbourfront station Exit D.

By Bus: take bus service number 10, 30, 57, 61, 65, 80, 93, 97, 100, 131, 143, 145, 161, 300, 646 or 855 alight at bus stop in front of Seah Im Food Center at Telok Blangah Road"
,,Very good walk in Singapore,5.0,,"We have visited Singapore many times and we were looking to do something slightly different and found this idea via a newspaper review. It was quite hot on the day that we did the walk especially as we went in the middle of the day. However there is a fair bit of shade and plenty of places to stop to get a cold drink. The views were great and we will do this again in the evening, or at least part of it when we are next in Singapore.

It is very interesting to enter a forest environment directly from a city car park and immediately see an enormous lizard. Hardly any people - very peaceful and great views,"
,,Great photo spot coupled with a leisure walk!,5.0,,"Highly recommended for trekkers who wish to go on a leisure one.. terrain is easy and if you start from Hort Park, it should take you less than 3 hours to complete (included lots of photo taking at the southern ridges and also some rest points)"
,,relaxing walk with nice view over singapore,5.0,,"Not as far as MacRicthie, and less tiring, the southern ridges is a nice walk to have on sunday in Singapore. it also offer very nice panorama over the city !"
,,The Southern RIdges,2.0,,"This is basically just a typical hiking trails for those who like outdoor nature hike in an urban nation. Nothing much to shout about, just simple trees, and tracks/trails, and that's basically about it. A bit disappointed with a keen hiker like myself."
,,Nice walk close to City,4.0,,"A nicehike that will take a good three hours of walking. Take MRT to the HarbourFront station. Look for Marang Trail which is a path (steps) that takes you up a relatively steep hill all the way to Mt. Faber Park where the cable car ride starts. After taking in the view, continue and follow Mt. Faber Loop heading to Henderson Wave which is a wonderful bridge. Continue on the path till you get to the forest walk - a nice steel walkway on stilts will multiple scenic viewpoints. However, there is virtually no shade on the forest walk. The path finally ends after reaching Alexandra Arch and our Hotel concierge suggested walking towards Labrador Park MRT station. We opted to continue towards HortPark - a public garden with many interesting miniature gardens."
,,Itching for a nature walk in Singapore?,5.0,,"This is a great walk to burn off a bit of energy, walk in the tree tops, see and hear birds, squirrels and insects and see the city of Singapore around you then try this walk. You can make it as short or as long as you want. I went from Mount Faber to Kent Ridge starting at 7.30am missing the heat. It is also disable friendly so anyone with mobility issues don't be put off there are ramps every where. I highly recommend this walk"
,,Great View and Walk,5.0,,The Southern Ridges offers one of the best views and a great workout suitable for both young and old.
,,It needs a mild day and patience,3.0,,"I walked some of it and quite enjoyed. I have to say this little country have done well in creating new landscape and preserving the nature. I would recommend a half day trip to walk it all, along with some capable good friends."
,,Good trail!,5.0,,"If you start from Harbor Front (Marang Trail), the walk from the Southern Ridges to the Alexandra Arch is extremely relaxing. I've done this trail many times, and I usually start from the Marang Trail where there's a lot of stairs! So once I reach the Southern Ridges, I find it extremely relaxing to walk on smooth ground 60 - 70m above sea level. I've done both in the morning and night, and I can say for sure that the Alexandra Arch is the most relaxing and my favorite part of the walk. Definitely recommend this to people who like walking/nature!"
,,Great hike! If you need to burn off some energy and get some nice views,5.0,,"I did this in reverse from the usual. I took the MRT to Kent Ridge and walked back to the Henderson Wave. It is a little more difficult as the signs are more for people doing it from Mt. Fabre and going back to Kent Ridge.

You get off at exit B at Kent Ridge and walk along Science Drive. The hardest part is finding the entrance to the park! There is NO signage at all, but once you get into the park there are signs everywhere. So just walk along Science Drive until you pass a Starbucks. It isn't too much further after that, right after a small bridge.

The Kent Ridge section is actually the most natural and you get some good views over the harbor.

The Canopy walk is nice but really not all that exciting.

Then you connect to Hort Park which is mildly interesting. You could spend a lot of time there but for the walker, it is a pass thru really. You can walk through that a myriad of ways and there are maps everywhere. After you exit it is a very short walk to the bridge of Alexandra Road. It is a unique bridge similar to one down on Robertson Quay.

After that you will walk on a metal pathway to the top of Telok Blangah Hill. Again... Some nice views along the way and it is similar to the Canopy Walk.

At the end you will be in Telok Blangah and you can walk up a steep hill to a viewpoint over Singapore. It is quite nice. If you don't feel like it, you can go around it to the left or right.

You will also pass an old mansion (now high end restaurant) which is quite lovely from the outside.

Finally you will arrive at the Henderson Wave bridge. It offers quite nice views and the architecture is stunning. It is better viewed from afar to the get the full effect though.

At the end you walk through Mt Faber park which is a well establish and old park in Singapore. You can take the cable car or just walk down the Marang path to Harbourfront and Vivo City.

The plus side of doing the walk in the reverse is that you END with a lot of places to eat and drink. If you start at Mt Faber you will only have a Starbucks near the end.

There are a lot of stairs and you should be in reasonable condition. I did whole thing in sandals, no problem.

Take an umbrella because although there are rain shelters along the way, there are some areas with none, so if you get caught in a downpour, you will get VERY wet.

Highly recommended as an antidote to all the mall shopping and eating in modern Singapore."
,,Something different from the normal attractions....,4.0,,"For those who loves nature & something different, this place is highly recommended.

However be prepared for a long walk in the open. Its very hot & very humid in Singapore. Try to come in the morning where its cooler.

Wear cool clothings & comfort shoes. Put on a cap or hat. And a sunglass to protect from the heat & reduce glare. Bring enough plain or mineral water. All these helps one to enjoy this visit better.

Oh. Don't forget to bring an insect bite relief cream. Not uncommon to get bitten by mosquitoes in such places."
,,Beautiful hike in a comfortable & safe environment,4.0,,"The Southern Ridges offer serene and beautiful hikes to the nature lovers. Paths are clearly marked and paved. Safe and suitable for children too.
The Henderson Waves is quite a beauty, especially at sunset.
We planned our walk such that our end point was to Safra Mt Faber for afternoon tea!"
