id,uid,title,score,date,content
,,Gorgeous,5.0,,This walk/hike is a must whilst you are in Singapore ! It's gorgeous. Takes a few hours but you see some amazing views go through some beautiful parks as well. You can also do this as quick or as slow as you want.
,,Bridges at tree top level,5.0,,"Definitely walk along Henderson Waves - high amongst the trees offering a beautiful view and quite simply a remarkably creative pedestrian bridge: unusual, aesthetic structure reminds us of waves.
Other sights to walk through such as the Forest Walk and Canopy Walk... listen to the birds, enjoy the quiet away from yet in the middle of the amazing city of Singapore!"
,,Absolute Must-Do!,5.0,,"Amazing walk around so many beautiful environments following numerous trails! Plenty of platforms and walkways, a great way to spend a few hours walking across the city!"
,,Southern Ridges walk,5.0,,"did this walk on xmas day 2017 in the afternoon after spending morning at Sentosa. i walked from Harbour Front start of trail is to the right of bus interchange behind Harbour front paved and steps to the top. great views and scenery changes all the way along this walk Henderson waves is great walking bridge over Henderson road whole track is sign posted so easy to follow when you get near the end go to ""Reflections Of Bukit Chandu "" story of the Malay regiments last battle in the fall Of Singaposre i walked to Kent rd MRT station for train back to Harbour frt. it took me 31/2 hrs to do 10k at easy pace and stops to admire views."
,,Lovely walk along the ridges,4.0,,"Starting from Harbourfront, this walk goes all the way to NUS, with a variety of bridges, treetop walks and Through Hort Park. Takes a couple of hours and the exits are close to MRT stations. I have done this walk a few times now and really like it but the signposting is poor. Good to carry a map to make sure you are moving in the correct direction."
,,Outdoor activity must in Singapore,5.0,,If you are the person who loves outdoor activity. Do not be hesitate to stop by this place. The walkway is easily in the forrest.
,,A wonderful forested escape from the city,5.0,,"Being resident in the UAE where city walking is pretty much impossible (and devoid of natural interest) we jumped at the chance on a recent long weekend in Singapore to complete the Southern Ridges trail. We started at Kent Ridge MRT and went all the way to Harbour Front MRT. The beginning is a little tricky to find but if you walk downhill you eventually reach vigilante drive and access to the start of the trail. The sights are spectacular, especially the elevated canopy sections and bridges over freeways with stunning views of the Singapore cityscape on either side. The walking wasn’t too tough either, just a little damp and humid unsurprisingly! A fantastic (and free) must see attraction if visiting Singapore."
,,Really enjoy this walk,5.0,,"I have done this walk a few times as I visit family in Singapore on a regular basis. Totally enjoy the walk and by some piece of luck have never been caught in the rain. I have never seen large crowds on this path, maybe I am just lucky!! I would certainly recommend if interested in the scenic and natural views.

Last few visits have been started by coming in by bus and dismounting at Harbour Front. Walk across the car park (right hand side), note where motorbikes are parked and go there as that leads you onto the climb up through the narrow gateway. The path climbs up, and then you get to the cable car point with some nice views. At the end of the road you can bear right and head straight to Henderson Waves or bear left and go up to the actual summit of Mount Faber. Invariably there will be some coach tours out there, behind the top there are steps down (not too easy to find) which get you down to a road and then you right turn up for the way to Henderson Waves. This is just a great piece of architecture to see, and just a steady gentle climb. Beyond the Waves you eventually come to the canopy walk over Teloch Blangah Hilltop Park for 1.3Km with some lovely views of trees and shrubs (can always go to the bottom and walk along the floor), again great. Before doing this you can note a climb up to Terrace Gardens for yet another panoramic view. Some steep step climbing. After the canopy walk it is then Alexandra Arch over the road and onto Hort Park. This park is very different to the previous ones, and worth the contrast. Very well maintained. At the far end of the park, the path winds up to the Kent ridge on another shorter treetop walk, where there are some reflective posters from WW2, and more views. There is also a nearby museum.

The option can then be to walk back and get a bus or taxi or follow the signs for the Kent Ridge Pond. There you will see a map showing directions to Kent Ridge MRT (less than 20 mins to get there).

The straight walk from Harbour Front to Kent Ridge is about 90 mins, but enjoying the scenary obviously adds more time.

I have seen monkeys on the canopy walk in the past, but not for a while.

Not all parts are well sign posted, the easiest option is probably to start from Alexandra Arch and return to Harbour Front. This is also the most attractive part of the whole walk."
,,Good hiking trip,4.0,,Mount Faber park is a good trail hike in Singapore. You need to start at Harbourfront MRT and go all the way till Henderson Waves that connects to Telok Blanglah park.
,,Amazing nature walk!,5.0,,"I didn't image how there is a secondary forest within a city. The Southern Ridges is one of great answer. Starting from very convenient MRT HarbourFront, it leads to the hill with bird-eye through the city. Old trees to high trees. Amazing Henderson Waves to sky trail, from top to bottom. The more you walk, the more exciting it makes.
P.S: walking in early morning is the best, then you can visit a lot of places around HarbourFront."
,,Leafy walk through the city,4.0,,This is a nice jungle walk which crosses the city. It can be long and there are some steps but it is relatively easy and a pleasant walk with some nice photo opportunities.
,,Was always a well kept secret,4.0,,"The Southern ridges was always a great quiet place to go for a long walk with some good views of Singapore. Lately it is becoming more and more popular. My only gripe is when it rains, and it often does when I go out walking, it is often difficult to find shelter."
,,Great Trail with great view,5.0,,"Very nice easy walk between tree tops. good breeze, great view. Recommended to come early morning to Mount Faber summit and go all the way down by ""The Southern Ridges"". easy and great way to start your day"
,,This was my greatest experience in Singapore!,5.0,,"The views! This high-tech nature walk offers unusual city views from within a green space, much of it one to three stories above the ground. Delightful! For architecture lovers, Henderson Waves is not to be missed!"
,,Needed more info before starting!,3.0,,"After taking ages finding the start of this walk after leaving the MRT station at Harbourfront & doing the walk to Hort Park, we realised we would have done better to have caught the bus from opposite MRT station, bus numbers 61,93,97, 100 or 963 direct to Hort Park & walked back. The walk in the trees & the Henderson Wave bridge were very impressive. Hort Park was rather disappointing."
,,Nice Walk with great scenery,4.0,,"I have done this walk several times and each time enjoyed it. Normally I start at the Vivo City End and make my way along the paths to exit at Kent Ridge. But if I'm feeling up to it I continue past Kent Ridge and exit at Clementi Road and walk down the hill to the famous Roti Prata eatery for a snack.

Its a good workout and not too strenuous with the advantage that if you are feeling tired its easy to get off the walk and find transport to take you where you want to go.
Bring water, a sunhat and if there is a chane of rain a small foldable umbrella"
,,Great for Long Walks!,4.0,,"A great place to go running, jogging, for long walks, and just slow walk around in. I recommend a taxi to get to one of the main parks, before you start your adventure."
,,"first time, after so many visits in Singapore",5.0,,"my first walk along this track. Nice view and a totaly other perspective of the city. Easy to walk and not too long. Only 2,5 km one way. So could be done forth and back"
,,Leg-stretching and scenic escape from city streets,4.0,,"I did this complete walk again yesterday as a prelude to a long flight back to Europe and it was good preparation. Mostly well-signed, there were two or three points where it was a little disjointed for those who don't know the area well. That, however, was a very minor issue and there are static maps posted along the way. Just take a paper version with you to connect the dots.

The start from Harbourfront is not well-indicated but easy enough if you follow this route...I took the MRT to Harbourfront and turned away from the shopping mall after exiting the ticket gates but while still underground (it is signed for the bus terminus and hawker centre). This route takes you through an underpass to avoid crossing the busy road. I then walked through the open-air car park towards the hill and the far right corner, where there is a narrow gateway and a footpath to the left. The path climbs up, in a ten-minute sweaty walk, to Mount Faber. I then followed the signs to Henderson Waves, which is a spectacularly high walkway over a busy road. The walk takes you then to Hort Park, via a long and impressive treetop walkway. In the past, I have met monkeys on this walkway, though none were evident yesterday. The views of the varied trees and shrubs is lovely, even without wildlife. Hort Park (the name is short for Horticultural) has toilets and drinks/snacks machines and a visitor centre. It is an impressive example of horticultural skills, in contrast to the forested parts of this walk. At the far end of the park, the path winds up again to the ridge on another shorter treetop walk, at the top of which is a small, but sobering and impressive, museum and memorial to the lives lost in Singapore during the Japanese Invasion.

The walk continues for a while along Kent Ridge at the end of which you can descend to a road with bus service (but not on Sundays!). Turn left and walk for ten-fifteen minutes to find Kent Ridge MRT to take you back to Harbourfront or, on a circular route with interchanges, towards Doby Ghaut MRT Station.

Along the way, there are toilet facilities and storm shelters. Since a thunderstorm was approaching, I noted the locations of the shelters, in case I had to turn back. You do not want to be caught in the open in a tropical thunderstorm! I did not check the time, but I think it took about 2.5 hours and was probably 10 kms long. You can start or break this walk at various points."
,,Great view of Southern Singapore,4.0,,"Good location for a jog or brisk walk and also to check out the southern side of Singapore from the hilltop. Several public (free) car parks in the proximity for visitors who drive. There are covered shelters, vending machines & also public toilets for park users."
,,Jungle meets the city,5.0,,"Gorgeous walk, you forget for a while where you are! Walkinh through lush green jungle, high in the tree tops its perfect on a sunny day. Completely forget you're anywhere near the big city - we even saw an orange snake on the path. Definitely worth a visit"
,,Great walk,5.0,,My friends and I did the walk from Kent Ridge Park to Mt Faber. Easy park to access via MRT. the walk through the different parts was relaxing and really interesting. Views are fantastic. Plenty of places to stop along the way and we enjoyed and ice cream at the top of Mt Faber. Would def recommend to do the walk.
,,Beautiful walk,5.0,,"A great walk for various fitness levels, giving a nice contrast to the urban side of Singapore. We began the walk by getting off the MRT at Kent Ridge and walked to Harbour Front. There are places to fill up your water bottle enroute and comfortable walking shoes are advised."
,,You must do this if you are in Singapore,5.0,,Luckily went mid-week where it was dead quiet. Did the 10Km trail and found it brilliant. Highlight definitely Henderson Waves followed by metal gangway forest walk. Unfortunately didn't see any monkeys :-( Maybe next time!
,,Little piece of wilderness in the City,5.0,,"How wonderful to walk in the treetops along this elevated walkway, Many entrances and exits. Ground levl path too, So much information about the birds,"
,,A long walk,4.0,,We did this walk later afternoon when weather was already nicer weather. It is a great place to visit and walk.
,,A hidden in treasure- great day of hiking!,4.0,,"This was a bit more a hike than we initially realized. We walked more than 7miles on trails that could have been better marked. We started from Kent Ridge park which had more steps than we wanted, but we eventually made it to the canopy walk. From there We found a WW2 museum (bukit Chandu) which is well worth a stop. Then it was a walk thru HortPark followed by a walk to Alexandra Arch which included a Forrest walk on an elevated bridge that lasted 1.3 km. Thankfully, that was flat as well as Henderson Waves. Great views all around and well worth the 3 hour effort. Make sure to bring water, sunscreen and a hat!"
,,Good way to get some exercise and enjoy the greenery!,5.0,,"Went for a late afternoon walk with my family. We really enjoyed it ! It's flat and easy, and great to have so much greenery around, and under your feet. What an experience. We will definitely be back!"
,,Nice walk,4.0,,"It was a really amazing experience for the 2 of us, my girlfriend and I. We started at the Faber trail and finished at the Alexandra arch bridge for a total of 9km approximately. Gotta see some different part of Singapore :). Enjoy it!"
,,Fantastic,5.0,,"This is a three hour walk so come prepared with water, sunscreen and hat. It was not easy to get to by bus or the MRT as the train stops at Harbour Front, then you walk to the start point. We took the cab to the start point. I love the serenity of the whole place. You get a panoramic view of the city and harbour plus it doesn't feel like you are exercising. The best for me was Henderson Bridge. The wave-like structure consists of what looks like ribs. Fascinating. You do get to see lots of flora and fauna. I didn't get to see any monkeys, but you are reminded that they are in the forest.
Even though the walk was long, it was worth the trip. Put this as a must do thing."
,,Nice for Short City Get Away (But not fantastic),3.0,,"My wife & I went to the southern ridges yesterday at about 830pm to walk. We walked from Henderson Wave to proposed Kent Ridge Hill.

Pros:
1) Nice Relaxing getaway from city & urban Singapore
2) Nice walkways to view above trees
3) Nice layout of walkway specially designed for people to walk around
4) Forest walk is above trees nice designed

Cons:
1) NO proper signage from bus-stop & street level to point visitors to where is the opening for Henderson wave - u cannot expect first time visitors to hunt for it. Though the bridge can be seen from the street U will be scratching your head where is the entrance which is in Telok Blagah Hill
2) Henderson Wave is a bit short & views blocked by tress - LOL
3) Though there are signs to point to Kent Ridge it was not design properly
4) Don't go at night - the place is EXTREMELY dark cannot see the trees & forest below
5) Many of the vantage points are covered by tall trees so you cannot look out to good views
6) misleading signs
7) no water fountains - please bring your own bottles.
8) We got lost in Hort Park (entrance) because there won't any PROPER signs pointing to Kent Ridge
10) Not much place to sit
11) The top of Telok Blangah hill is closed for reno so u cannot go up to have nice views - waste time
12) the sign which points to Kent Ridge Park IS WRONG!! we ended at Bukit Chandu LOL

overall ok for city dwellers don't expect fantastic at night. I think day light would be much better views"
,,Great place for exercise,4.0,,I usually go there for morning or evening walks as it is less crowded and the location is away from the hustle and bustle. The views at the top are stunning. I recommend spending about 1 to 1.5hrs here to enjoy the scenery and end off at VIVO or Harbourfront for snacks.
,,Beautiful landscape,5.0,,"If you want to scape from the city, this is the prefect place. There are different pathways that you can use depending on the time, distance and difficulty. The shortest walking tour arriving to the TreeTop Walk and turning back is about 3 hours."
,,Great Running Trail,5.0,,"I have been running from Mount Faber to Alkaff Mansion to Kent Ridge for many years, even before the connection pedestrain bridges were built. With those bridges and tree top paths, the route has become much more enjoyable. Nice scenery and seems to be more breezy too. If you add in Labrador Park and Keppel Island, it becomes half a marathon run, being hilly, quite challenging too."
,,'A City in a Garden',5.0,,"We had a lovely morning walk at the Southern Ridges, despite the early heavy rain, it didn't dampen our spirits and we were rewarded with fantastic views across the city and out to Sentosa. The walk is pretty easy going and does help you escape from the hustle and bustle of the city. I'd highly recommend spending a morning doing the walk."
,,Excellent place for a long walk/ run,5.0,,Good mix of natural tracks/ constructed wonders right in the middle of city. Henderson waves is my personal favorite in the Southern ridges
,,Enjoyable but most of it is too developed to experience any nature.,4.0,,"The walk is very easy and it is nice. However it is in the city and there are dozens of parking lots and concrete. The canopy walk is sadly not a swinging bridge as i thought. I saw lizards and snakes and loads of plants. The walk is very easy and of no challenge and it is easy to get to by public transport. If you have one day and want to experience nature, don't go. Only a limited bit of it was set up as a nature trail. It was boardwalks and pavements. It took my two hours to walk the whole 9km, plus i spent time sitting on a bench for some."
,,Wonderful walk in the middle of town,5.0,,"Walked from Hort Park via Henderson Waves to Mount Faber. It is a diverse, beautiful nature walk. It's not a difficult walk and signage is good. For a less crowded experience better to do it during the week. Recommended."
,,Another outdoor must-do attraction!!!,5.0,,"I highly recommend it for active folks who enjoy walking and jogging. Get yourself to the Alexandra and Depot roads crossing (the bus stops on the Depot Rd. near the Interlace* building, see below).

Right at the start of the pathway, the Alexandra Arch is a good spot to enjoy the labyrinth view of the Interlace building, esp. before and after sunset…

The metal elevated path is built high over the surrounding 'jungle', you have nice views of the forest, harbor and nearby public housing buildings... The walkway connects with the Telok Blangah Hill Park, the Henderson Waves and the Mount Faber park. You can combine them all for a nice leisurely walk. The Southern Ridges path is mostly uphill but once you reach its end and cross into the Terrace Garden in the in the Telok Balangan Hill park it's all downhill from there, all the way to the VivoCity Mall and transportation back to the downtown are and hotels.

Quite enjoyable, have some water with you and a towel to wipe off sweat;) Again, the best time to visit is late afternoon before sunset, when it starts cooling off a little, not much though... It's Singapore after all, hot and humid year round.

* A residential building that you can walk or view from the Southern Ridges walkway. It looks better from further away, at least in pictures, as a jumble of haphazardly laid out apartment blocks, unique, creative, and I'm sure functional. Another proof of why Singapore is one of the most innovative cities for creative and award winning architectural design. Made super popular by Instagram and drone photographers."
,,Am I really in a bustling metropolis?,5.0,,"Have done this walk from Kent Ridge Park (passing through the Horticultural Gardens) to Harbourfront many times. It's hard to imagine one is in a large city when walking amongst treetops. Always wildlife to see, particularly birds if you are interested in these."
,,Amazing and satisfying,4.0,,The scenery is fabulous and the bridge is really easy to walk. It can accommodate strollers easily. Perfect for people looking for some fresh air or to get some exercise.
,,amazing view and lotsa greenery,5.0,,went up for a walk with my partner and ended by doing a 10km hike ... amazing views and lovely feeling...
,,a gem in the city!,5.0,,"we didn't expect to find something like this in the city of lion. it took us almost 4hrs to traverse this marvelous stretch, that includes a lot of selfies, haha. very relaxing and comforting. it's a must see especially for those who wants to unwind from their daily busy life.

I suggest take the kent ridge to harbourfront route so you'll end up at Vivo City, and of course do it on a weekday.

it's a very satisfying experience."
,,Fun place for a walk,5.0,,"This is a very enjoyable place for a walk. If you have a dog you can take it with you, though the pathway is made of metal grills and our dog wasn't so sure it was a good idea to walk on it. He was ok after a while. LOL"
,,Beautiful scenery in a city,4.0,,"The view was beautiful and it can be a great place for walking. My children enjoyed looking at the different types of trees , fruits and flowers. They were hoping to meet some monkeys but we didn't see come across any. I definitely recommend this place to people who like nature and walking, but bring your mosquito repellent"
,,Nice walk!,4.0,,"This is a great walk from alexandra park up to mt. faber peak. great walk on the treetops, and then the beautiful henderson wave. Don't miss this end of the walk though :)"
,,Good for an evening stroll,3.0,,Popularized by recent Bollywood movie Badri ki dulhaniya. Not a must visit at all. Good for an evening stroll if you are in signapore for two weeks. Short trip travelers can avoid.
,,lovely,5.0,,nioce views can cater to your desired walk length or ability as u decide where to enter or exit amdist teh local haunst so u can stop off for food very relaxing and great for a workout or fun hike
,,Fabulous escape,5.0,,"This is a fabulous path which is very varied, combining bridges, woods, gardens, great views, shade, sun, benches and places to rest and easily makes a great Sunday with the entire family, friends or alone. Each part is different and you can access or exit on the way and just do parts rather than the entire long way. There is good signage and the entire route seems to be very well maintained."
,,"Start from Alexandra Road if you want the ""quick tour""",4.0,,"If you want to have just the highlights and a short walk, then use a bus or a taxi to go to the ""S P Jain"" bus station on Alexandra Road. At Alexandra Road, there is a possibility to enter the Southern Ridges trail and enter the jungle (in the Telok Blangah Hill Park), then cross the Henderson Waves bridge and then walk up to Mount Faber."
,,Special city hike,4.0,,This is a rather special and spectacular in-city hike. Go for it if you want a hike combining thick forest with landscaped gardens and cityscape views from the elevated boardwalks.
,,Enjoyable walk through city and forest,4.0,,"This walk is varied and interesting, with some great views. Bring plenty of water (at least 2 litres per person) as it is hard work in the heat! There is water available at Hortpark.

Download a map to your phone as it is not always obvious where to go, especially at the science park end."
,,Great way to spend a few hours,5.0,,"We started our walk from Harbour Front station then onto Marang Rd up to Mount Faber Rd, past chair lift station towards Henderson Waves bridge, its not until you pass Telok Blangah Hill Park the Southern Ridges tree top walk starts, and if you are energetic enough keep walking until you come to Kent Ridge Park from there you can head south towards W Coast Hwy to the nearest MRT station (Pasir Panjang), this walk took us 2.5 to 3.0 hours stopping along the way to take in the views, gardens/plants, places to purchase drinks and look for wildlife, all in all we a had a great time it was good to get away from the hustle of the city, it was well worth the effort, next time we’ll do a similar walk but at night time."
,,Great experience outdoor,5.0,,"Enjoy the air of ""forest"" right in the middle of a noisy and busy city. You can listen to both birds singing and construction noise at the same time. It has lots of exits to get back to the road so you don't need to go all 9km. Super safe with many signs so it's hard to get lost. With western people it's quite hot but for Asian it's totally fine. Perfect for teenagers to spend a day after shopping and eating around in Singapore."
,,A walk in the forest - in the city,5.0,,"The walk was fantastic with diverse vegetation and excellent walking paths. You are in the middle of the forest with a city around you everywhere you look. Strangely, you do not hear the city. Brilliant"
,,Difficult to follow,3.0,,"More a series of short walks as opposed to a long continuous hike. Some parts were very impressive and seemed surrounded in nature, while other times you pass through crowded parks or walk along a road. Signage from one point to another was lacking and we had to backtrack several times trying to find the next section. This would not be a problem if it were a continuous walk, but because this is more a series of short walks, the next section's location was not always obvious. I recommend taking a photo of a map posted on a board for reference during the walk."
