id,uid,title,score,date,content
,,Urban Jungle!,4.0,,"Southern Ridges is a trail that spans three parks across southern Singapore: Mount Faber, Telok Blangah Hill Park, and the Kent Ridge Park. The trail is located literally in an urban jungle; with fantastic bridges over city roads connecting the various paths set along tree tops. During my visit, it seemed that it’s mostly local residents who where traversing the trail as some were friendly enough to greet me in the early morning, as if knowing that I was there just visiting. What a great way to start the day!

The trails are easily accessible by metro and bus as mentioned by previous reviewers. Since I was short on time, I started at Labrador Park MRT and made my way to Harbour Front. This may be actually easier, as you don’t have to walk uphill on uneven terrain at Marang Trail. Try to arrive at around 7:00 AM at Labrador Park MRT to catch the golden morning light at the Henderson Waves, the highest pedestrian walkway in Singapore. The views and the light are fantastic! It took me around two hours to get to the Harbour Front MRT Station, where a hawker center and the VivoCity mall are located nearby.

After your walk, consider a visit to the awesome Haw Par Villa which is only a few stations away on the MRT Circle Line."
,,Easy way to enjoy nature,5.0,,A good walk without the scare of the jungle (and mosquito). Easily accessible by bus 195 from Queenstown MRT or Harborfront MRT
,,Loved every minute of it!!!,5.0,,"This is a must do in Singapore, specially if you like hiking. Bring mosquito repellent and something to keep yourself hydrated. The walk is peaceful; it wasn't crowded at all. Beautiful views and very interesting for architecture lovers like me. Loved it!!!!"
,,top of the world.,5.0,,"Get to the top to see the beautiful scenery...on a clear day . A well-preserved area, beautiful park and spectacular trees."
,,A different Singapore,5.0,,"A rare chance to see a very different singapore. Spend a day away from the concrete jungle and immerse yourself into this southern ridges of nature exhibits. You can start from kent Ridge park and end up at Vivocity.

A must try for all tourists coming to Singapore. And its Free!!"
,,Escape the city but not the heat,3.0,,"The walking trail along the Southern Ridges is a great way to escape the crowds of Singapore. It is possible to walk from Harbour Front via Mount Faber, Telok Blangar Park, Hort Park, Kent Ridge and eventually West Coast Park. That is, however, a lot of walking especially if not used to Singapore's climate.
Accessibility is good, and signage adequate for navigation. Exepect steps and steep inclines. Also expect great views over the Central Business District and Pasir Panjang Port.
For me, the best part is between Mount Faber (home to the Singapore Cable Car) and Kent Ridge MRT station. Refreshments can be found at Hort Park along the way. Just check the weather before you go. Shelters are few and far between and the rain can be.... tropical!
Other essentials to take: Drinking Water, Sun Cream, Umbrella and Insect Repellant."
,,A different side of Singapore =) Hikers and tramping enthusiasts welcome.,5.0,,"If you are wondering what to do in Singapore, a morning spent walking along the trails here is well-spent. I would recommend ending your walk at HarbourFront so you can hop over to Seah Imm Food Centre or VivoCity for lunch."
,,An interesting walk,5.0,,This trail was very enjoyable. We took the cable car to Mt Faber then started the trail from there crossing the Henderson Waves bridge.
,,Great jogging path !,5.0,,This is a great place to jog in a 'trail' so to speak. There are some points of gradual elevation (mount faber and other hills) which can provide a good challenge and the views are great! Not to mention its close to many great food choices after your run to refuel.
,,"Long, winding paths through lush greenery.",5.0,,"My wife and I strapped on our walking shoes, packed a bottle of water and gave this a go. The scenery was stunning and was all the better for having arrived by cable car further down the hill!

If you try and cover the whole distance, you will be VERY sweaty by the end of your trip but well worth it to find another of the 5 Merlions placed around Singapore."
,,Not quite a remote as hoped!,4.0,,"This trail is a good way to (partly) escape the city and the bridges themselves are interestingly built and offer great views into the greenery. However, they do not take you that far from civilisation as the bridges are over roads and past buildings so you never really feel like you've left the city behind. Also the parts of the path away from the bridges themselves are often beside the road or multiple car parks which doesn't aid a feeling of getting away from it all!"
,,Walking above the tree tops,5.0,,This is a unique experience of having the walk above the tree tops . This is absolutely enthalling being able to see the beauty of the greenery from the height . Mind blowing . One can take a long walk or short - there are easy ways to get off point . Ver very enthalling . The maintenance is superb . Do not miss it . Would recommend it highly .
,,"A real Walk in the Park, Within an Urbanised City!",4.0,,"If you love outdoors, nature and tree top walks, this is the place to go, which stretches to various areas of the Southern Ridges, including a nice city view on Mount Faber as well. It is easily accessible by MRT or by car, or if you have money to spare, Cable Car as well. Bring good walking shoes, and water, and a cap and enjoy the long walk."
,,Urban forest walk,4.0,,Easy to reach by local bus. We walked all the way from canopy bridge to the beach front mrt (maybe 5k). We ate lunch at top of the hill next to the cable car station. Route was nice and not very crowded.
,,"Great views, suggest early morning.",4.0,,"We stared from Mt Faber Park and walked for about an hour before the heat got us and we headed back to Mt Faber.

Very easy walking, with great views and lush vegetation. The Henderson Waves section got to me because I don't like heights and it is very high! You can also look through the gaps in the decking at the ground below. I just don't do heights and walked over quickly.
We walked back to Mt Faber as It got to hot for us and then headed to Vivocity shopping centre and cooled down and did some shopping. A great day and enjoyed us all."
,,Great nature trail,5.0,,What a great walk with some awesome bridges by some great architects. It's a full day of out door beauty in the city with some great views.
,,A Very Long Walk,3.0,,"First of all, you need to be really fit to complete this walk. I would say it's a 7-8km walk that will take up around 2-3 hours of your life. I prefer to start at Harbourfront, ending at Kent Ridge, because there's a food court at Harbourfront to stock up on your energy. Make sure to bring a lot of water, the only place to refill is at Hort Park, halfway into the walk. If you're a jogger, then maybe from Kent Ridge to Harbourfront is the preferred route as there's a lot of climbing required from Harbourfront to Mt Faber. There are a lot of rest stops along the way, and in certain areas they are shaded. But if it rains, you're going to get wet. Bring along a camera to get the views."
,,I had no idea...,5.0,,"I've been living in Singapore for the last 2 years and I had no idea these beautiful trails existed. My son visited from America and told me we had to visit -- he was so right!

We started by taking the cable-car from Harbourfront MRT to the top of Mt. Faber, from there we walked a criss-crossing of trails to Alexandra Street and beyond. We did the Henderson wave, the Forest Walk, the Canopy Walk, visited the horticultural gardens. My pocket GPS said we covered more than 10Km of walking, and all in the middle of forests with great trees, flowers, and wildlife (beautiful birds). A great experience.

The terrace gardens were lovely.

Bring water and sunscreen.... this is Singapore."
,,Great walking activity,5.0,,"Be prepared to WALK. Wear comfortable shoes and don't look down if you are afraid of heights. I loved hearing the birds in the trees eventhough they were hard to spot. It is difficult to think that you are in the middle of a sprawling city. It is quiet and peaceful as you walk through the tropical jungle. It is only when you get the odd glimpse of buildings peeping through a clearing in the trees, that you realise you are in the city."
,,splendid views,4.0,,"a walk through jungle environments with occasional views down onto Singapore, particularly from the notable bridges. A great way to experience the contrasts of the real jungle set against the backdrop of the urban jungle."
,,I got lost,3.0,,"Signage was lacking but hopefully was only due to construction works blocking some paths. Be prepared to return to the starting point as is hard to find an exit to public transport along the way.
Watch out for monkeys. Was taking a photo and they tried to get into my backpack."
,,Stunning walk through surprising Singapore,5.0,,"The walk from Kent Ridge MRT station to Harbour Front is three hours of easy walking and is a little known treasure we discovered through local friends. Forget Orchard Road and see tropical birds, stunning views, incredible bridges and lush rainforest. Take water and wear comfortable clothing and a hat. Finish at Harbour Front in the food court for a delicious lunch. Unbeatable."
,,Lovely walk,4.0,,This route offers a lovely slow meander among Singapore's southern hills... as you walk from treetops to hill sides and over the top into the valleys. A very nice way to spend a dry and not too hot late afternoon into the evening cool.
,,Nothing special,2.0,,"I visited Southern Ridges last weekend and it was pretty dissappointing... Theres really nothing special about it. I would rather do MacRitchie reservoir. The walk is kind of boring with a lot of concrete roads, and the bridge is pretty cool... but it s just one bridge... not worth it. theres much better in singapore"
,,Nice scenic walk,5.0,,Really enjoyable walk through some beautiful areas of Singapore. Some great views. take your camera along
,,great walk with beautiful views,5.0,,"Walked the ridges from Kent Ridge (easy access by MRT) to Harbourfront and were treated to beautiful views, lush greenery and amazing architecture (Henderson waves bridge). Stopped at the top of Mt Faber for a quick lime juice to refresh. Thoroughly enjoyed it and highly recommended if you want a break from the hustle and bustle of the city."
,,Amazing views but very hot,4.0,,"I took the bus 124 from Chinatown, it takes you close to the Henderson Wave. Amazing view, very good signs, you cannot get lost (at least until the Canopy Walk, I got lost there). The walk from Henderson Wave to Canopy Walk was about 4hrs. I went for this walk at noon, saw about 10 people en route. Very peaceful.

It is very HOT and there's some climbing, so be prepared. Sun got me off guard and I got a headache despite a scarf, water and breaks."
,,A stroll in the sky,5.0,,"Explore Singapore from another perspective: take a stroll on a suspended bridge that brings you through the jungle's branches until the gentle hills of Mount Faber, with breathtaking view of the city and its southern skyline and amazing artistic curves at Henderson Waves."
,,Stunning Walk,5.0,,"We walked the Southern Ridges walk all the way to Mount Faber and then on to Harbourfront. The walk is truly beautiful and is mostly on suspended steel walking tracks high above the forest floor offering great view of both the spectacular greenery and glimpses of the city in the background. There is also the odd 'black and white' mansion, great examples of older Singaporean architecture. We didn't see any monkeys on our walk but apparently you usually do! We ended our walk with lunch at Vivi City Mall - lots of options to choose from..."
,,My favourite walk in Singapore,5.0,,"I usually start at Kent Ridge Park, accessible by MRT to Kent Ridge, and walk through the many lovely bridges to Hort Part and then on to Mount Faber. The walk/run is 7-8 km each way but is mostly flat and is nicest in the early mornings and evenings. The views of the gardens and secondary forest are great and there aren't usually too many people about so you can enjoy a quiet walk. At night, some of the bridges are lit and are an attraction in themselves."
,,Worth the walk,4.0,,"This made me fall in love with Singapore again. The walk stretches between HarbourFront MRT/Mt Faber and Kent Ridge Park and will take you through quiet greenery, past great views and along interesting bridges and walkways. The best thing about the walk to me was the diversity – it feels like you are covering different areas on the way. Bring plenty of water and avoid the middle of the day when the temperatures are peaking."
,,Great walk!,4.0,,"If you are in good shape, you can do the entire thing in one day. Otherwise, divide the walk into a couple days. Mornings are better since it is cooler."
,,Southern Ridges,5.0,,"If you are found of walking long distances on rough and tough terrian Then this Walk of more then 6 Kms will be refreshing both for your body and mind. Starting from Vivo City , cross the Road and on other side you have a tough exotic wood trail to reach the top. Go to left to visit Trolley station,Faber Mount Park,wave bridge, wood walk,more than 2 kms bridge walk to reach Kent ridge . Very beautiful experience worth the calories you will burn on this Trail.Found of walking must go for this Trail."
,,Escape to the country,5.0,,"We've visited Singapore many times so decided to do something different this time; we walked through the Southern Ridges to Mount Faber Park. We started at the Kent Ridge Canopy walkway, continueing through the Hortpark across the Alexandra Arches, through Telok Blangah park across the Henderson Waves, and through Mount Faber park to the cable car.
It was a brilliant way to experience Singapore; the walk way traverses jungle, woodlands and cultivated gardens along with several themed gardens. It was a hot walk so we appreciated the many shelters set out with drinking fountains and toilets.
We enjoyed the engineering feats and design of the Alexandra Arches and Henderson Waves, and were grateful to come at last to the restaurants at the cable car station! If you're not used to the Singapore heat this is quite strenuous, many uphill sections, but well worth the effort. Apparently you can see monkeys on some sections, but not during our visit."
,,Good Hike With Views To Boot!,4.0,,"This offers a good hike for those who want to be close to nature. It connects several parks in Western Singapore together, and walking from end to end will take about 3 hours.

The trial is suspended high above the roads at some points, which affords you a great view of Singapore's Southern Coastline and surrounding neighborhoods.

However, you need not traverse through the whole trial. Just start from any where in between and when you are tired, just go to the main road and get on public transport."
,,A different side of Singapore,5.0,,"We really enjoyed our walk around the Southern Ridges.
It provides great views of both the strait & the city.
We didn't want to go for a long walk so we caught a taxi to Mount Faber peak (where the cable car ends) and walked from there to the Henderson Wave bridge. It's all downhill, so an easy walk. We then flagged down a taxi at Henderson Rd.
Would recommend for early morning or early evening to avoid the hotter parts of the day."
,,Not for first-time tourists,4.0,,This is a great place for nature lovers but I'd probably not recommend it for first-time travelers to Singapore unless you love outdoor walking.
,,A nice walk and great views,4.0,,Worth going to if you're in town for long enough. Some great views of the city and a great place to escape the urban jungle. Bring a long lens for the views.
,,Back to Nature and in the midlle of suburbia,5.0,,"Fantastic nature walk on the top of Mt Faber. Birds, even monkeys and surrounded by incredible vegetation. Peaceful, serene and not a long walk at all, but a late afternoon or earlier morning walk would be good times of the day to enjoy this."
,,Awesome Place for some Outdoor Exercises,5.0,,"Began the walk from Harbour Front MRT station Exit D, which leads to Marang Trail according to the signboard. There are quite some climbing involved at the beginning, but the view on top is awesome. Once you reach the top, there is just a short distance to the cable car station. It is alright to spend some good time there looking at the wishing bells hanging everywhere nearby the restaurant beside cable car station. You can buy wishing bells at the souvenir shop and make a wish too. The next destination that you could reach is Henderson Waves. The view is nice up there, with the buildings surrounded by trees. It is also a nice place to rest and have some light snacks as the ""wave"" is actually some sort of mini shelter. Overall it is an awesome place with the tracks built right beside the trees and you can even see birds if you are lucky enough. However please spare plenty of time for the visit if you wish to explore the entire Southern Ridges as the journey could be quite time consuming and it is not very accessible to MRT stations (if you are not really familiar with the buses, just like me who always rely on MRT heavily) unless you are willing to walk all the way to return to Harbour Front MRT station. I was so nervous as the time is approaching to my flight but I was still miles away from the airport and I need to grab my bag which was still placed in the hostel I stayed, and I finally found an exit near Alexandra Arch, which is 900m away from nearest MRT station (Labrador MRT)."
,,Take the time to enjoy this walk,5.0,,"We did what other reviewers suggested and took a taxi to Mt. Faber as the weather was very warm and humid. There is a cafe here for a cooling drink before you explore this area. You can enjoy the view of the harbour and city and see the bridge road to Sentosa Island.
This nature reserve was such a relaxing contrast to Singapore City life and seemed under utilised on the day we visited. The Henderson Waves is an amazing pedestrian bridge perched between two hills. The architecture is quite beautiful and the construction over the 300metres is to be admired.
There is a forest walkway, lots of bird life and small animals visible. It was good to have rest areas as the heat and humidity can be taxing.
We decided to walk down from Mt. Faber as it wasn't difficult and crossed the road at the bottom to the Vivo shopping centre where there is an excellent food court and juice bar on the 3rd floor."
,,a 9 km long trail where forest meets high-rises in the Southern ridge of Singapore,4.0,,"Singapore is putting much efforts into preserving its forest and make the city as green as possible. The Southern Ridges one of the results of that strategy.

The Southern Ridges trail consists of 4 parks stretching across the western half of Singapore, with bridges allowing pedestrians to cross busy highways. Several parts of the trail are suspended high above the jungle. This gives a surprising view of the ultra-modern city and how it starts to be integrated into what the green areas that remain."
,,We love this walk,5.0,,There is not a lot of places in the world where you can commune with nature right in the city without having to worry about safety. The Singapore government (we are a big fan) really put a lot of planning (foresight) and resources to bring city living to a different level by providing easy access to green spaces. It's so mores wife how they thought about connecting all these green spaces with tree top walkway. The early morning walk is very pleasant as you hear all sorts of birds calling each other for feeding time. You can see squirrels and monkeys.
,,Just do it!,5.0,,Great walk. Be prepared take water - although you can top up along the way. Gives you a different view of Singapore. Wished I had more time to explore the parks along the way. Do take time out to visit Reflections Bukit Chandu museum located at the end of the Canopy Walk.
,,Cool walk!,5.0,,Excellent way to see Southern Singapore skyline. The sea was filled with ships and we saw plentiful trees among the tall buildings. Can be very hot. We were lucky with a shower (got wet!) but refreshing.
,,Extend it to the full stretch!,5.0,,"The whole area from kent ridge in the west all the way over to harbor front is a lovely stretch of parks and walks, over bridges, through firsts, along green house and on top of several canopy walks. Explore the nature and spot different birds, animals and plants you may have never seen before. The southern ridges are especially nice for the long walk on the metal structure high above the ground and over the wavey bridge even higher above one of the big streets. Highly recommend to walk through the whole area - a roughly 2 hours walk."
,,A nice enough walk,3.0,,"A nice enough, if sweaty, walk with a few interesting things on the way (host park, Henderson waves bridge). Fine if you have time to fill, but lots more interesting things to do/see in Singay"
,,Surprise in a city,4.0,,Lovely walk on excellent pathways with some great views. We walked for a couple hours then caught the bus back to Vivo City Mall. All very easy to do & gives a very fresh and peaceful prospective of this lovely city.
,,Nature Escape in the heart of singapore,5.0,,"didn't know what to expect when we started the walk from reflections at Bukit Chandu, but we were blown away. Amazing jungle scenery, treetop strolling for hundreds and hundreds of metres, hortpark was very nice and the interesting views of the city made this a top walk."
,,Excellent Trekking experience,5.0,,"Excellent trekking experience overlooking half of Singapore.
Must remember to bring a towel and a full bottle of water.
Long 2-3 hour Hike in the urban-inistic tree tops !
If you walk towards the end at Mount Faber, you can take the train (MRT) at Habourfront back to where you need to be."
,,Awesome Hiking place,5.0,,"The southern ridges is all time favorite for hiker either you are beginner or experienced hiker, the experience is awesome."
,,The Henderson Waves makes it,4.0,,This walk is all worth while once you hit the Henderson waves. The walk itself was very nice with a much more jungle like atmosphere than I have experienced in Singapore before. Plan your route a bit before you go as the signs and maps aren't as frequent as you may hope!
,,Nice view,4.0,,Great place to go for a fresh morning walk. Level of difficulty i would rate 2.5/5. Great to go with family.
,,Rare green belt ...,4.0,,"Get yourself a pair of comfortable walking shoes, light clothing, hat with plenty of water to remain hydrated during the trekking. Insect repellent is advisable when enter the greenery of the belt."
,,The elderly should consider taking a taxi,5.0,,"We commenced our walk from the Harbourside MRT station, which probably was a mistake, as the first half mile involved climbing about a million stairs in humidity so intense my suntan lotion slid right off my face. My wife was whining like a British Airways jet full of Poms by the time we reached the top. When I saw the road to the cable car entry I wished we had taken a taxi to the top and commenced our walk from the end of the loop. From there, it is an easy walk to the Henderson Wave, which is an architectural marvel well worth the effort. I agree with all the praise heaped on this free facility by other reviewers. I simply wanted to caution the more geriatric among us that this is not so much a walk as a fight for your life!"
,,Stunning views!,5.0,,"Our journey along the Southern Ridges took us from Kent Street MTR to Vivo City. This walk isn't for the faint hearted, it involves some large climbs and many sets of stairs in some lovely SIngapore humidity.

The first few kilometres isn't as spectacular as the final but still worth it if you are up for it. Once you reach the final stages after Hort Park you will be in for a surprise.

The tree top walks and bridges are world class and the view are spectacular."
,,Bundled it with a visit to SENTOSA,4.0,,"One of the Singapore's landmark, Henderson wave bridge is here. The walk along the whole Southern ridge will take about 1 to 2 hours. View from the top of Singapore highest bridge is amazing. Do visit if time allow you to."
,,tree top,5.0,,must go if you stay a little more in city. Its formed by 3 or 4 parks in south of singapore. It is a tree top trail that you can go from Hort to Mount Faber. Fabulous place for pic nic. If you like nature this place is fantastic.
,,Breathtaking view,5.0,,"Long walk from Hort Park, but interesting , beautiful and refreshing walk all the way . Feel of nature around with the many birds and beetle singing."
,,what a view,5.0,,"could not believe this was in the middle of Singapore. absolutely stunning. BUT make sure you take HAT, WATER, GOOD SHOES. its a LONG walk - longer that what we thought. but sooo worth it. the views, and the jungle canopy over some of the walk and the wave bridge is stunning - almost scary - to me anyways whos scared of heights but did it- we started at Reflections at Buki Chandu - very moving 2nd world war remembrances. then did the meandering walk along Kent Ridge - so lovely and intimate - and then thru Hort Park and then followed the paths and signs and went along the elevated walkways amongst the jungle canopy and the wave bridge. signs about monkeys, but we didn't see any :( took a few hours in all. so really plan it for the day and take plenty of water and snacks. we had water but no food, and were real cranky at the end hahaha but SOOO WORTH IT. MOST AMAZING THING TO DO IN SINGAS !!!!!! jungles and wildlife - beautiful birds - in down town Singapore"
