id,uid,title,score,date,content
70911552,M31****479,,4,2016-02-16 22:17,圣淘沙岛上的娱乐活动很多，新加坡人充分利用了这个小岛。其实沙滩上也不错，人不多，沙子细，大人游泳，孩子玩沙，半天很快就过去了。
70910837,HFHR2013,,5,2016-02-16 22:00,玩儿影城才进去的，有点小马尔代夫的感觉，里面的景色非常漂亮，吊桥不错，拍照片很有感觉
70909056,_JLH****8616,,5,2016-02-16 20:44,非常好的旅游胜地，地方不大，但处处有景色，处处有惊喜！
70907541,oishiijimmy,,4,2016-02-16 19:25,很漂亮！！很后悔一个人来了这里&#x20;应该和女朋友一起来这么浪漫的地方～值得去值得去
70907142,234****932,,5,2016-02-16 19:07,圣淘沙岛上可以玩得项目非常多，尤其适合带孩子的家庭，这里有环球影城，海洋公园，水上乐园等等，可以选择住在岛上，这些项目玩个2天也玩不完。
70904587,游在水里的鱼,,4,2016-02-16 17:21,很好的一个吃喝玩乐的地方，适合小孩子和年轻人玩一整天。
70902753,Nevila,,4,2016-02-16 16:08,一般般。沙滩景色远比不上周围几个国家有名的沙滩，价格巨贵...不过基础建设很不错，干净，有一个比真的鱼尾狮还要大的鱼尾狮雕像，很新加坡。
70899857,210****199,,4,2016-02-16 14:37,这真是个高大上的地方，想买名牌的话，这确实是个好地方。
70900076,300****925,,4,2016-02-16 14:37,不错的度假胜地。非常适合旅游&#x20;&#x20;。
70898770,ajamy,,4,2016-02-16 13:55,应该说新加坡值得带小孩玩的基本都在圣淘沙了，包括环球影城、海洋馆、海底世界、缆车等等，从沃丰城走步行道上岛节假日免费（平常1新币）比坐捷运省钱，进了岛之后再坐捷运就不要钱了。也就走个10来分钟
70898661,老程66,,5,2016-02-16 13:33,好玩的地方，建议新加坡游在岛上住两天，环球影城和水上乐园都好玩，地方不大，但比较精致。不错。
70890501,elle****1982,,4,2016-02-16 12:22,个人觉得岛上路线和交通有点复杂，各种项目中比较喜欢时光之翼。
70890053,游泳的鱼,,5,2016-02-16 12:00,小岛不大但是景色不错，游乐项目设计合理，适合亲子出行，这次在携程上预订了瑞享酒店，处于小岛中心区域，步行很短就到景区非常方便！
70889591,RainyGoo,,5,2016-02-16 11:40,完全的旅游岛，在岛上有吃有住有玩，可以乐不思蜀，节假日走进岛免费，岛上消费档次相比市区稍高，价格也稍贵
70889453,288****157,,5,2016-02-16 11:36,参观了海洋世界，看了4D电影，还坐了lounge。很开心！
70888842,飞鱼兔,,5,2016-02-16 11:10,圣淘沙很大，两天紧密的安排才有可能遍览。环球必须一天，进园后安排路线抓紧时间。海洋馆，水底世界，有人说还没有大连的好呢，但是又在个别细节上会设计独特体验。其余几处景点需要由岛内的免费交通相连。海滩也要看看，站在亚欧大陆最南端时，才有资格说这也没什么。有条件的话，住在岛上，都会是充实的两天，更别提从市内赶过去的亲们了。
70888070,Barnett Sun,,5,2016-02-16 10:54,岛上玩的多&#x20;西索洛海滩不大&#x20;丹戒还好&#x20;连着亚洲最南点
70888027,wange2008,,5,2016-02-16 10:50,当地人休闲的地方，虽然不是很大，但设施完善，海水干净。
70885411,lulusun728,,4,2016-02-16 08:38,海滩可以踩踩&#x20;但是游泳不行&#x20;有小车子可以免费坐来回
70884118,203****335,,4,2016-02-16 07:25,在岛上逗留三天，纯人工景观，娱乐性强，较适合亲子游。新加坡面积小，资源少，只有靠打造人造娱乐设施来吸引游人，来一次足矣
70880452,M18****090,,5,2016-02-15 22:29,赞的，不错的一个地方，去新加坡一定要去的。
70879346,madong_2009,,5,2016-02-15 22:08,印象最好的是那里的野生动物园，开放式的，还有海边的沙滩
70872433,可心爹爹,,5,2016-02-15 16:54,值得一去的地方景色环境绝对一流建议大家尽量多玩一玩这里这次在这里住2晚有些紧张了！
70867591,M18****024,,5,2016-02-15 14:08,带孩子玩乐的好地方！还偶遇了偶像袁咏仪，好开森！
70867396,鼻子,,5,2016-02-15 14:06,相当好相当漂亮的城市花园，现在每个城市都应当往新加坡这个方向去发展，街道干净整洁，居民素质极好，交通便利，饮食健康卫生，建筑美丽大方！
70865849,_CFT01****3499293,,5,2016-02-15 13:22,去新加坡十天没玩儿够。还想去玩儿
70863908,cici hung,,5,2016-02-15 12:02,岛上都是休闲娱乐的地方，基本上不用出去了
70855938,涓子,,5,2016-02-15 00:34,新加坡最好玩的景点聚集地，景美服务好
70854248,carrie213,,5,2016-02-14 22:54,圣淘沙的环球影城机动游戏不错，还有滑车很有兴趣。
70849750,收房,,5,2016-02-14 19:46,开发的非常完善的一座小岛，用心在经营
70848311,yaj****ai,,5,2016-02-14 18:02,植物漂亮&#x20;装饰漂亮&#x20;玩的挺多&#x20;各种喷泉&#x20;激光秀都不错
70846800,e00****57,,5,2016-02-14 17:10,圣淘沙是个值得去的地方，特别是带着小孩去会很有意思。
70838964,CM哥哥,,5,2016-02-14 12:28,一个结合景点和游玩的地方，适合一家大小，男女老幼皆宜。
70838908,_M13****8836,,5,2016-02-14 12:25,去了sea海洋馆和亚洲最南端！很美！但是建议大家一定要避开公众假日，否则各种印度人！
70835058,Ivan,,4,2016-02-14 10:09,新春的圣淘沙又是一番新年快乐的气氛，还有响鼓可以敲。
70831997,权真沉,,5,2016-02-14 06:53,新加坡的旅游胜地，有环球影视城等诸多可以玩儿的地方，但是岛很小，环球里面的项目也很小，需要排队的时间很长…性价比一般哟
70831972,Jalen,,4,2016-02-14 06:34,屌。&#x20;一生值得去一次。&#x20;&#x20;爽&#x20;的
70827131,腐琴琴,,5,2016-02-13 22:00,海滩游泳，很爽，海边有更衣淋浴设施。西乐索炮台，风景很美，免费的哦。
70821985,rai****_nz,,5,2016-02-13 18:40,圣淘沙很棒，我们这次去一整天都泡在圣淘沙，4新币的轻轨一天内圣淘沙可以随便坐，早上开门先去环球影城，变形金刚需排比较久的队，别的项目都还好，半小时内都能玩上，我们1月底上午10点半进园下午4点半出园，想玩的项目都玩到了。海洋馆不推荐去，不如上海海洋馆内容丰富。亚洲大陆最南端这个地标还不错，我们去的时候正好夕阳西下，蛮美的，吊桥也很有感觉，晚上还有灯光秀。总的来说这次新加坡之行最推荐的就是圣淘沙这一天～
70822062,Elaine_Yin,,5,2016-02-13 18:25,没有怎么晃荡，不过好的是新加坡不大，走着走着就是景点。
70821961,ja****g75,,4,2016-02-13 18:17,趣味大赏，个性化彰显，虽然非常多的游客但非常有秩序！
70820381,jacky800328,,5,2016-02-13 17:06,岛上到处都是景点，环境优美，沙滩美美哒，如果住在岛上就最方便了！不过，价格是市区的两倍左右。
70818803,一直在路上,,5,2016-02-13 16:11,环球影城很不错，还有6D电影可以看，风洞也好玩
70816514,自得其乐1977,,5,2016-02-13 14:49,环球影城很棒哦！水上乐园也很好！景色也不错啊！
70814522,姜炜,,4,2016-02-13 13:28,节假日人很多，建议平时去，错峰会有惊喜，吃喝玩乐一应俱全，如果住在里面可以玩两三天。
70812675,hidaishanshan,,5,2016-02-13 12:30,"环球影城，s.e.a.,太多玩的了，有30多个玩的项目。不过孩子最爱的是挖沙子，虽然palawan和siloso沙滩的沙滩真的一般，无奈娃喜欢啊，从早到晚，挖了一天沙子"
70812047,小宇,,5,2016-02-13 11:53,玩了几次都玩不够的地方，建议多点时间去逛，不然很大，根本逛不完
70811643,M15****928,,5,2016-02-13 11:31,非常适合亲子游，特别是环球影城，水上探险乐园，斜坡滑车都很有意思，里面的交通都是免费乘坐的，非常方便
70810112,M26****848,,5,2016-02-13 10:31,非常適合親子遊，一定要住在島上至少2晚，1天遊環球，其它時間留在島上的沙灘玩樂
70809458,蛋糕1107,,5,2016-02-13 10:22,海边风景不错很适合家庭出游，住在岛上的酒店交通便利环境也好，除了岛上的各种游乐景点，在海边陪小朋友也可以呆上大半天！住在了palawan海滩这面安静些！就是吃饭除了酒店就要到名胜世界那面去，海滩边上的饭不好吃！
70808628,tir****u023,,5,2016-02-13 09:46,很不错的度假岛。除了环球影城，海洋馆。其实单独的岛也值得玩儿。椰子冰激凌值得一试。
70804033,chef_pan,,5,2016-02-13 00:26,这里确实不错，有点感觉是个城市的缩小版，沙滩，轻轨，我还会再去一次，当然是带着我家宝宝去！
70802770,忙里偷闲三两天,,5,2016-02-12 23:37,美丽的小岛。因为一天是在环球乐园，半天去了海洋馆，所以在岛上时间不长。后来才发现岛其实很大，风景不错，很多人就是坐在海边吃吃睡睡&#x20;海里游泳也是非常不错的。岛上有很多游乐设施，收费的，也没有时间体验了，作为度假地还是很不错的
70801794,anan6691475,,5,2016-02-12 22:54,好玩，而且新加坡属于发达国家，设施和人的素质都没得说
70800751,高傲的女人,,5,2016-02-12 22:07,适合所有人去游玩的地方！设施很齐全，环境不错，干净，交通便利，可以坐缆车、捷运、岛内免费巴士；环球影城内的项目适合各个年龄段的人，有惊险的、有欢快的、有刺激的……
70799919,馍馍妈,,5,2016-02-12 21:46,国外景点胜在管理和规划，圣淘沙真是亲子游的天堂！麻雀虽小五脏俱全！
70800161,guoguo1019,,5,2016-02-12 21:45,从入岛一直走到亚洲最南端差不多需要20分钟，沿途的风景不错，还有很多适合孩子玩的游乐设施，带孩子来的话最好步行
70796336,e01****32,,5,2016-02-12 19:11,坐着缆车抵达圣淘沙岛，一路从空中俯瞰美景。到达岛上，首先映入眼帘的是杜莎夫人蜡像馆，一路乘着扶梯，欣赏两边的绿植，小花和闲逛的孔雀，来到了鱼尾狮身像前，留影拍照后，下来就到了最热闹的娱乐中心，节庆酒店，hardrock，环球影城，海洋馆，水上探险乐园，各种美食，马来西亚美食城，鼎泰丰，众多奢侈品牌都积聚在此。吃喝玩乐一应俱全。乘坐岛内免费捷运，来到海岛沙滩，安静修养，孩子戏水挖沙。也可以选择步行来到岛内，一路扶梯跨海美景，十分钟即可上岛，直接来到欢乐世界。
70789947,TT妈,,5,2016-02-12 14:43,沙滩--在上面走走、海里游游、沙很细、那儿还有花、也很美！
70788178,189****1580,,5,2016-02-12 13:25,这里的激光表演可以看看，效果很棒！
70786346,ace****om,,5,2016-02-12 12:06,非常棒的旅游景点！住了三天，交通方便…各种设施非常完善！海滩人不多！很舒服！
70785039,yu****21,,5,2016-02-12 11:20,一个适合亲子游和休闲娱乐的度假胜地，小朋友玩的超级high，岛上的各个景点的服务也可圈可点，穿梭巴士想过当方便。只可惜感觉预留的时间太少，三天玩不够啊。
70783280,e13****99,,5,2016-02-12 10:08,亲子游蛮紧凑的地方，不会太累，环球影城，带沙滩的度假酒店，到处都能玩水。
70783572,奥里萨巴孙亮,,5,2016-02-12 09:53,圣淘沙岛上有很多娱乐设施，这次由于时间有限，我们只玩了一天的环球影城，由于真赶上猴年春节，影城内人很多，许多节目要排一小时的队，不过还要点赞一下。
70780784,大茴香,,5,2016-02-12 07:38,值得亲子活动游，能够愉悦的玩两天！
70779795,mac****121,,5,2016-02-12 03:34,为了merlone去的～过去很方便，岛上有环球乐园，门票太贵没去，哈哈…值得一去的地方～ps.有好多鸡蛋花树哦
70779318,Maggie-Queen,,5,2016-02-12 02:01,世外桃源，值得一住，环境幽静&#x20;交通方便。
70774799,M18****470,,5,2016-02-11 21:57,非常好完，环境很好，空气清晰，在国内三亚也很难享受的好环境
70770112,M22****973,,5,2016-02-11 18:11,去年圣诞节去的，值得一去的地方，很美，建议岛上玩2-3天，环球影城玩一天，沙滩玩一天
70766611,M10****620,,4,2016-02-11 15:08,挺美的地方，可以一揽新加坡海峡美景
70761617,求索,,5,2016-02-11 11:15,看准地图，先坐车游览，再坐缆车观光！最后海边休息…完美！
70758707,m28****78,,5,2016-02-11 08:53,岛不大各种玩乐设施齐全，吃东西比较贵。。
70758653,yanyan,,5,2016-02-11 08:31,这里有带美国大片故事情节的疯狂过山车，还有美丽沙滩、跨&#x0A;海索道……
70757777,devilcry,,5,2016-02-11 07:46,觉得是新加坡最好玩的地方。集中了新加坡几乎所有的好玩的娱乐项目。环球影城、海洋馆、水上探险乐园、ifly、时光之翼、斜坡滑车、鱼尾狮塔、昆虫蝴蝶公园等等等等！无数新奇好玩的娱乐项目和漂亮的海景在等着你。置身圣淘沙岛，到处可以体验到人性化的设计设施，方便快捷。快捷小火车在城市上空来回穿梭，彷佛置身科技都市！推荐最好在圣淘沙岛住几天。感受阳光、沙滩，感受新奇刺激的娱乐项目，会让你流连忘返！
70754354,红粉巫婆,,4,2016-02-10 23:11,这个小岛，值得去的地方太多，一天根本不够。
70749637,_WeCh****62145,,4,2016-02-10 19:38,对于新加坡印象开始于小时候看人在旅途开始，年底去了趟新加坡，确实是一个用心的城市，干净整洁政府高效，圣淘沙的环球影城必去
70749500,八月雪花飘,,5,2016-02-10 19:36,太美了。下次一定一定还会去。强烈推荐。
70747473,_m13****5508,,5,2016-02-10 17:15,特别喜欢这边的环境，像进入一个大花园，到处都是泳池，感觉很好，玩的多，比较集中，餐厅好多，不用担心了，就是餐厅要另收10[%]服务费，还有5[%]税金，立马贵了很多。环球世界，感觉比较小，一般。携程上的票使用很方便，可以刷码进去，海洋世界留到下次再来。
70743916,189****8366,,5,2016-02-10 13:58,圣淘沙的沙子很干净，踩着很舒服，做开放的缆车很刺激，做着单人滑板超好玩。真心推荐。
70741046,蔻蔻丽,,5,2016-02-10 11:12,圣淘沙可以玩两天，建议住在岛内，进出游玩方便，岛内交通方便，沙滩也很棒，总之一次玩不够。
70740652,118****552,,5,2016-02-10 10:39,景色迷人，游玩项目丰富，是全家大小旅游的好去处！
70740330,弗雷德里克斯堡狄青,,5,2016-02-10 10:22,可以1楼步行10分钟，也可以3楼坐小火车4新币。岛内所有交通免费。第一站主要玩影城和SEA海洋馆。然后建议直奔第三站海滩。东面有2处海滩，西面有1处海滩——但比较大。Luge很不错，很多都坐好多遍。ifly很刺激，建议提前续约。祝大家玩乐愉快！
70734311,110****311,,5,2016-02-09 22:42,一张票随便玩，沙子很白，现场很多人在玩。有时间的话还可以租一辆电动车随意跑，值得一看
70732056,Ivan,,5,2016-02-09 21:04,这个美丽的小岛，有环球影城，还有美丽的沙滩和海景。
70729527,确否,,5,2016-02-09 18:31,非常好玩的小岛，有风洞飞行，沙滩，酒吧，
70725299,夕照寺,,5,2016-02-09 13:36,非常值得去，尤其是带小孩。环球影城，海滩景色精致。
70725501,100****859,,4,2016-02-09 13:30,挺好的，我喜欢！环岛的公交车还免费！赞一个
70719833,_WB3****312,,4,2016-02-09 02:08,还可以，周边很舒服，捷运挺方便的，才四元新币还包了门票，景色宜人！
70718382,微兮,,5,2016-02-08 23:28,环球影城不大但适合亲子游玩，水上探险乐园的浮潜超级棒，西乐索海滩也很美。
70718101,M29****090,,5,2016-02-08 23:08,美的让人舍不得睡觉！美景！美食！
70716607,GRACEJUN新博,,4,2016-02-08 22:12,想出行方便&#x20;建议住在本岛，想安静度假，住圣淘沙岛！岛上酒店价格普遍比市里贵些。
70716311,M18****044,,5,2016-02-08 21:30,很方便，非常适合亲子游。小朋友们超级开心。
70712462,_M13****6777,,5,2016-02-08 17:02,各式玩乐俱全，可以呆上三五天！
70710909,七荤八素,,5,2016-02-08 15:26,岛很小，趣味性越来越低，这几年去了几次，基本无变化。
70705010,lynn2004,,5,2016-02-08 07:41,新加坡最著名的游玩景点，一直在更新改造，值得一去再去，儿子超级喜欢，孩子的天堂
70704358,kittyjessica,,5,2016-02-08 03:09,圣淘沙有很多娱乐设施，非常适合带小朋友去玩，大人玩也很有意思
70700430,7daisy7,,5,2016-02-07 23:30,从市区搭乘缆车、轮渡或汽车只需几分钟便可到达。
70695847,雪灵严严,,5,2016-02-07 17:14,圣淘沙岛是到新加坡必到的地方，无论是住宿，美食还是玩乐都没有遗憾，非常值得推荐！
70692177,118****454,,4,2016-02-07 12:53,很人性，很合理的地理布局，没有想象中大，免费的小火车很方便。海滩边的人行道都有遮雨棚，考虑很周到。
70692081,CICI,,5,2016-02-07 12:30,新加坡旅行一定要去圣淘沙！！景色优美，气候宜人，街道干净大气，各种年味儿。最重要的是&#x20;名胜世界主干道的顶棚，刮风下雨都不怕了！
70689315,augustwuwing,,5,2016-02-07 08:46,度假的话是个不错的选择地，吃喝玩乐一应俱全！好！
70689016,vivilin0826,,4,2016-02-07 08:28,环球影城不错！适合喜欢玩游艺项目的人！74新币&#x20;！
70688618,139****0874,,5,2016-02-07 07:57,有免费的公共沙滩和和各种娱乐活动，环球影城啦，缆车啦，海底世界啦，还有无敌海景，必须在这里住两晚，否则新加坡最精华的就玩不到了。
70686642,maple_j,,5,2016-02-06 23:35,推荐三处sea海洋馆，环球影城，时光之翼，行程可以2天，个人觉得住vivo就可以，主要逛街吃饭都方便，小火车用mat卡就可以，很方便。不同颜色的小火车，是一样的，每站停。海鲜共和国可以吃晚饭，时光之翼边上的酒吧晚上可以做做，在沙滩里，可以听海浪声，吹海风，很赞。
70684720,M25****363,,5,2016-02-06 21:57,缆车、水族馆、环球影城巴拉巴拉都是很好的游玩项目，这次唯一的遗憾就是没有看成晚上九点开始的仙鹤芭蕾
70684251,weak****1cn,,5,2016-02-06 21:06,比想象中的好，海滩设施很完善，玩乐项目都很好，就是吃饭没有性价比
70683366,202****829,,5,2016-02-06 20:27,好吃又好玩，非常适合带小朋友玩，环球影城效果棒棒哒
70682676,M16****208,,5,2016-02-06 19:20,吃住玩都可以在岛上。环球影城值得玩。变形金刚，木乃伊建议下午去人少。我们就是上午去的变形金刚排队2个多小时，下午再去十几分钟。圣淘沙晚上有焰火表演要买票的。其他的娱乐项目也挺好玩，都玩过来得玩两天。
70680728,赵虹广发礼品卡1,,4,2016-02-06 16:53,3D变形金刚最值得玩，大人小孩无一不爱
70680488,200****072,,4,2016-02-06 16:49,住了两晚，岛不算大，岛内交通方便，可以买个通票，有多种选择，根据自己的时间，可以在多个项目中任选几个买通票，一天的时间79新币可任选3个项目玩，比较划算，附图说明&#x0A;。总的来讲岛内景色好游乐项目还是挺丰富的，值得来。
70676250,135****4466,,5,2016-02-06 13:19,慢步在岛上，一处一景，令人心旷神怡，吃喝玩乐应有尽有，最好呆两天时间，要不然会很紧张！
70673384,286****264,,5,2016-02-06 11:07,山顶滑坡缆车很好玩，当地买票，25新币，3次！
70671695,_M15****5095,,4,2016-02-06 09:08,花4新币入岛，还有2日联票（我们后来从发现）打6折，如果想看全景，直接上老虎塔，岛鱼尾狮塔下面看看就可以了
70671821,266****798,,5,2016-02-06 09:08,很适合休闲一族们去的乐园，或刺激，或浪漫，或悠闲，真是玩玩好开心，不需此行。
70669471,丹丹,,5,2016-02-06 01:06,在圣淘沙玩了3天，岛内交通便捷，有免费捷运去很多好玩的地方，比如帕拉湾海滩，名胜世界里的海洋馆，环球影城，水上乐园，当然还有购物，吃喝玩乐齐全
70668842,133****0319,,5,2016-02-06 00:08,玩的地方很多，两天时间可以大概玩遍
70666471,288****920,,5,2016-02-05 21:48,值得一去，很多地方没时间转了，景色好美，但公共沙滩很小，酒店的应该不错
70663085,锦绣豆豆,,5,2016-02-05 19:13,悠闲，静谧美，是亲子和情侣们手拉手闲逛的好地方。
70662796,138****3117,,4,2016-02-05 18:47,孩子体验了FLY这个项目，教练还表扬说飞的挺好，就是没提前订票，当场买票价格贵许多，还玩了吊椅和滑车。总之景色不错。
70661725,yb****don,,4,2016-02-05 18:20,我个人觉得一般，不会去第二次。
70657697,plm0728,,4,2016-02-05 16:49,应该是新加坡必去景点吧，首先交通很方便，机场转个地铁到怡丰城，凭岛上预定的任何一家酒店的预定单就可以到三楼领取免费车票，坐小火车进岛。然后酒店会给免费三天的车票给你，可以在岛上任意坐车，这点是很方便的。吃的地方可以选怡丰城的大食代，东西很多也不贵。吃完还可以在里面逛，里面的东西很便宜，买够一百块还可以退税。岛里面玩的东西也很多，但是都是要收费的，可以选择性的玩，就算不玩，在酒店游游泳，晒晒太阳也是很好的。两天都没玩够。
70658141,M24****702,,5,2016-02-05 16:47,这里的空气很好蓝天白云，真想在岛上摆张沙发床静静的享受
70654852,1380845,,5,2016-02-05 15:36,圣淘沙的环球影城、水上乐园海豚互动，4D影院都是值得去玩的，小朋友很适合。
70649172,菲妈,,5,2016-02-05 13:31,好好玩，只在岛上住了两天，觉得不够，住个三四天感觉才能玩遍
70648537,小爱施,,5,2016-02-05 13:27,岛上娱乐施舍很多，交通也方便，捷运、电瓶车都可以免费乘坐，特别推荐斜坡滑车，超好玩，小朋友玩了3、4次，有2条不同的赛道，门票可以直接去现场买，有家庭票，比网上的便宜
70648981,135****1956,,5,2016-02-05 13:27,景色很好，也很方便，就是里面的消费太高。
70643083,be****nu,,4,2016-02-05 11:29,适合带孩子来玩，岛不大，但是景点很多，适合在岛上住几天慢慢玩！
70637324,202****956,,5,2016-02-05 09:07,很好玩，建议多呆待几天，特别适合小孩
70636951,an****eaf,,5,2016-02-05 08:18,入岛方式有好几种，我们是出租，从滨海湾出发20新币，入岛收费处看了酒店入住单免了入岛费用，到了酒店checkin后给了3日入岛票，去vovocity的时候回来用了一次。岛上风景还行，沙子也蛮干净的，鱼尾狮爸爸很大，晚上眼睛和嘴是红的，有点吓人。
70636451,xi****720,,5,2016-02-05 07:34,为了环球影城去的，很棒！里面的娱乐项目太刺激了我喜欢！
70634799,携程旅行顾问leon888888,,5,2016-02-05 01:44,度假游乐胜地，特别适合亲子游，非常推荐！
70632793,_bbc****84241,,5,2016-02-04 23:06,干净，玩水的好地方！景色也不错！
70631348,月灵双舞,,5,2016-02-04 22:04,岛上很美，去环球影城也很近，度假的首选！
70631068,沙漠之王,,4,2016-02-04 21:45,它是一个综合性大型游玩场所，有沙滩，有过山车，有变型金刚，有小火车等等，不错的地方
70630573,奥古斯都,,5,2016-02-04 20:54,典型的热带海滩，白色沙子，快去度度假吧
70629530,_WeCh****52480,,5,2016-02-04 20:29,值得去的地方，风光旖旎，大自然赋予我们的神圣地域
70629629,E32****266,,4,2016-02-04 20:15,前年跟团去的，导游不错，但在圣淘沙放的时间太短，四处看了一下啥也没来得及玩就走了。很遗憾哪
70629218,E32****230,,5,2016-02-04 19:55,去过无数次，还是很爱圣淘沙的海，海可以从这岸游到另一个小岛，景色很棒。
70628988,E32****656,,5,2016-02-04 19:46,来新加坡必去的地方啊，乘坐地铁紫线和黄线到怡丰城下车&#x20;很有情调的餐馆服务的很热情
70621409,如一加加,,5,2016-02-04 16:29,缆车看风景超级美，就是没有空调，白天去会有点热，极地海洋世界也不错，带小孩子去很好
70615889,138****9891,,4,2016-02-04 14:50,风景怡静优美，项目缤纷多彩，可以再去，可以小住。
70612745,_WeCh****16653,,5,2016-02-04 13:18,环球影城，海洋馆，还有各种室外娱乐项目，除了有点热，其他都很好。记得有一个娱乐项目是从山坡上自己开小车滑下去，好像叫什么“一次不够”的，特别好玩，真的玩了好几次还不想走。
70598447,陈小陈,,5,2016-02-04 02:18,非常适合亲子游的家庭，度假综合体总有你喜欢的项目，住上几天都不会无聊，交通设施也很方便出行，我们一家去过两次还没有玩遍！
70597695,wq****i,,5,2016-02-04 00:21,很适合带孩子去玩，各种娱乐设施。最好在岛上住宿，方便游玩。推荐去水上乐园，可以和海豚亲密接触。
70597385,旅游面包,,5,2016-02-03 23:44,价格便宜量又足的旅游地点，从vivo边的桥走路进去能省下小火车或者缆车的车费
70596317,M29****090,,5,2016-02-03 22:55,住不够的美景！看不够的舒适！还要去
