id,uid,title,score,date,content
139197305,coldwar,,5,2017-10-12 13:16,圣淘沙是新加坡最好玩的地方了，不过在整个新加坡的消费都比较贵，尤其是圣淘沙，环球影城和海洋馆都是值得一看的，舍得花钱的可以在圣淘沙住一晚上，节庆大道非常热闹，还有缆车和海滩。
138842759,M46****912,,5,2017-10-09 22:08,方便，快捷，以后还是携程订票。
138812058,暖暖的玲儿99,,5,2017-10-08 20:48,圣淘沙四面环海，拥有新加坡三个最美丽且各具风格的海滩—西乐索海滩、巴拉湾海滩与丹戎海滩。高耸的椰树，随风婆娑；稀稀落落的茅亭，更增添沙滩的南洋风情。特别给力的是入岛后的交通工具如捷运、循环行驶的岛车都是免费的哦！
138735830,205****379,,4,2017-10-06 19:23,去的时候下雨，没怎么玩，而且很多没开放，有玻璃桥和高空秋千，看着很刺激，但是下雨秋千没开，以后有机会再去
138718653,enjoy4321,,5,2017-10-06 11:10,岛上环境很好，建议住一晚岛上，在岛玩上一两天。除了享受酒店设施，还能享受岛上的宁静，很不错。上岛也很方便，我个人喜欢坐地铁到vivoCity站，沿着海边吹着海风走上十来分钟上岛，沿途还能欣赏风景拍拍照，况且都有遮阳棚和扶手梯的，很轻松就到。
138693732,意大利之夏,,5,2017-10-05 18:39,到新加坡应该玩的项目～值得一去&#x0A;
138659659,M41****892,,5,2017-10-04 19:56,新加坡著名的度假胜地，有很多玩乐的东西
138659264,M41****443,,5,2017-10-04 19:45,可以体验跟多娱乐设施，著名景点。
138636580,旅游不能盲目,,5,2017-10-04 02:41,海水很清澈，空气很清新，心旷神怡
138618147,xu****369,,5,2017-10-03 15:59,住的不错，环境也很好，还有好玩的地方
122318529,Fiona-xie,,5,2017-09-27 18:14,每次出游都选择携程定各种票，方便又快捷。
122309997,_CFT01****1503043,,5,2017-09-27 09:02,很喜欢这个风景宜人的岛&#x20;里面有很多高级酒店
122260174,辰星宇90,,5,2017-09-24 08:00,前年暑假去的圣淘沙，太大了，一天玩儿不过来，非常刺激，今后有机会再去一次！
122258092,小美不姓孙,,5,2017-09-24 05:52,玩的很多，热热热，带泳衣，去之前搞清怎么坐捷运到每个娱乐项目，省时间。缆车很贵，33新币每人。还是住在岛上方便，一天玩不完，
122257451,SISISIY,,5,2017-09-24 00:12,500公顷大的岛屿居然有这么多的玩乐项目，3天3夜都不够呀
122229252,语溪,,5,2017-09-22 08:54,圣淘沙是新加坡顶尖的度假胜地，娱乐休闲购物美食应有尽有。绿意盎然的热带雨林，黄金的沙滩，垂涎欲滴的美食，各种品牌的物品，还有最棒的环球影城。大人小孩都适合。而且环境相当干净整洁。尤其是孩子的天堂、乐园。
122228437,M42****481,,5,2017-09-22 07:19,非常美丽的一个小岛，难忘美丽的海滩和电影院
122189758,grace,,5,2017-09-19 20:06,现在去的人少了，以前去新加坡的必去景点之一。
122119505,D21****50,,5,2017-09-15 16:15,来新加坡必去的一个地方，有的吃有的玩还可以小赌两把，真的太棒了。
121698286,维克多一只耳,,4,2017-09-14 17:17,岛不大，但是娱乐内容很丰富，景区管理服务很到位，走路逛完全岛很累，可是每个小馆之间的距离不远。
121571790,颍川文岸,,5,2017-09-14 14:54,体验很好，快捷票很受用！免去了排队的痛苦
121299074,WJ小居居,,5,2017-09-13 23:38,圣淘沙一日游，妥妥睡个自然醒。海洋馆是她去的第三个海洋馆了，还有做了捷运，逛了糖果王国，踩沙子和海水，很开心。妈妈很不靠谱，带娃走了很多冤枉路，娃很靠谱，不嫌弃妈妈，还指出妈妈的错误。
121285711,_WB6****555,,5,2017-09-13 09:47,岛上可大了&#x20;有很多的酒店和游乐设施等等
121283000,开拖拉机De王大壮,,5,2017-09-13 07:05,圣淘沙岛是新加坡本岛以外的第三大岛。现在圣淘沙是新加坡顶尖的度假胜地，也是亚洲区域首选的娱乐景点。面积大约500公顷的圣淘沙岛拥有各式各样的主题景点。
121279018,瓦尔-蒂利兹宣统,,5,2017-09-12 21:34,交通便利，阳光，沙滩，浴场，海浪，太美了。步行走跨海步道（长500米，带顶的长廊式，也有地面扶梯），走路，也就5分钟就到圣淘沙。岛上的交通免费，游泳+泳后冲水免费，只是些大的活动项目收门票，岛上的公共区域都是免费。
121245527,_ucwe****935753,,5,2017-09-10 19:19,十分合算！性价比高！妈妈腿脚不好！带她逛着看看很方便！非常不错
121244243,Kelly郡主,,4,2017-09-10 18:02,玩了整整一天，刚到那里就下雨了，所以第一站就去了海洋馆，逛了一小时出来雨停了刚好去环球影视玩一圈，里面的海滩捷运是免费的哦，不过去的时候是周末人有点多，晚上去看了时光之翼，看完搭捷运出来吃了海南鸡饭，愉快的一天！
121231807,漢江鴨鴨,,4,2017-09-10 01:43,聖淘沙，在新加坡本島以南五百米處，面積約3.47平方公里，是新加坡本島之外的第三大島。殖民時期，聖淘沙是英國海軍基地，島上還留有建於1880年的英國碉堡西洛索炮台。現在的聖淘沙島，已被開發成為設備齊全的海上樂園，島上的海洋博物館，陳列有新加坡港的歷史、航海術的發展歷史等資料，以及新加坡居民早期的生活用具和生活方式。聖淘沙島集主題樂園、熱帶度假村、自然公園和文化中心於一體，是新加坡旅遊和娛樂業的璀璨明珠，是人們休閒、度假、旅遊的好去處。
121231146,_CFT01****2753231,,4,2017-09-09 23:18,#圣淘沙岛##新加坡##亚洲大陆最南点#&#x20;本次行程最装逼景点达成，不过海滩本身的沙子也很细，也非常干净，岛上散养的孔雀到处跑来跑去，通往亚洲大陆最南点的浮桥在海面上被吹得像在荡秋千。
121204292,winni9797,,5,2017-09-08 12:09,新加坡南部岛屿。位于新加坡本岛以南500米处，东西长4千米，南北宽1.6千米，面积为3.47平方千米，是新加坡本岛以外的第三大岛。在圣淘沙岛殖民统治时期为英国海军基地，旧名绝后岛，1972年改名。现已开发成设备齐全的海上乐园。岛西端的英国碉堡西洛索炮台建于1880年。5世纪的古炮保存于此，内有复杂的地下建筑物城墙和炮座、大炮、臼炮。海洋博物馆陈列有新加坡港历史、航海术的发展过程等资料；新加坡居民早期使用过的独舟、原始的捕鱼方法、渔具等都用木板。
121203454,M17****301,,5,2017-09-08 09:56,很多到新加坡游玩的朋友会选择的景点，里面还有沙滩，海浪，不过没有仙人掌哦，哈哈哈，还是会很值得去的
121183885,ay19,,5,2017-09-07 07:28,新加坡的度假胜地，见意在岛上住一到两晚。
121159653,M23****2459,,5,2017-09-05 16:36,挺不错的，玩得非常开心，下次约上朋友一起再去那边玩玩
121107199,khcc,,4,2017-09-04 00:17,圣淘沙岛除了美丽的海滩，近年更打造成拥有世界水平的渡假地方，百分九十的进岛的人都是游客。而且交通十分方便，灵机一动，就可以马上上游完。
121102756,绝对冷静,,5,2017-09-03 19:09,新加坡旅游必去的旅游景点！漂亮
121082179,_WeCh****59812,,5,2017-09-02 17:08,非常适合全家旅游度假的一个小岛，因为这次是和闺蜜一起去的，我们主要去了岛上的水上乐园和海洋馆，在岛上随便走走看看风景，用了一天时间，带小朋友的话可以留足两天时间，把一天用在环球影城
121077024,是他没错a,,3,2017-09-02 10:01,在新加坡，圣淘沙，在很多年前就算是地标性的去处了，不过人工痕迹蛮多
120986999,黎总,,5,2017-09-01 16:02,小小地方人山人海！消费高1:5东西都是大陆过去的多
119953829,mapleseason,,4,2017-08-30 22:40,刚到新加坡，就来圣淘沙了，酒店班车正好到这里，整体感觉圣淘沙就是人造而成，其实不大，但是里面比较绕，幸好老公比较熟悉，来到鱼尾狮雕像，直接可以走到海边，还有飞行，斜坡滑车，时光之翼这些不错的玩乐地点。
119947817,西芹辣吵小百合,,4,2017-08-30 18:41,云顶酒店到金沙岛有班车，想去就去，金沙岛可以说是新加坡一个打发休闲时光的好去处。有主题公园-环球影城，有美食-马来西亚美食城，海鲜共和国，有娱乐-sea海洋馆等等，还有沙滩。
119947382,_wf****0702,,5,2017-08-30 17:48,安全舒适美丽&#x20;值得一游&#x20;还会再去&#x20;美食流连忘返
119945191,张小姐不乖,,5,2017-08-30 15:48,亚洲大陆最南端的日落&#x20;很美&#x20;不怕累的可以自己走着欣赏
119904121,E24****403,,5,2017-08-28 15:08,因为是陪2批不同的人去，所以一共去了两次。岛上不仅有海洋馆，还有很多动物馆，植物馆等等。人造沙滩非常适合带着小朋友来玩。晚上有表演，很值得一看。
119901964,太阳神Angela,,5,2017-08-28 13:51,作为除新加坡本岛之外的第三大岛，是集主题乐园、热带度假村、自然公园和文化中心于一体的休闲好去处。可以在沙滩上赤足行走，沐浴海风；可以在37米的鱼尾狮塔上眺望，到看世界昆虫博物馆观赏；可以到高尔夫乐园里挥杆，到梦幻岛里体验。
119901424,茱珠,,4,2017-08-28 12:59,带孩子去好玩儿，岛蛮大，活动很多。
119891878,SISISIY,,5,2017-08-28 01:36,新加坡的第三大外岛，面积500公顷，但是风景特别秀丽哦，所以现在岛上住的人非富即贵
119830693,韦嘉焱,,4,2017-08-25 12:48,岛上环境很好，大多数娱乐项目都汇集在这里！去了环球影城，索道等等！
119825154,龙神皇陛下,,5,2017-08-25 07:00,新加城著名的度假岛，环球影视城，名胜世界，西索亚海滩都是不错的目的地。
119823795,世界美食游走达人,,4,2017-08-25 04:38,新加坡实在是太棒了，十分的干净，也是十分的安全。让人忍不住要喜欢这里。在这里游玩，十分的开心。这里的餐厅也是很不错的，好吃。
119805179,花叔叔,,5,2017-08-24 10:47,去新加坡必须要去圣淘沙岛，无论是大人还是孩子，都会在那里嗨翻天，太赞了
119794952,绿茶慕司,,3,2017-08-23 21:09,圣淘沙岛，现在很热门，很多人喜欢。有逛得停不下来的糖果店，很多花里胡哨的糖果，甜蜜百分百。Palawan沙滩，吹着海风找海龟。
119775364,马特洪峰,,5,2017-08-22 23:54,上岛玩的人很多，又著名的环球影城！
119764926,_CFT****05504,,4,2017-08-22 15:35,圣淘沙岛是新加坡一个相对独立的区域，虽说整个新加坡都不大，但是一个圣淘沙也够你玩几天，我因为带娃娃玩，所以预定了住在岛上，但是两个晚上居然完全不够，环球影城一整天也很紧张，SEA海洋馆，水上探险乐园，能玩的太多了，亚洲大陆最南端和时光之翼都没有去，下次如果还来住三晚不过分，如果觉得岛上住宿的性价比不高，可以选择住市里，坐地铁到vivocity转车上岛，但是提醒带小朋友的（特别是小学以下的）还是住岛上比较省心省力。去新加坡旅游，还是定制去体验比较好&#x0A;http:&#x2F;&#x2F;t.cn&#x2F;RKs4TSR
119733388,未央77,,4,2017-08-21 10:50,套票总体来说不错，人太多，有几个地方还是很值得去玩的
119733385,未央77,,4,2017-08-21 10:48,套票总体来说不错，但是人太多，必须买优先证，相当于你又花一遍钱，不划算。
119716170,le****711,,5,2017-08-20 17:37,香格里拉圣淘沙度假酒店环境很好，非常适合亲子出游最佳选，交通很方便的，从宾馆出来就有免费巴士，可以到环球影城。环球影城旁边有各种小吃，味道不错。
119705025,自由的米其林,,5,2017-08-20 08:14,非常美丽的一个度假圣地，还可以看到马六甲海峡来往的邮轮
119674997,远行-遇见你,,5,2017-08-19 00:41,黄金的沙滩，世界闻名的锦标赛高尔夫球场，升涛湾的深水游艇码头与豪华私人住宅区&#x20;−&#x20;这些都是圣淘沙每年吸引上千万名游客的主要原因。岛上万众瞩目的旅游景点&#x20;−圣淘沙名胜世界－不仅享有新加坡史上第一座综合娱乐城的头衔，其中开设的娱乐景点还包括了东南亚地区首创的环球影城。圣淘沙离商业市区不远，访客能选择乘坐圣淘沙捷运，风景宜人的缆车或通过圣淘沙跨海步行道抵达圣淘沙，路程只需几分钟。圣淘沙岛还要一个必刷景点，就是亚洲大陆最南端了，其实是一座吊桥将Palawan与另一座小岛相连。圣淘沙岛上的捷运都是免费的，只有上岛时要收费，离开和其余来往的捷运都免费直接乘坐就可以啦。日落，就静静的坐在这个沙滩上，牵着对方的手，看着夕阳缓缓而落，嗯，不错。
119667993,Lincolnt,,5,2017-08-18 19:17,值得去，最好孩子10岁以上比较好，太小了只能看热闹
118760523,东瀛杰西卡,,5,2017-08-17 12:01,非常美丽的岛，太多玩的地方，没有玩够呢！下次去新加坡一定要在岛上多住几天了。
118476130,hua****4483,,5,2017-08-17 08:13,圣淘沙岛很美，新加坡必去的地方，宾馆很贵
118468039,jenny,,5,2017-08-16 21:24,合家欢的大岛，环球影城是最爱。
118434867,大城小孩5,,4,2017-08-15 18:51,岛上很干净，海水很漂亮，非常漂亮
118369210,simonsun2078,,5,2017-08-13 09:40,岛上有环球影城、海洋馆等，可以住在岛上，方便游玩
118369106,人在旅途G2,,5,2017-08-13 09:31,去圣淘沙岛可以免去二十元的轻轨费用，直接走滨海大道，只要想免费就可以免费完全不用花一分钱，环球影城海洋馆从外面看一看就行
118367356,Chenhutamu,,5,2017-08-13 07:37,圣淘沙岛大概是新加坡最好的海滩之一了吧，泡泡水，玩玩游乐园不错。
118364678,_WeCh****422684,,5,2017-08-13 01:51,住在岛外，圣淘沙用了2天游历，值得分享、再去！
118363854,晨羽625,,5,2017-08-12 23:30,很方便快捷，很好的，性价比高！
118363427,hua****4483,,5,2017-08-12 23:04,圣淘沙岛是新加坡最有名的景点，好多世界著名酒店
118292799,pi****wqq,,5,2017-08-10 22:47,最喜欢岛上的斜坡滑车，真心没玩够，住在岛上很好，不住也无所谓，新加坡本就很小
118272586,富乐顿市张辽,,5,2017-08-10 03:02,圣淘沙是新加坡南端的岛屿，是休闲度假的好地方，有沙滩有树林，植被很好。
118269023,hua****4483,,5,2017-08-09 21:36,圣淘沙岛是新加坡最有名的地方，很小的岛
118268327,118****395,,5,2017-08-09 21:04,非常值得去，至少应住两晚，很热闹，吃住玩都很方便
118248635,神么么,,5,2017-08-08 23:46,度假首选，吃喝玩乐一应俱全。带小孩老人来特别合适。
118238850,hua****4483,,5,2017-08-08 16:09,新加坡必去的地方，中国人很多带小朋友去玩的
118228585,张小团,,5,2017-08-08 09:28,圣淘沙岛上有许多游乐设施和酒店美食，但是交通较为拥挤，尤其到了高峰时段，需要排队很久
118224221,财会人,,4,2017-08-08 00:03,圣淘沙岛，这里的景色太美了！！
118213036,一品涵香,,5,2017-08-07 15:38,来新加坡一定要去的地方；环球影城、海洋时间
118180834,雨中漂飏,,5,2017-08-06 10:27,鱼尾狮像很高很大。沙滩非常舒服，喝上一瓶喜力，非常棒。
118180524,super_ring,,5,2017-08-06 09:59,进岛是要收取费用，但如果你是入住岛上酒店的话就可以领取免费的票
118172860,320****035,,2,2017-08-05 23:17,景点干净，人流不多，很喜欢。下次有机会还想去。推荐给想去东南亚旅游的朋友，值得去的地方。
118152193,上善若水,,5,2017-08-05 04:37,适合家庭出游的最佳地方，岛上的景点和旅游设施小孩子非常喜欢
118149214,bonnyloveleo,,5,2017-08-04 23:11,非常棒的旅程，订票出票快，方便！
117105185,hua****4483,,5,2017-08-02 21:18,圣淘沙岛是新加坡最有名的景点，很多游客
117096774,侬好-朋友,,3,2017-08-02 14:12,2017年7月底，尾单新加坡跟团旅游！离出发前三天拿到的尾单名额，价格是超便宜的！本来要出团的一对情侣，临时决定不去了……于是就被我等屌丝捡了一个便宜，比较庆幸自己有新加坡多次往返签证!&#x0A;跟着团避开上海的高温酷暑和纳沙台风，在新加坡好好转转。&#x0A;这个开车沿着海岸线30分钟就可以把整个城市逛下来的地方。干净整洁！这里有严明法律法规，严格执行，真正的做到了：王子犯法&#x20;庶民同罪……&#x0A;回头看看国内很多不文明的糟粕思想习惯……在这里一定被收拾的服服帖帖……
117096925,无非子,,5,2017-08-02 13:39,圣淘沙太好玩了，三天绝对不够。走到哪都有好玩的，唯一的缺点是，岛上物价贵。&#x0A;&#x20;&#x20;&#x20;&#x20;&#x20;&#x20;&#x20;&#x20;岛上除了Taxi，其他交通工具都是免费的，有接驳小火车，还有环岛Bus。Bus每一站都有不同的景点，班次非常密集，这点很人性化，但末班车时间周末和工作日不一样，需看清楚。入住香格里拉还有从怡丰城来往酒店的免费bus，为我们省去了不少时间和精力。&#x0A;&#x20;&#x20;&#x20;&#x20;&#x20;&#x20;&#x20;&#x20;圣淘沙水上探险乐园在诸多游玩项目中不算热门，但事实证明，这个乐园玩一天也不会腻。除了常规款惊险滑道、休闲漂流、冲浪戏水外，还有好几项特殊活动，比如海豚探索、珊瑚礁浮潜、海底漫步、与鳐鱼互动等收费项目。我们提前预约了海豚探索，真的是不虚此行，除了照片价格贵之外，无其他毛病。海豚互动约1个小时，加上等候和讲解，前后一共1个半小时。&#x0A;&#x20;&#x20;&#x20;&#x20;&#x20;&#x20;圣淘沙之所以吸引人，除去那些好玩的游乐项目外，走到哪都有可能会有不经意的节目呈现在你眼前。当我们饱餐一顿沿着河边散步时，忽然眼前出现了两只翩飞起舞的仙鹤。虽然之前有看到“仙鹤芭蕾”的指示牌，但决没有想到是如此精彩的仙鹤。&#x0A;&#x20;&#x20;&#x20;&#x20;&#x20;&#x20;&#x20;&#x20;新加坡一共有三座有名的鱼尾狮，最让人知晓的一座在滨海湾，但最大的一座是在圣淘沙岛上。恰逢新加坡国庆期间，7月-8月期间，这头坐落在岛上的鱼尾狮大放异彩，每晚的20:40和21:40有两场投影灯光秀，最近计划去圣淘沙的朋友别错过咯！&#x0A;&#x20;&#x20;&#x20;&#x20;入住圣淘沙香格里拉，会有猴子出没。本以为我们住在高楼层，看到猴子几率会很小，没想到，早上睁开眼，就看到一猴儿正趴在阳台的栏杆上，用期盼的眼神看着我们。同为吃货一枚，怎能不晓得这眼神的含义，赶忙找出一包坚果来，这下子又跑来两只，逗趣取乐了一番。&#x0A;&#x20;&#x20;&#x20;&#x20;&#x20;&#x20;&#x20;&#x20;早餐时，还有孔雀在旁散步。岛上沿海沙滩边也会偶遇到孔雀。&#x0A;&#x20;&#x20;&#x20;&#x20;&#x20;&#x20;&#x20;&#x20;环球影城两次变形金刚+侏罗纪河流探险、未来水世界特效演出，史瑞克4D电影、鞋猫剑客历险记、马达加斯加木箱漂流记、芝麻街意大利面太空站、小黄人越狱秀、魔法转轮，除了不敢玩的和不好玩的，其余的基本都刷到了[耶]，爽歪歪的一天。&#x0A;&#x20;&#x20;&#x20;&#x20;&#x20;&#x20;&#x20;&#x20;西乐索炮台天空步道（就在香格里拉度假村旁边）以及亚洲大陆最南端必须要去打个卡。&#x0A;&#x20;&#x20;&#x20;&#x20;&#x20;&#x20;&#x20;&#x20;时光之翼提早20分钟检票进去，虽然有分检票口，但进去后座位不固定，我们挑选了中间第一排。很精彩的一出水幕灯光、烟花秀，值得一看。
117090391,妖精妖妖,,5,2017-08-02 09:23,环美，气美，水美，文明行天下。
117080227,deancr,,5,2017-08-01 18:05,很好玩的地方，以后还要常来，带上朋友一起
117070044,耶路撒冷的牛牛,,4,2017-08-01 08:57,这个岛上面汇聚了新加坡这边的众多娱乐项目除了有环球的影城之外，这里还有其他的东西。有说这里有所谓的亚洲最大南点，虽然不是真正的最南点，但是还是有一点意思淘沙海滩也是在这里的附近。&#x0A;是免费的从地铁站出来，经过一个商场过来就是了。
117069627,sherry25,,4,2017-08-01 08:15,圣淘沙岛还要一个必刷景点，就是亚洲大陆最南端了，其实是一座吊桥将Palawan与另一座小岛相连。圣淘沙岛上的捷运都是免费的，只有上岛时要收费，离开和其余来往的捷运都免费直接乘坐就可以啦。安利一下palawan的日落，就静静的坐在这个沙滩上，牵着对方的手，看着夕阳缓缓而落，嗯，不错。
117062804,jessica,,4,2017-07-31 21:57,娱乐休闲场所，优越的自然环境与现代的游乐设施完美的结合，打造了一个多功能的大型娱乐区域，各种游乐设施齐全！适合不同年龄的人群游玩，嬉戏！
117060141,M22****9006,,5,2017-07-31 19:30,亲子游很好，不累。就是自由活动的时间少。
117057531,M28****01,,5,2017-07-31 16:59,圣淘沙很多人都推荐环球影城什么的，我推荐一下早上的沙滩。我住在圣淘沙岛上，早上坐小火车到沙滩边背后都是一个个静谧的高级酒店，沙滩干净，海水清澈，看太阳冉冉升起……
117026261,_WeCh****32303,,5,2017-07-30 11:38,海岛很热闹&#x20;，交通很方便，除了共享单车收费，其他的捷运海滩火车都免费
117008291,Applejuice777,,4,2017-07-29 14:33,圣淘沙岛上酒店挺多，玩的也多，环球影城、海洋馆、亚洲最南端等等，可以坐缆车上岛，也可以从vivid&#x20;city的跨海步道免费步行上岛，千万別错过了环球影城门口的糖果店，小朋友的至爱
116694302,hua****4483,,5,2017-07-28 19:36,圣淘沙岛是去新加坡必去的，上面的宾馆很经典
116631854,139****1368,,4,2017-07-28 17:23,特别美丽的一个岛，性价比超高的
114460651,电电爱去旅行,,5,2017-07-27 14:23,新加坡的圣淘沙岛又是另外一个很值得推荐的景区。从地铁圣淘沙岛站下了以后，如果你要走路过去的话，就是不用额外费用。如果你想坐那个小火车进岛的话，就必须买票才可以要另外交钱，但是在岛上交通又是免费的。在圣淘沙岛，你可以用一天的时间估计就差不多了。里面有海洋馆，有环球影城，还有一些一家大小都适合的娱乐项目。在圣淘沙岛上面的游玩设施都能够在国内旅游网上面找到，买票也很方便。如果遇到天气好的话，圣淘沙岛上面有一个岛，是属于新加坡的最南端，在那里看日落估计会很漂亮，可惜我去的时候刚好遇上了阴天，所以没能够看到日落，有点可惜。
113965796,_CFT01****1503043,,5,2017-07-27 08:41,比较喜欢圣淘沙&#x20;因为里面有游乐场&#x20;又是靠海边的呢
113989950,王木木,,5,2017-07-27 07:13,住在岛上特别方便，吃喝玩的好地方
113522159,George Zeng,,5,2017-07-27 00:17,新加坡地标，旅游观光集中景区，由环球影城和系列主题公园组成。
113329117,紫轩,,5,2017-07-26 23:00,应该说是新家坡著名景点之一，来新加坡一定要去圣淘沙岛，里面有环球影城，海洋馆，还有水上乐园，景色美，娱乐性高，流连忘返！
116992756,笑看风云淡rexlee7777,,5,2017-07-26 15:55,非常好，孩子非常喜欢！！不错！
113306223,来去随缘,,5,2017-07-26 00:53,景色很美，趣味无穷，值得一家人去渡假
113304446,尚睿淳咖啡,,5,2017-07-25 22:39,我今年去了几次挺好玩的景色很美
113297578,_CFT01****9405854,,5,2017-07-25 13:20,还来到了新加坡的圣淘沙岛，圣淘沙岛是新加坡最大的旅游度假景区，经过几十年的发展，已经形成娱乐休闲度假于一身的综合性度假区，玩的很开心。
116973864,205****858,,5,2017-07-24 01:23,买的套餐，海洋馆里待了二个多小时，见识了各种珍稀鱼类。
113271699,环球小女子,,5,2017-07-23 17:51,这里是一个非常美的自然风景区域，而且有很多星级的酒店也是在这里的，而且很多景点也在这里，小孩子玩得很开心。还有很多标志性景点。
113268117,王木木,,5,2017-07-23 13:32,一定要住在圣淘沙名胜世界岛上。
113262982,mikochiu,,5,2017-07-23 00:09,服务非常好，环境优美！圣淘沙很适合亲子游！
113251998,王木木,,5,2017-07-22 06:35,一定要住在岛上，出入方便的。岛上超漂亮
113250308,灵儿128,,4,2017-07-21 23:26,很好玩，第一天只完了环球影城，人不算特别多，一般排队半小时左右可以玩上，整整一天感觉还没尽兴。有的项目很吓人啊，特别那个木乃伊，我的妈妈啊，就剩下叫了
116950970,mikochiu,,5,2017-07-21 07:05,食品出品不错，服务也非常好！！
113194116,一粒微尘,,5,2017-07-21 00:45,天然无污染，休闲度假的好地方，约了朋友去玩吧！
113206504,小象莱新,,5,2017-07-21 00:00,最喜欢去的就是环球影城，各种个样的玩乐场所！木乃伊，过山车！水上乐园！还有4D影院，变形精钢！例外还有圣淘沙的全世界最大的海族馆！
