id,uid,title,score,date,content
88102100,M39****170,,5,2016-09-27 19:50,新加坡太美丽了，如果有机会的话，我会在新加坡定居，我是特别新欢新加坡，中国很少有，这样的城市，下次旅游还会来新加坡，亚龙湾我爱你
87927456,Davilimigi,,5,2016-09-27 11:19,去了新加坡，不上岛是不行的，当时我选了Michael酒店，没有原因，感觉顺耳。不过酒店在最里面一条，大堂不规整，但是离外出的玻璃门近，早餐也还可以。还能从阳台看到紫色小火车开过。
87919044,泼皮牛二,,5,2016-09-26 20:12,圣淘沙很适合度假休闲。有大片的沙滩。岛上的交通都是免费的。除了环球影城、海洋馆等这些闻名的旅游点外，沙滩也是非常好玩的。岛上还有很多孔雀，很有意思。最好是在岛上住上几天，不然还真是玩不够啊。
87867242,allenpro,,5,2016-09-25 11:26,可以去环球影城，也可以去水族馆
87863565,_98号,,5,2016-09-25 09:09,进岛费4新币，如果住在岛内凭酒店入住单可免费上岛，岛上公共交通一律免费。&#x0A;&#x20;圣淘沙岛不大，岛上的交通非常方便，而且只要是住在岛内的酒店凭酒店入住确认信可免费上岛。&#x0A;我上次是入住的是hard&#x20;rock酒店，一般一晚总共就1000左右~很不错，音乐主题的酒店
87859494,happyxuxu,,5,2016-09-25 01:17,景色很好，名胜世界与沙滩各有特色，住了三天，意犹未尽。
87833514,E29****90,,5,2016-09-23 18:07,去了之后才知道圣淘沙是亚洲大陆的最南端，就更加开心了！景色超级棒！
87840721,Michiyo,,5,2016-09-23 17:11,海边很干净，经常有学生们组团到圣淘沙活动。除了海边还有不少的景点可以参观
87823248,_zx514****153937,,5,2016-09-22 21:22,新加坡历史悠久的旅游胜地，环境优雅，趣味性强，新加坡旅游必去之地
87816459,Mary_Kiky_Zhu,,5,2016-09-22 14:45,新加坡圣淘沙岛，被誉为最迷人的小岛。被称为欢乐宝石。
87817049,CN_BOICE,,5,2016-09-22 14:13,圣淘沙岛面积不大，休闲娱乐设施和娱乐项目比较多。岛内可以步行或乘坐圣淘沙捷运。圣淘沙环球影城门口有全亚洲最大的糖果屋，整整几面墙都是糖果，各种颜色各种口味各种样子，应有尽有。最喜欢S.E.A.海洋馆。海洋馆里有一个透明玻璃海洋观景区，无以伦比的超大全景玻璃幕墙，绝对震撼！
87812318,Tracy,,5,2016-09-22 11:49,"有好几个沙滩，&#x20;沙滩附近都提供免费淋浴。&#x20;带小孩&#x20;朋友可以去Palawan&#x20;beach,&#x20;那边有个小孩戏水乐园。&#x20;除沙滩外，&#x20;还有缆车，&#x20;鱼尾狮，蜡像馆..."
87809989,家有肉肉妻,,5,2016-09-22 09:02,个人比较喜欢圣淘沙那边一家很大的candy&#x20;shop，每次去那边玩都会去买点～还有就是环球影城～个人觉得都非常不错～音乐喷泉的话，我觉得还是金沙那边的会比较好～
87807855,yifulan,,4,2016-09-21 20:01,环境还不错，可以和家人朋友一起去玩一玩&#x20;值得慢去慢看，最好早点去，否则人山人海。
87794476,Mary_Kiky_Zhu,,5,2016-09-21 13:12,圣淘沙岛，被誉为最迷人的度假小岛。海滩，龙道，龟屿岛。
87790400,wlgngl,,3,2016-09-21 08:42,呆的时间较少，玩不了什么，听说至少要呆2-3天才行。
87781214,wchaos,,5,2016-09-20 16:42,很悠閒的度假地點，適合帶全家人一起享受慢活的假期。
87782453,130****8280,,5,2016-09-20 14:50,简直流连忘返，旅游的天堂，阳光沙滩，游乐设施，总之一定要去！太棒了，还有就是交通很方便！
87772611,_zx514****153937,,5,2016-09-20 05:43,新加坡综合性旅游度假区，景色美，配套全
87765985,139****7050,,5,2016-09-19 16:01,好地方，适合在这里悠闲地玩上两天，个人还是喜欢下点雨，没那么热
87767461,M44****213,,4,2016-09-19 15:49,美丽的空中花园城市。。。。。。。。
87767645,Tingwai,,5,2016-09-19 15:10,超級好玩，傍晚夜空好美，空氣好，遊戲設施多
87768229,135****2558,,5,2016-09-19 14:59,在岛上住了3天，非常好，很美，吃饭方便，免税店推荐polo衫，便宜，消费偏高，新加坡人都不常来。
87760348,远行的猫咪,,5,2016-09-19 07:54,你去新加坡一定要去圣淘沙名胜世界，那里可以游玩一天，有新加坡历史博物馆，军事博物馆，还有鱼尾狮，亚洲最南端，好多景点，值得一去的地方。
87755470,妮妮妈,,5,2016-09-18 21:49,亚洲最南端，那里有两座塔楼，站在塔楼上，海风、海浪、蓝天、白云、绿树……远离城市的喧嚣，远处的船只却又不经意间告诉我们这里的繁华，是一个奇妙的景点。
87754246,M35****03,,5,2016-09-18 19:29,在岛上住了一晚，马来西亚小吃街总体来说是不错的，东西挺好吃。岛上交通都很方便，有免费观光巴士1、2、3。白天玩那个斜坡滑车很刺激很好玩，不是太多人排队，还有冲动想玩多一次，至于空中吊椅还是不错的，不过想看四周景色必须要四围望才行。哈哈！白天看鱼尾狮景色还不错，不过晚上看，我老婆说有点恐怖。
87744899,danning,,5,2016-09-18 12:36,圣淘沙岛的香格里拉酒店还是不错的，里面有很多的美丽的孔雀还是非常喜欢
87746741,wzt890118,,5,2016-09-18 10:58,整个圣淘沙岛风景秀丽&#x20;岛也不太大，各个景点之间不太远，能玩的项目还挺多，大鱼尾狮能上去瞭望风景看马来西亚，这里也是亚洲的最南端，值得一去
87737964,上谷,,5,2016-09-17 21:56,挺好下次还要来这里吃.住.玩。
87732479,M51****56,,5,2016-09-17 15:51,无论是景色、环境、空气来说都是适宜人居住游玩的，特别适合孩子。真是个童话王国，流连忘返，不想回家后了。
87714261,1314lll,,5,2016-09-16 12:48,去新加坡圣淘沙是一定要去的有专门的捷运往返市区和圣淘沙很方便我们住的节庆酒店赠送3天免费往返车票相当贴心在岛上有海洋公园和环球乐园而且沙滩也好棒捷运贯通整个小岛建议住一晚这样就可以游玩不留遗憾
87709404,木子佳人,,4,2016-09-16 09:00,这里岛边人很少，因为都去环球影视了。我喜欢一个人在海边走走，看看，吹吹风，都是老外没有国人。对面就是马来西亚。海水也很干净。
87589399,地球1999,,5,2016-09-15 20:38,亲子游的绝佳之选，如果单比的话，环球影视城和迪斯尼差不多，但圣淘沙岛上不止环球影视城，还有海洋馆、天际滑车、海滩娱乐、各种儿童娱乐设置，综合起来甩迪斯尼好几条街。
87610946,眼睛很大想多出来逛逛,,4,2016-09-15 17:08,还不错，干净美丽。值得分享的去处！
87566058,Amanda,,5,2016-09-15 16:32,值得一去的景点，可惜我们时间匆忙，只去了西乐索沙滩！
87353686,王炸,,4,2016-09-15 15:28,总体而言还是可以的&#x20;小盆友很喜欢这鹅
87243060,_CFT01****7726071,,5,2016-09-15 10:24,圣陶沙岛通过一条堤道跨海大桥与新加坡大陆连为一个整体，岛上吃东西也很方便，好点的可以吃海鲜共和国，追求性价比的可以去吃马来西亚美食街，里面的沙爹，印度飞饼
87241869,pyjay05,,5,2016-09-15 09:50,购物，娱乐为一体，后面还有沙滩，游泳也是可以的，美食也不错哟，有鼎泰丰，大家可以去品尝
87243547,bule08,,5,2016-09-15 09:46,圣淘沙岛名声在外，新加坡对这个小岛确实规划的很不错。岛上环球影城，购物中心，高档酒店，海滩高尔夫球场应有竟有。连接的vivo&#x20;city也是超大商场。去新加坡玩必来。
87235508,M37****212,,5,2016-09-14 22:35,眼花缭乱，看哪里都新鲜，游乐设施和店铺让我和孩子流连忘返。
87231846,_m15****8345,,5,2016-09-14 15:14,除了环球影城，海洋馆和水上乐园外，也建议去海滩和跨海步行道走走，人少，很舒服
87229116,世博老魔,,5,2016-09-14 15:04,值得一去的地方，很美！我们去的时间太短，最好待两天
87228970,fip2030,,4,2016-09-14 11:04,新加坡的一个美丽景点&#x20;到新加坡是一定要去玩的
87216373,_WeCh****40081,,4,2016-09-13 14:35,去了水族馆，非常好玩，是去过的水族馆中鱼最多也是设计得最好的。台风体验没有太多惊喜，但出场后与外面的沉船设计相得益彰，里面的暴风雨场面真的会下雨但不会太湿，建议把手机，卡等各种物品放入包中。水族馆有荧光棒棉花糖，一边吃一边可以照明，相应时间还有喂食环节，有小朋友的可以查阅一下相关时间，应该会是很好的体验。另外，水族馆的厕所没有想象中的干净。
87211412,一家三狮,,5,2016-09-13 12:48,圣淘沙就像一个大乐园，孩子的游戏天堂！
87207243,香江一号,,5,2016-09-12 21:42,很不错的地方，就是天气太热了！游乐项目很是齐全，比较有新意。新加坡就是消费比较贵，房间不是很大。吃的口味还好很合中国人。
87205431,bm****04,,5,2016-09-12 18:35,由于没有做太多攻略，虽然知道去圣淘沙有船、缆车、公交、步行都可以到达，而且缆车是最推荐的，可是还是没来得及弄清楚到哪里坐缆车，坐乌节路跳上了一辆开往圣淘沙的公交就以为很快就到了，心想反正新加坡也就那么大，二十分钟总归能到吧，结果晚高峰有点堵车，而且是绕来绕去的，估计开了45分钟才到。已经是华灯初上，游客却是不减，非常有气氛，还可以在山顶看到山寨的mini鱼尾狮，整个小岛灯光效果非常好。中心舞台还有热烈的表演。
87203171,又又916,,5,2016-09-12 17:54,风景很好的一个地方，去的时候人不多，可以静静地在海边呆上一天
87202026,Moka,,5,2016-09-12 14:48,圣淘沙岛是新加坡的一个岛屿，是个名副其实的度假胜地，满满的热带雨林的风情和气息，进入岛内需要4新币，里面的玩乐设施也是特别的多，风景也很多的。
87197097,133****2786,,5,2016-09-12 12:56,环球影城，sea海洋馆，wings&#x20;of&#x20;time&#x20;表演……
87195200,ti****17,,5,2016-09-12 10:38,新加坡最好玩的地方，个人建议在里面住两天
87198036,ann****mlp,,5,2016-09-12 10:19,去新加坡没有不来这里的吧&#x20;景色还是OK的&#x20;值得去的
87194482,小林,,5,2016-09-12 07:47,海边公园，娱乐，美食，游玩，一体化，四面环海。
87190980,E34****99,,5,2016-09-11 22:10,风景很漂亮的，有很多特色的景色，值得来的哦
87189335,Pacino Chen,,5,2016-09-11 16:33,非常值得玩一周的地方，物价比其他国家贵一些，但是安全干净，尤其适合带孩子的家庭游！
87180892,神仙,,4,2016-09-11 09:20,为我家小胖在这里过了生日…感觉还不错，只是没有过多准备什么反而觉得有一种很纯粹很干净的感觉…这个地方给人感觉也还不错，至少在中国是没有的
87164552,M31****721,,5,2016-09-09 23:11,环境还是不错的，超大的鱼尾狮，下面就是免税店，就是有的东西不是照国内便宜，需要自己对比，买的手表就比国内贵几百。跟团没吃什么吃的。
87163340,小米回收站,,5,2016-09-09 19:30,一定要在圣淘沙酒店住二晚，新加坡物价高，其他天气闷死，其他都玩的开心
87159462,_WeCh****90373,,5,2016-09-09 15:27,这次一直住在岛上，感觉挺好的，鱼尾狮广场不算一个热门景点，娃却玩的很开心，坐完缆车后在蝴蝶馆门口玩水都玩了一个小时……很开心，吃饭虽然不算便宜，但是节庆大道上的选择还是挺多的，尤其是那个很大的candilicious，连推车的大小都做成宝宝尺寸，真心推荐^_^硬石酒店里还有很多活动，也很不错^_^
115988958,TacyGu,,5,2016-09-09 14:10,很刺激，也很好玩，价格相对也比较合理，而且要比现场买便宜很多！还是很划算的！给个赞
87156147,饭桶小王子,,5,2016-09-09 10:54,妈妈特别喜欢，景色很美，也很舒适、
87157323,闪瞎眼的2连,,4,2016-09-09 10:18,圣淘沙岛有无数好玩的景点，非常值得一来，很多有趣的项目都值得玩，在这里玩的几天是最开心的了
87151851,530057681,,5,2016-09-08 23:50,非常美的小岛，而且各種都很方便
87150522,呆河马,,5,2016-09-08 21:24,玩的地方挺多的&#x20;新加坡必去之一
87145118,lovesue,,5,2016-09-08 21:11,没去过的可以去逛逛，感觉没什么好玩的
87149922,mummyeeyore,,4,2016-09-08 21:02,带着小朋友住到圣淘沙&#x20;虽然离市中心不会很远&#x20;但还是偏了点&#x20;没有小朋友的话&#x20;还是住市里吧
87135904,118****757,,5,2016-09-08 08:34,值得住两天，岛不大，走走就逛完了，但是很干净，空气好，游乐内容也多，非常适合带老人孩子来度假！下次应该还会来的，可以多在岛上住几天！
87133695,320****737,,5,2016-09-08 08:13,岛上环境很好，西乐索海滩很漂亮，海滩附近酒店也多，景点也多，出名的环球影城，海洋馆都在岛上，岛上的小火车，巴士都是免费坐的
87118506,君澜,,4,2016-09-07 12:00,地标总得到一下，人很多，没什么大的发现
87118107,恩琪是我,,5,2016-09-07 11:26,果然是亲子旅行Top1，影城、海洋馆太精彩了，孩子很有共鸣，看到了海底总动员里各种角色，激动的直拍玻璃.配套很不错，酒店，餐饮都很方便，开发比较成熟紧凑，到哪里逗很方便！值得一去！
87118295,320****462,,5,2016-09-07 09:38,红眼航班，就走了下，没有玩很多，可是感觉很干净，人员也特别有礼貌～希望有机会可以好好走一圈
87116221,顺其自然1312,,5,2016-09-06 21:12,实在是太美了，简直就是娱乐王国。
87115925,暴文艺,,4,2016-09-06 21:09,大家都说圣淘沙好，但是我并又觉得有什么特别的地方，因为圣淘沙岛其实不是很大，我认为我国任何一个欢乐谷都能与之媲美，不过也难怪了，新加坡也确实没有什么值得去的地方，相比其他的地方，这里也算是个好去处了
115983848,E36****91,,5,2016-09-06 12:38,是大人和孩子都喜欢的游乐项目，不能错过的体验，旅行结束后还一直让孩子津津乐道的最喜欢的行程之一！
87102416,186****3117,,5,2016-09-06 11:11,值得一去！吃喝玩乐都有，景色不错！
87104131,flyinbaby,,5,2016-09-06 07:08,很漂亮，适合在那里玩上一天，里面好玩好吃，而且一票到底，新币74元，算起来要比迪士尼便宜
87085812,z夜雨,,4,2016-09-05 10:58,玩得很开心，孩子说下次还玩，回到家特别兴奋&#x20;好吃的很多&#x20;还有好玩的缆车
87085267,hbl1113,,5,2016-09-05 02:12,岛不大，但是足够玩好多天！不仅有豪华的五星酒店还有玩不厌的水上乐园！环球影城，海底世界都在岛内！沙滩边晒个太阳就能打发一天，所以这里是天堂
87086135,prince-sg,,4,2016-09-05 00:34,环球影城不错就是人太多，海洋馆没啥意思
87084122,smallyangsun,,5,2016-09-04 21:34,很不错，好多玩的，尤其对孩子来说，是个乐园。住了两天，感觉没玩够。
87064201,芥末丶丶,,5,2016-09-03 21:10,你要的手信，奢饰品，这里都应有尽有&#x20;商场里的东西也比较贵，在商场看了一件外套
87063636,珍果家园,,5,2016-09-03 15:38,吃喝玩乐购一应俱全，男女老少咸宜！我们一家三口去的，老公带孩子游玩，我专门逛街。
87062063,203****580,,5,2016-09-03 15:31,适合一家老小去的地方，环境好美，拍照留影是美的不得了的，会经常去
87049576,Luna,,5,2016-09-02 19:56,岛上有环球影城，海洋馆，最大的糖果店，亚洲大陆最南端的巴拉湾，西尔索岛，鱼尾狮塔，等等。好玩得玩不过来呀！免登岛费啦～而且，周一到周四岛上捷运等交通都是免费的。平时去人少。玩得很尽兴
87049560,e31****36,,5,2016-09-02 18:25,风景和趣味都非常棒，人多东西不便宜。
87049557,Yolanda,,5,2016-09-02 18:07,环球影城太多项目没有来得及玩，玩整整一天时间差不多。
87046982,PO****X26,,5,2016-09-02 16:02,岛上可以住几天，很好玩。如果带孩子真的可以只来岛上就好了
87044616,E34****99,,5,2016-09-02 14:58,是最迷人的度假小岛，蓝色的水世界很浪漫的感觉，还有摩天塔
87042917,M10****377,,5,2016-09-02 12:44,建议步行上岛，风景不错还可以省去上岛费，下岛时可以坐捷运。海滩非常美，酒吧很有特色，海滩公共设施一流。水幕电影特别不值。
87039919,Mary_Kiky_Zhu,,5,2016-09-02 09:55,圣淘沙岛，在殖民统治时期，是英国的海军基地，旧名绝后岛。
87037067,_3310****517831,,5,2016-09-01 21:41,度假好地方，小火车很方便，玩得也都在一起
86999156,破坏死光,,5,2016-09-01 16:09,圣淘沙岛是新加坡必游景点，&#x20;周边娱乐设施配套齐全，很值得大家去玩玩
86776417,e37****69,,5,2016-09-01 15:38,最后在岛内住几天，玩得尽兴一点。
86677999,E34****99,,5,2016-09-01 14:04,被称为最迷人的度假小岛，有很多的娱乐设施和休闲场所，最喜欢音乐喷泉
86690956,TTTT111,,5,2016-09-01 11:43,圣淘沙是去新加坡每个游客的必去站，里面的项目很多也很有趣味，大人和孩子都特别开心，玩一整天还不够。里面除了玩，还有沙滩和美食
86654295,139****1397,,5,2016-08-31 11:03,岛上交通方便，游乐设施、酒店管理有序，风景也美，虽然新加坡并不太适合下海游泳，孩子们一样玩得很开心
86653793,Bambino,,5,2016-08-31 10:02,景点集中，步行或小火车基本能到各景点，就是吃的一般
86651366,good****307,,5,2016-08-30 22:56,非常好的体验，十分满意，下次还会考虑。
86647894,哎哎爱,,5,2016-08-30 22:00,小岛继续了新加坡“花园城市”的味道，放眼望去，一片青翠，郁郁葱葱。阳光沙滩等自然景观自不必多说，更有精致的人文景致耐人寻味。你可以在沙滩上赤足行走，沐浴海风
86649525,lyn****my,,5,2016-08-30 17:54,环球影城真的很好玩，进入影城大人小孩就Hi起来
86644299,魔鬼BB,,5,2016-08-30 16:21,环球影城百去不厌！水族馆和国内差不多
86633074,M93****89,,5,2016-08-29 21:22,时光之翼，斜坡滑车，空中吊篮，海洋馆，环球影城
86627901,暴力玻璃,,4,2016-08-29 16:37,人工岛适合悠闲晒太阳吹海风，岛上也有很多娱乐设施可以玩～
86627291,蜗牛上树,,3,2016-08-29 16:15,不错的地方，值得去转转，吃喝玩乐
115967659,如图好,,4,2016-08-29 13:42,用了携程送的套餐，免费去张照片，可是经验不足，和一群人通过拍照点，所以就成集体照了，建议慢慢滑，看到散光灯慢点噢????
86626664,zhengyi0828,,5,2016-08-29 13:36,新加坡最值得一去的地方，适合在岛上待一天
86624740,freedomxm,,5,2016-08-29 10:20,免費的。坐公交車過來是1元。景色不錯，吃的也有，便利店也有。人不少，中國人很多。佔地不算很大，但也不算很小。適合至少兩人以上來人。
86622461,139****0474,,4,2016-08-29 08:51,逛街，购物，看海景，岛上玩乐项目也很丰富
86621770,m16****69,,5,2016-08-29 08:09,非常适合小孩子玩，在那住了三晚。圣淘沙，欧亚大陆最南端都去了。还可以坐斜坡滑车。逛街。几个酒店都是联通的。岛上的轻轨出去对面的vivo也很方便。小朋友玩的超级开心。
86615702,吉祥三宝,,5,2016-08-28 22:18,跨海步行道一路走过去景色超美，且上午与傍晚时天空景色不同，摄影的好时机。步行道不长，免费进岛，其他进岛方式都要收费，本人建议步行进入。
86617557,Owen,,5,2016-08-28 21:26,夜景很美哦！非常漂亮？激光喷泉很好看哦？
86613018,cgn吴杨,,5,2016-08-28 18:43,圣淘沙很不错，适合度假，去了2天都玩不过来，至少一个星期差不多，孩子很开心
86612531,_CFT01****0713497,,4,2016-08-28 12:50,环境不错，适合青少年游玩。规模有点小，游戏项目不算多，玩一个项需排队一个半小时。设有单人通道值得一赞。
86611831,hiluoling,,3,2016-08-28 12:10,圣陶沙岛是位于新加坡南部海域中一美丽的小岛，面积约3平方千米，1970年以前是英军基地，现为新加坡最大的旅游度假胜地。圣陶沙岛通过一条堤道跨海大桥与新加坡大陆连为一个整体，游客前往可以乘坐缆车、游船和汽车三种交通工具，十分方便。岛上遍布厅花异草，环境十分优美。同时，由于岛上拥有美丽的海滩、众多展览馆以及各式各样的娱乐设施，来观光游览者络绎不绝。
86608000,糖灵,,5,2016-08-28 11:30,圣陶沙岛是离新加坡本岛最近的一个岛屿，在马来语里是“和平安宁”的意思，如今被誉为新加坡最为迷人的度假小岛。圣陶沙岛不仅充满了热带雨林的气息，拥有巴拉湾海滩和西罗索海滩上的椰风树影，水幼沙白，还汇聚了众多娱乐项目于一身。建议在这里多玩两天，放松放松。
86606596,186****9671,,5,2016-08-28 09:50,带上孩子去乘滑车吧，家庭套票优惠很多，真的一次绝不够！
86605410,jessy,,5,2016-08-28 07:21,如果时间不紧，推荐在这里住两个晚上，岛上的巴士都是免费的，时光之翼，天际滑车，亚洲最南端，环球影城，海洋馆都是必去的，带着孩子，真是玩嗨了，基本上孩子会很喜欢。吃饭的话选择也很多，价格不便宜，但出来一趟的也不计较，能接受。天气真的好变化，一会儿大雨一会儿大太阳，很潮。
86601689,筱元儿,,5,2016-08-27 22:06,环球影城，S.E.A海洋馆，水上探险乐园，亚洲最大糖果屋，斜坡滑车＋空中吊椅，亚洲大陆最南端“巴拉湾海滩”。整整三天，小朋友们意犹未尽，玩的不亦乐乎
86596539,爱葡萄,,5,2016-08-27 12:21,很大要玩好久20个项目一天都不够玩的
86593094,zh****ang,,4,2016-08-27 10:49,比较热闹，旅游设施一应俱全，如果钱宽裕点，住圣淘沙是一个好主意
115961568,D32****71,,5,2016-08-27 08:52,玩两次太少了！小孩非常喜欢，想多玩几次。我们一开门就去了，第一次非常快，第二次人就开始多了
86590790,dearleilei,,5,2016-08-27 08:44,特别适合带孩子度假的一个地方，风景宜人水清沙幼&#x20;还有环球影城&#x20;海洋馆&#x20;水上世界&#x20;水幕电影&#x20;fly体验&#x20;吊椅滑车&#x20;&#x20;等等各种娱乐设施&#x20;我们在岛上住了四天&#x20;&#x20;都没有玩够&#x20;唯一的缺点就是住宿费用高&#x20;但在新加坡也不算什么&#x20;房间总归比市区的大多了
86594139,一笑而过,,5,2016-08-27 08:43,新加坡是我所有自由行东南亚型国家中的认为最值得去的地方，是一个发展很先进的国家很干净虽然小但是给你一种家的感觉很温馨。特别是圣淘沙岛那是孩子的天堂游乐的世界，岛上各种游乐设施不但新鲜刺激、而且好玩。
86592456,138****6548,,4,2016-08-27 08:19,景色好，度假好地方……，，。，
86572175,星小兔,,4,2016-08-25 22:30,新加坡的度假胜地，有环球影城，海洋馆等景点，有斜坡滑车，时光之翼等玩乐，有新加坡海鲜共和国，森等美食，还有无数度假酒店。我最推荐的进岛方式是捷运，它鲜艳的涂装本身就是一道风景
86572839,当地向导云空,,5,2016-08-25 21:48,好玩，名胜世界、SEA海洋馆、环球影城都在那。岛上还有马来西亚美食街&#x20;&#x20;里面的东西挺好吃&#x20;典型的东南亚特色菜。在岛上完了一天，感觉亚洲人很多。除了很多中国人，还有好多日本&#x20;韩国的人来旅游
86566685,小艾米,,5,2016-08-25 16:22,好喜欢这个城市，每每来到这个城市总是有一些不自信的感觉，每一个景点都安静的在那里，不争不吵，总在你不经意间，回眸偶得。干净透明，街上少有看到人，泊车的地方车辆也是少之又少。
86564510,D12****399,,5,2016-08-25 15:42,好玩的东西太多！岛上三天真的不够啊！孩子最爱斜坡滑车！水上乐园也超好玩！
86557697,win****xu,,5,2016-08-25 06:38,乘着圣淘沙小火车沿途逛逛是个不错的选择哦，虽然小，但真是个干净舒服的地儿
86557060,_CFT01****9412654,,5,2016-08-24 23:34,有漂亮的沙滩，其实走步行道过去也很方便
86555264,风满楼111,,5,2016-08-24 21:17,可以走到岛上，可以省钱
86548674,老小子ll,,4,2016-08-24 14:42,过了旅游旺季去的，玩儿什么都不用怎么排队&#x20;游乐设施不算特别的多！遮阳的地方太少了！
86542682,M16****864,,5,2016-08-24 08:44,圣淘沙一天玩起来还是跟紧张的，我们玩了两天，岛上的景点很多，也很有特色，吃饭的地方不是很多，主要集中在几个类似于大商场的区域！在岛上返程打车需要排很长的队！岛上还有放养的孔雀
86543321,151****1636,,5,2016-08-24 00:15,一直都想去，听说非常干净非常美
86534120,球球猫,,5,2016-08-23 21:45,不大，但是很有特色，可以去走走
86534810,在路上,,5,2016-08-23 19:45,值得一去，尤其是滑车，后悔没多玩几次。
86531364,Mary_Kiky_Zhu,,5,2016-08-23 12:58,圣淘沙是新加坡的一个小岛，非常漂亮。可以堆沙玩，还有好多好看的贝壳。日落西山，也是很美的。
