id,uid,title,score,date,content
,,Favourite: Berlin Bar,4.0,,"Recently reopened with new tenants, and renovated courtyards, Chijmes is attracting crowds that used to frequent Clarke Quay. New bars and restaurants have opened up - but my favourite is The Berlin Bar in the basement of Chijmes, with a great band and DJ that spins Top 40s and Retro music, and a comfortable welcoming ambience with great service."
,,so good-looking,5.0,,"If you like take photos, you MUST go there! The building is handsome extremely,however you cannot imagine!"
,,"Interesting, to a point...",3.0,,"Beautiful colonial architecture, interesting story but what will forever be burned into my mind is that there is an APPLEBEES here - what an abomination! You would think in strictly controlled Singapore, there would be some sort of law preventing an APPLEBEES from polluting the local culture. The other establishments seemed to be legit, but I will ALWAYS remember feeling sick to my stomach when I set eyes upon America's shame..."
,,A classy place,5.0,,For people with a taste for the class - it to s a must .Reservation are needed to have a meal - plan well . It is on high end side . Worth the money .
,,Pretty Setting.. Lots of Choice,4.0,,"Chijmes is full of restaurants and bars and pitches mostly to the expat community and the tourists.. The renovated old barracks situated around the old church makes for a very pretty setting, especially at night."
,,Tantalise the taste buds.,5.0,,"Chijmes is the cultural hub of good food and great conversation. Spread out beneath what once was an old 19th Century Gothic chapel are the cafes and restaurants of an international flavour. Formal restaurants to casual bistro cuisine are your menus of choice. Chijmes will leave you wanting to come back and visit a new city each night, from the German brew, to the Japanese sushi - any connoisseur will be slave to the abundance of choice."
,,Harrys @ Chijmes,4.0,,"Visited Chijmes while in Singapore in June and had a very pleasant afternoon in Harry's Bar, very good service from Joseph - constantly checking to see if we would like more drinks and topping up of water - not something we tend to experience in Perth! Thanks Joseph - we will be back!"
,,Perfect location and such a beautiful historic building....,4.0,,"Staying at the Carlton just across the road mean't Chijmes was perfectly located to pop in and out for a meal, couple of quiet drinks or browsing in several of the gorgeous little boutiques."
,,Amazing Restos,3.0,,From outside who could have ever thought underneath this beautiful church is a bar and resto's. Yeah you heard me right there are bars behind this church. But they no longer do mass though.
,,Has changed over the years but still a favourite of mine,4.0,,"Still a lovely old building used as a pre nightlife haunt of bars and restaurants. Been going here since 1999 and has changed somewhat, was sad to see the loss of shrooms a few years ago. Has went under a couple of revamps since then with a good mix of different restaurants with a nice relaxed feel.
Certainly worth a look in as good meeting place to offer up a mixture of tastes."
,,Great F&B Destination!,5.0,,"This is a great F&B destination that you should visit.

It was formerly a convent that has been refurnished and now run by a private company.

The property has undergone major renovations and refurbishments, with some new tenants. This refreshes their F&B offerings, which include Japanese, Mexican, Scottish, Chinese and Asian.

With restaurants offering casual dining to fine dining, there is something for everyone. There are also watering holes which you can pop into after your meal, so that you can have a night cap after your meal.

An ideal all-in-one location for a night out in town!"
,,Harry's @ Chijmes,4.0,,Very nice place to have a chilled beer and hang out with mates !!! I have been to Chijmes several times - very chic !!! I would recommend it highly !
,,Handy if you're staying at The Carlton.,5.0,,A great place to visit if you're staying at the hotel across the road. We originally thought it was a venue for business lunches and that there was one aisle/street of cafes/restaurants but approached it from a different direction the next day and found it was much bigger than first thought. There is a lively vibe to the place and a variety of dining options/budgets. We opted for Japanese one night and American the next and we enjoyed both visits.
,,Relax environment good meal good friends,5.0,,"I recently went there looking for food with an overseas guest. Newly renovated and the whole area cleaned up, I love the vibes and the surrounding. I love the choices. I ended up at Harry's for beer and buffalo wings. Yummmm. You look up and there is a beautiful church just above....awesome space to hang out with friends."
,,Lots of restaurants and bars to choose from,4.0,,"Have been here a couple of times and on the last visit, today, found many restaurants have gone. There is still a good selection and I don't think you'll struggle to find somewhere to eat."
,,"A piece of Singapore History, newly revamped and ready to entice!",4.0,,"The restaurants here went through some major revamp. Some old names were kept while other moved on. There was a good mix of international cuisines where tourists and locals alike will enjoy. The overall revamp of chijmes seemed to be less predictable and ""touristy"" .prices of food are not low but there are better selections than before the revamp. I see many locals coming here too. The old building is left untouched with enough restoration work done. Good job in keeping this place intact and alive."
,,Good selection of eateries,4.0,,"If you don't know where to go for dinner in Singapore, Chijmes is a good location. It has a dozen or more eateries, and a cuisine for everyone."
,,Neat Place,4.0,,"I stayed at Carlton Hotel during my recent trip to Singapore which was directly across the street from Chijmes. It stretches a city block on every side and holds restaurants and bars. Came here to Toast Box for breakfast one morning. The next day, we took a stroll through the complex in the evening. The scene is bustling with restaurants yet peaceful with it's elegant decor. I didn't eat at any of the other restaurants or bars but you don't need to spend much time checking it out. Definitely worth a stop if you're in the area."
,,Beautifully restored convent complex,4.0,,"Located diagonally opposite Raffles Hotel is Chijmes (pronounced as ""chimes"") which was gazetted as a national monument in 1990. Chijmes is an old Catholic Convent and the first building on the site commenced construction in 1840, other buildings including the chapel were added over time. After the convent closed in 1983 the complex was refurbished and now operates as a bar, dining and venue centre. Here the tourist has the opportunity to walk around the site, to take in the history and the many photo opportunities that exist, including ""The Gate of Hope"" where abandoned babies were left for the nuns to care for. The site is well worth a visit and while the bars and eateries are not the most competitively priced (but much more reasonable than the nearby Raffles Hotel), the tourist could easily spend time in this setting. The Esplanade and City Hall MRT stations are within easy walking distance."
,,Amazing,4.0,,"This is a late review, however came here year ago! It really us a hidden gem, pretty and a must when visiting the area."
,,Visit following Renovations,4.0,,"First visit following the recent renovations, place has changed quite a bit and a lot of the old venues have gone. As per other reviews there appear to be quite a few Japanese restaurants around the ground floor entrance... Harry's Bar is here along with a mix of Mexican, European (Highlander), American (Applebee's) and Singapore's Prive where we had a very good late breakfast.
Would be nice for a few more places to be open early where you could grab a coffee and breakfast...place is still geared for night time when it really comes alive. The de consecrated church now called Chijmes Hall is still a magnificent looking building day or night. Will be interested to see the place when all the outlets are open as there are still hoardings in place where new venues are planned. A few seats in the garden area would be good too, just to sit under the trees and enjoy this quiet spot during the day."
,,Beautifully Restored,4.0,,"A collection of newly restored buildings, lovely grounds and many restaurant choices. Just love the Cathedral, it's a beautiful building. A great place to sit, eat and relax by day and still take in a little buzz."
,,Peaceful and beautiful,4.0,,The entire Chijmes Centre is just beautiful and so well maintained. There are so many wonderful restaurants in the area and the picnic on the lawn is a must-do with kids. The church is beautifully restored. The Gate of Hope and the history surrounding the whole area is really interesting and worth the visit. Comes highly recommended!
,,One of the heritage attractions,4.0,,"It's really beautiful here! came here around evening, listening to a band singing basanova, a group of kids playing and jumping around, different racial groups chit-chatting and laughing, some more it was during sunset. Just simply stunning."
,,Great architecture - have fun pronouncing the name,4.0,,Chai-jimmies? Che-jims? Chi-jams? Chij-ammies? I know I certainly used all four to pronounce Chijmes. Sadly it was closed for restoration when we visited but it certainly looks impressive.
,,A place to just sit and relax without the hustle and bustle,5.0,,"I love the newly restored chijmes, I feel like I have found a little hidden gem just sitting amongst the towering buildings, hidden from the world by white washed walls and a stunning church. Inside you will find green gardens edged by trendy bars and restaurants, the food is great and the scenery is peaceful."
,,Enjoyable night out!,4.0,,"Had a very enjoyable meal at Chijmes, with a slight Scottish theme, staff in kilts! All meals were lovely and plenty of food on plates. The hot chocolate pudding for dessert was to die for!! Chocolate lovers heaven! Will defo eat here again. Lovely surrounding within an old Cathedral setting."
,,Beautifully restored to its former glory,5.0,,"There is nothing better than returning to a place you love, to see it fully restored to its former glory. I was at chijmes in July 14 when it was a renovation nightmare. Tonight to be able to walk into the stunning cathedral was just magical. I actually gave off one of those pathetic ghasps when walking into the beautifully restored church. They have developed the area and old convent to beautifully restore the old buildings, whilst carefully introducing modern restaurants. For fantastic bar deals head to highlander bar, which is outside but downstairs in the open airbasement area and Offers 50% off
cocktails, beers and wine until 9pm, a great location as you take in the cathedral that stands over the basement area. If your ever in Singapore please come and spend an evening here, just make sure you bring your camera."
,,"Newly renovated, very charming hangout spot",4.0,,"While renovation works are underway to restore this so very charming structure, restaurants and bars which are already opened truly brings this venue alive. Not your typical church, Chijmes has been converted into an entertainment spot where one can enjoy a great dinner and bar hop. A must visit if you've never been, or re-visit if you haven't been here since before the renovation."
,,So beautiful,5.0,,"I stay in Swissotel the Stamford and take a walk here before stat my day. Here is so beautiful with comfortable garden and white church. Also, here has many restaurants and bar. It's such a pity I didn't have chance to have a meal or drink here."
,,Not your usual entertainment venue,4.0,,"Chijmes is an interesting concept. They converted a former church and the associated properties into an interesting array of bars, restaurants and galleries. Here is secluded hideaway from the noise and traffic of Singapore's CBD. Although a tad pricey for the fare, the service and location makes for an enjoyable evening when you can actually hear the conversation at your table. Well recommended."
,,"Light and airy, lots of food choices",4.0,,"The recently renovated Chijmes is nicer than ever. It retains its interesting architecture in the form of the old, converted convent, and the well manicured lawns which provide welcome greenery in the heart of the city. There are a range of interesting restaurants, cafes and bars, including some exciting brand new eateries. These establishment offer a choice of pleasant alfresco dining, or eating in air-conditioned comfort, with the some of the restaurants being connected by light filled walkways with glass canopies."
,,A must go place if you are in singapore,4.0,,Have been in love with the place since the first time I went there...but it had been under renovation for quite some time...so did not think of it especially for bringing in the new year...but what a surprise it was to go there and since not everybody knew about its opening there were less people so finding a nice place on new years eve that is less crowded was a miracle....nice food good ambience and lovely evening ...
,,"""Oasis"" in Singapore",5.0,,"Do not if I misunderstood Chijmes because it is a lovely place with a church I believe it was and then also a place to go for drinks and food. They have some nice bars and restaurants and everything shielded from all traffic. It feels like you are not in a big city but a very tranquil place to enjoy, hang out with friends and loved ones and just doze off into the evening with some good food and drinks. Especially one place was super hip and we went there a couple of times during our visit - Privé. Very cool place with excellent food and good drinks."
,,If Jesus was alive he would go spare,4.0,,"Not sure if converting a convent into a place of drink and debauchery is the brightest idea - but it works
Its a great setting to just hang out and chill or party the night away

A variety of drinking holes and eateries and when the footie or other major sporting event is on - giant screens fill the courtyard and it becomes a cauldron of activity

Worth a visit"
,,A jewel deconsecrated to a cafe,3.0,,"Winner of Merit Award of UNESCO Asia Pacific Heritage Awards for Cultural Heritage Conservation in 2002.

After a major conservation effort, it is now converted into a plaza of theme retail and mediocre food and beverage outlets interspersed with ample outdoor spaces and courtyards, cloistered walls and long, covered walkways.

A haven in the city, unfortunately is no more a place of worship."
,,A bit of a letdown - This time,3.0,,"We have been coming to Chijmes quite a few times over the past 5 years, but now it seems to have been overtaken by Japanese bars and restaurants and bigger chain bars. Before there was something for everyone but now it just seemed to corporate. No fashion and nik-nak shops, no Aussie bar, not many good happy hour deals which always draw people in and too much boom boom music at Harrys."
,,"Rats, ants, lizards, burnt pizza, heavily disguised included service charge and an £8 pint",1.0,,"See above. Maybe it's your thing. Not so much mine.

Rats over my feet, ants and lizards on my plate ( no 'bush tucker trial' ordered) pizza woeful, beer overpriced, service slack and disingenuous.

Nb. There are maybe decent places in the food complex - I was at 'P&C'."
,,Former convent,4.0,,After visiting Raffles hotel I decided to stroll across road to the Chijmes complex. Built in 1854 as Convent of holy infant Jesus. Chijmes has been transformed to a modern cafe/boutiques. I had a couple of drinks one evening. Value for money
,,Mediocre restaurants and bars,3.0,,"Nothing really special in this place. Fairly generic selection of bars and restaurants but nothing really spectacular. Popular place for drinks on a Thurs or Fri night,"
,,Cool hangout place with plenty of places for a drink and munch,4.0,,"It is a great place at a convenient location. Most places / joints are cool Veg options are limited. Harry's is recommended out there for its chicken, beer and flat breads (like pizza)"
,,Gorgeous setting,4.0,,"The building itself is great (definitely phot worthy) add in the many restaurant options, and the proximity to Raffles Hotel, and why would you not visit Chijmes when in Singapore? :)"
,,Soulless expat restaurant complex for those who want to avoid any kind of culture or atmosphere,1.0,,"This kind of place makes me embarrassed to be an expat. Painfully generic, they prioritise ""something for everyone"" over taste, interest and atmosphere. There's a disproportionate number of Japanese restaurants, an oyster bar, and several ""tick all the boxes"" generic pizza/pasta places. It's about the furthest away you can get from Singapore, whilst still in Singapore."
,,Not a church,3.0,,"This was once a beautiful church, now converted to events and restaurants. Most of the restaurants were Japanese and between service when we visited. Nice to see if you are in the area."
,,Nice place for a meal,5.0,,"There is currently some renovation going on, but, all of the restaurants were open. The setting is lovely and it's reasonably quiet given it's central location."
,,More food in a nice atmosphere,4.0,,"Built around a church building and its surrounds, chijmes is a selection of bars . and . restaurants.

Next to raffles shopping centre and city hall mrt station it is easily accessible.

The bars have live bands which rocks you through to the early hours of the morning but you can also find nice cosy restaurants.

Dining alfresco is also prominent in chijmes.

Have a try...you wont regret"
,,Romantic,4.0,,"If you wanna bring out your girlfriedn or wife to a nice and quiet spot in the city, you should book one of the restaurants at Chijmes. Its in the city center, just next to the Swissotel and Cityhall MRT, so very accessible. Theres an Argentinian restaurant that is good, and one high class chinese and a korean bbq restaurant (less romantic). The rest are bars for watching soccer."
,,Under Construction but please visit!,4.0,,This is a converted church and surrounds. It's a great little distraction from the busy shopping centers nearby and you can have a meal and/or a drink at one of the establishments in the vast grounds.
,,Restaurants of Singapore,4.0,,The old Chijmes has been turned into a variation of restaurants and pubs with a selection of Japanese restaurants of all types. A tad expensive but excellent food and presentation whichever restaurant you choose
,,A new experience and still beautiful,4.0,,"After reading reviews on Chijmes while in Singapore late July 2014, I was reluctant to go as the picture painted was not one of what I remembered of Chijmes and sounded like it was having a complete overhaul and not open. As we were staying opposite, we decided to give it a go. I myself did love the old Chijmes and the open air ambiance and hawkers stalls that I remembered from years ago, with the backdrop of the beautiful building which was originally a convent. This recent experience was completely different however I feel the place is amazing, Its just a modern version. Yes its different its now been decked out with funky bars and restaurants, but the food is amazing and service is extremely welcoming and warm. All staff in all the restaurants are very keen to welcome you to their establishment. After our first evening visit we ended up going back 3 days in a row for breakfast at Dimbulah. Amazing coffee and great service and extremely well priced. Dimbulah happened to have one of our favourite beers Kronenbourg 1664 Blanc which you can not get in Australia and here on tap for happy hour so we were won over instantly. Most of the restaurants are now open for business and the feel and ambiance was great. Its a modern electric atmosphere without being pretentious and opposite where we ate there was a fantastic wine bar. If you are after hawkers markets and the old chijmes then unfortunately no this is not the atmosphere now, but if you want to put on a summer dress, enjoy some tapas, wine, or a happy hour then give it a go. Its still a beautiful place to dine. My only cringe moment was seeing a Hogs Breath cafe at Chijmes and luckily its up the other end, but it just does not suit the venue apart from that it was a great experience."
,,Historic place. Featured architecture.,3.0,,"With religious history and of historical features. A couple was shooting video/photos in the place. Unluckily, the outer building was under construction at that time. A bit disturbing to the peaceful environment."
,,Over -hyped,2.0,,"I've been to Chijmes on many occasions in the past. After a gap of four years I returned to Singapore and revisited Chijmes. What a waste of time. The renovations, supposedly completed in May are no-where finished. There is no feeling to the place, no decent restaurants, no ambience of any kind. Gone are the interesting shops, the pleasant open space and vibe of the place. I don't know what the owners are planning - there was no-one to ask when I visited. But on the form I saw I will not bother to go back. One of the few disappointments of Singapore

Incidentally, with a spread of reviews earned by Chijmes. I do not see how it deserves a Certificate of Excellence by Trip Advisor"
,,Wait until later 2014 before trying for food/drink!,2.0,,Used to be really good place to go for various restaurants and pubs however most of it is currently closed for refurb which was really disappointing. Hopefully when it's complete some of the previous atmosphere and buzz will return.
,,History Outside Change Inside.,4.0,,A beautiful old building that was once a Convent. This is a sensational find amongst many in the CBD. A delightful piece of scenery from the outside. As with many opportunities in Singapore it is just easy to walk around and explore and find. There are many Churches in the CBD and many notable Civic Buildings that are presently under restoration. Many parts of Singapore are getting a much needed cut and polish.
,,Great for a quick photography stop,4.0,,"I think of the great things about Singapore is building preservation. CHIJMES is another one of them. Formerly a convent, it is converted to a destination of restaurants and bars. Even if the dining and drinking options there don't appeal to you, it makes a wonderful visit for how the convent architecture is now integrated into this night time destination which also means it's perfect for a quick photography stop."
,,Only Time will Tell,3.0,,Revisited Chijmes as we had fond memories from a previous visit but we should not have expected time to have stood still in Singapore. It had lost the character that we remembered so we did not stop but maybe when the refurbishments are complete it will have a better feel. Food was costly at one of the restaurants we investigated.
,,"Out with Old, In with New",4.0,,"Chijmes is undergoing major renovations. Worth a look if you're in the area. The first new venue opened two months ago, an Australian coffeehouse. A few more have opened since, and several others, including the Don Katsu sake cafe, will open soon. Dimbula's coffee is great, they serve breakfast till 1700, and have some tasty pastries: lamingtons and brownies. Good new addition.

Chijmes is a beautiful place to go, and I spent some memorable pleasant nights there on prior visits to Singapore. I wish them well, but alas, when it's out with the old, in with the new, sometimes what you lose is more valuable than what you gain.

There are very few things on earth stronger that Aussie espresso, but hundred-year-old Laphroaig is certainly one of them. Losing the best whisky bar East of Suez is quite a loss. Whisky connaisseurs needn't mourn. The Auld Alliance isn't dead; it's relocated to the RendezVous Hotel at where Bras Basah turns into Orchard. Rendezvous there instead of at Chijmes."
,,A Great Find,4.0,,"The Chijmes complex is surrounded by extremely high walls this is because it was a convent school for girls in a former life. It is located in the commercial area right behind the landmark Raffles Hotel.
The area has been transformed into a leisure area containing numerous bars and restaurants. It used to be much busier a few years ago but still is a fun place to go."
,,Buzzing in the evening,4.0,,"The Chijmes was originally the Catholic Convent of the Holy Infant Jesus. On Victoria Street it is close to the Commercial district and also close to Raffles Hotel. It looks like a private building from the outside and we only found it whilst looking for the Lei Garden Restaurant. The architecture is beautiful, with bars and restaurants in the convent buildings and in the cloisters. The building is under renovation so will definitely go back on my next visit to Singapore to see how it looks when finished.
Pour
Our hotel was on Orchard Road which was an easy walk back."
,,Rather less life than I was expecting,3.0,,"I was here many years ago, and had fond memories of a lively buzzing happening place. On my return though, I was rather underwhelmed. Admittedly, much of the complex is under renovation, to open in May - but still rather dead in the evenings with few places just to sit and have a drink"
,,Hidden Gem,5.0,,We found this venue by just walking the streets as it was not mentioned in the hotel info and from the outside it appears a bit private however once entering it is very inviting. We found a variety of different venues to eat at and the ambience adds to the overall experience. Overall a peasant experience and I doubt you would not find something enjoyable to eat !
