id,uid,title,score,date,content
,,My favourite place in Singapore.,5.0,,"Just to sit anywhere down along the Promenade is fantastic and it's Free!
So much to look at and enjoy. We saw dragon boat races one day! Lovely
to see all the locals enjoying the Marina. It is so relaxing just sitting there
enjoying all that's going on around. Top place and a must in Singapore!
don't miss it!"
,,Must see,5.0,,Your trip to Singapore will not be complete without visiting these iconic architecture. Perfect for photo ops.
,,Amazing view,5.0,,Day and night both views are amazing.love the water show at night the sitting arrangements are beautiful
,,Breathtaking,5.0,,This is such a breathtaking sight. You just want to stand and take everything in. The lights are stunning.... marina bay hotel in the background. Wow. There is a part where there are free concerts. The night we were heading back from dining we heard drums.... yes went to investigate and it was the tyco drummers from Japan. What a performance. It was amazing to watch. It just an awesome sight......
,,Nice place to enjouy lasershow at night,4.0,,"This is a place where local people and tourists get together to view lasershow. Nothing very special, but when you are in SG, why not to visit here. It is easy to reach and does not cost anyhing. The atmosphere is of course nice as well."
,,Awesome,5.0,,Its an amazing experience in nights. Wonder of Lights with a show of Water.Its an romantic place in nights
,,Ideal for an evening meal and walk,5.0,,"If you are visiting Singapore, don't miss the opportunity to have an evening meal at one of the many restaurants on the Promenade and take in the brilliant laser light show on Marina Bay Sands. Settle your meal with a stroll along the whole promenade, maybe finished off with coffee at the Fullerton Bay Hotel."
,,Superb view in the night,5.0,,Visit this place by 8.15pm in the night to view a spectacular buildings around with glowing signboards of many top banks. The laser show here is excellent to watch
,,Wow place,5.0,,Must visit. A good place. Should see spectra show at 8 and 9 pm. Worth visiting. Nice for solo as well as families
,,Pretty and nice,4.0,,Great views of the Marina Bay. In the evening nice light and sound and water show with lasers. One can enjoy the show while having a snack or dinner on the quai.
,,mesmerising !!!,5.0,,spend a good evening here is a must for everyone who visits singapore !! lovely coffee shops and amazing views !! the light and sound is amazing !! the merlion is beautiful..the whole vibe is just so cool !!!
,,Delightful,4.0,,It's better at night when the weather is more pleasant and you can enjoy the view of the water vs. nightlighted skyscrapers
,,Excellent free light show,5.0,,"A visit at night is a must as the place takes on a whole new perspective, lights are stunning, there are lots of places to eat and drink and its usually cooler in the evening."
,,Night time walking around will the best. Hot during the day!,4.0,,"Well, many Singaporran running and walking around this area. Suggest go to the section at night, cooler and can overview the night light. A lots of fun, enjoyed."
,,"Great views, eats and drinks",4.0,,"Great for just a nice stroll, but good places to eat an drink, watch light shows in the evening, see the Merlion, get boat trips, watch the open sir theatre."
,,Mesmirizing Show on Earth,5.0,,"You cannot miss the Laser Show in the evening that happens at 2000 hrs and 2100 hrs every evening. Great Show of lasers and music where in the fountain dances to the tune of a great music. You feel like transformed into a different world. It is great stress reliever and stress buster show. You are sitting in the open but when the show starts it seems as if you are sitting in a theatre. It is good if you are tired after sight seeing Singapore, come to Marina Bays sands and sit over there and enjoy the show and then go back. It is not to be missed attraction of Singapore."
,,LIGHT SHOW NOT TO BE MISSED!!!,5.0,,Stay by all means to see an incredible light show. Even better? The freakin' sound system!! Best part? It's free!!!! Just get there a bit before the sun completely dies down and then hang out and do some people watching. Bring water though. You will need it.
,,Stay for the light show! and watching people taking selfies : - )),5.0,,By far one of the most beautiful places you will see. The light show is beautiful and the city is bustling with people. A must! if you are ever in Singapore
,,Nice,4.0,,Very good place. Clean. Management was good. Nice best place to visit. Marina bay sands is damn good.
,,absolutely beautiful,5.0,,"very amazing, free musical fountains, just the best place for a nice riverside walk/stroll. best of all its free!"
,,Nice,4.0,,"It is nice, Singapore officials are doing everything to make Singapore exciting. It does not have the rich culture and landscape of Hong Kong."
,,Fabulous display,5.0,,Sat by the waterfront along with hundreds of others watching an amazing display of light and fireworks. Plenty of places to sit and it is tiered so everyone had a good view.
,,Wait for the light show,5.0,,lovely place to walk around but the restaurants here are very very expensive. Just get a drink and wait for the light show on the hour from around 8pm that's projected from the top of the skypark
,,Nice view,3.0,,Nice view from this place. Many tourists visit this spot Nice place for a walk in the evening Looks beautiful at night
,,A nice peaceful place.,5.0,,This is a peaceful place to be with your partner/ family or even if you are alone. They also have a sound & light show which is one of the main attractions.
,,Well worth the wander (Walk) around such a great place,5.0,,"Every city in the world that is on the water front should have one of these. A great open space to wander taking in the view of the city, the light show, the water show, the water taxis or just the water, with no hawkers, no speeding push bikes or tacky tourist stalls, selling rubbish.
It is good the way Singapore sees the bigger picture of tourism and gives the tourist areas where they not only feel safe 24 hours a day, but can enjoy the area with out fear of being ripped off or pestered.
Take the time to enjoy, night was my preference"
,,Amazing architecture and views,5.0,,"Walked through the Promenade and was taken back by the views over the river and also by the architecture. Nothing boring like Perth where we come from, but each building was very different. Some of the designs were amazing, something you simply have to see to believe."
,,Both day and night,4.0,,The waterfront promenade is busy day and night with each offering a different experience of the city. Don't miss the light shows at night.
,,great,5.0,,great place to have a walk but also for jogging. Especially at night when everything is illuminated.
,,Great place to stroll on balmy evenings,4.0,,"When it isn't raining, strolling along the perimeter of the Marina Bay is a feast for the senses. Watching the light show is refreshing; so is feeling the wind that cools you down from those hot humid afternoons spent outdoors. There are hotel restaurants, bars and casual dining places nearby to get food from, and beautiful architecture to admire. Highly recommendable."
,,Best place to chill at night,5.0,,"Came here at night after a long walk accross singapore city. Just sit, relax, and enjoy the laser show. Good the refresh your body."
,,Not only a bridge,5.0,,"This is a bridge to link the Sand and Garden by the Bay, therefore, you can enjoy both the view of the Sand, Garden by the Bay, Singapore Flyer, I think this view is better than the Marina Bay"
,,Good Walk,5.0,,"Very attractive buildings and a nice walk, though it was a bit hot day and I felt exhausted. There should be a few drinking water fountains provided and restrooms foe the public use."
,,New light show,4.0,,Marina Bay Sands have started a new light show in early June. Great spot to watch the light show at night.
,,Yum yum,5.0,,Loved sampling different food on offer at a few of the restaurants along the river and people watching ! There were surprisingly few mosquitoes being so close to the water
,,Nice walk around the bay,5.0,,"Great opportunity to walk around the marina and enjoy the views. Singapore is not only very clean, but also very pedestrian friendly. I have walked almost every part of the inner city, including this one."
,,"Great views, even better @ night",4.0,,"Great views, even better at night because of the spectacular view with all the lights and the cooler temperatures. Great possibilities for spectacular pictures. You should also watch the lightshow, however it was not the best we've seen so far. Many restaurants and bars with great views but with also ""great"" prices. Go there for a drink during the ""happy hour""."
,,Just incredible at night,5.0,,"Visit at night and see all the buildings lit up and hear the music of the bars and attractions, it all builds up to a great atmosphere. A must do in Singapore"
,,Beautiful and Iconic View Of Singapore,5.0,,"All visitors need to visit this place with the view of MBS Marina Bay Sand, Singapore a River and Merlion Park. Amazing view but it could get warm in the day."
,,Photo Opportunities Abound!!!!,5.0,,What more is there to say than a beautiful city with beautiful views over the water. On a still warm night the lights reflect beautifully. Totally romantic and totally lovely!
,,Great Light Show,5.0,,Visit here just before sunset to enjoy the waterfront as the sun goes down and take in the great views of the city with all its lights. Take a seat and wait for the free light and music show at 8pm which lasts about 15 minutes well worth it. The show is on the steps in front of the mall at marina bay.
,,Wonderful views,4.0,,"Just enjoy, eat, drink and shop around, nice place to visit and rekax. We did and had some drinks... not cheap BTW :-)"
,,New light show since beginning of June,5.0,,"New light show since beginning of June, which is absolutely worth going for. Starts everyday at 8PM an 9PM and lasts around 15 minutes. Be there on time to get a good view."
,,Great evening views.,4.0,,"This is a great promenade to explore the evening beauty of Singapore. After dark, the entire Marina Bay is lit in gorgeous lights, which makes all the buildings, bridges and monuments come alive. Don't miss it!"
,,Awesome view,5.0,,Watched few live performances here. Beautiful place for photos with the Singapore skyline when the sun is setting down.
,,"Hot During the Day, But Best Photography",5.0,,"Decided to walk around the place during the daytime and I was fortunate enough to take in all the beautiful scenery before my flight back to Malaysia. Had some photo shots taken for keeps and this will definitely be another tick off my bucket list! I believe this would be the ideal first place for tourists as it is after all Singapore's main landmark. There are others as well, but nothing as yet could compare to this one."
,,"Nice View, Must Go",5.0,,"lucky me was here during the ""i light Marinabay"", all the lights along the bay, nice view, nice food, nice event show! Should came here again when Singapore have event along the MarinaBay"
,,Great views to the City and Business District (CBD),5.0,,"The Promenade is a very enjoyable location to stroll around. Pedestrianised, peaceful, views of the Bay and City and shopping on hand ... if you can't resist!"
,,16000 Wonderful Steps,5.0,,"Walking around the Marina Bay can take you the all day, due to the enormous amount of things to do, places to visit.
From the flyer, through the helix bridge, over and into the science museum, across to the tree groves through the Marina Bay Sands.
But it is at night, that the glittering of the skyline and restaurants, on a boat trip that it is more interesting. A must."
,,Visit at night,3.0,,"Nice to walk particularly at night. Lots of restaurants and atmosphere, the light show is not worth hanging around for. If you are in the area when it starts then give it a go but don't go out of your way to view it as it is average, nothing compared to light shows of similar nature in Dubai or Kuala Lumpor."
,,Fun at night,5.0,,This place comes alive at night we lots of food to try you can see the light show or just watch the boats go back and forth
,,Do it at night,5.0,,The promenade provides a wonderful view (pictures) looking towards the river and the amazing (and colourful) high rise developments along the southern banks of the river. Unfortunately as part of the Sands complex you need to sell a car to pay for the meals in most restaurants.
,,Lots of Resturants,5.0,,Lots of Restaurants and cuisines to try. Be careful as they do hassle you to go to their restaurants but once seated everything is lovely.
,,Amazing Architecture ..!,4.0,,"I am really amazed by the Architecture ..! One thing which i heard about this hotel is that when they conduct F1 Racing in Singapore, this hotel will be fully booked and the Lavatory becomes the place where the viewers will sit and see the races ..! :-) :-) Amazing Architecture and loved to be there ..!"
,,Best view at night,5.0,,This place offers a great view of the Singapore skyline at night. Another good place to catch the Wonder Full Lights and Water show.
,,Beautiful at night,4.0,,We walked down the river in the day time and someone suggested walking down at night. And Omg it is stunning. All the lights are beautiful. Got some stunning pics.
,,Good Place to Run 5K,4.0,,"I stayed in Singapore for 4 days, and ran here a couple of times. Its really a convenient place to run when your hotel is downtown, and you and the hundreds of runners can be treated to scenic views, and if you run during the evening, the occasional free concert as well as cool weather"
,,really must visit place. photogenic,5.0,,very good place. good for walk and ofcourse photographs. Amazing view from all corners. must spare 2 to 3 hours minimum.
,,Spectacular skyline view,4.0,,"Walking around the promenade is blissful as you get to see the whole of Singapore's major skyline. Spectacular sunsets and the night lights look stunning from the promenade. Best place to grab a drink, have an amazing meal by the bay and even get some memories captured. If you plan to walk around, recommend wearing sneakers for sure."
,,Lovely Skyline views,5.0,,Walking along the promenade early evening was wonderful. As the sun started setting the lights from all the skyscrapers reflected in the Singapore River! Many joggers and people strolling or eating in the nearby restaurants was wonderful to see.
,,Breathtaking place,5.0,,"Beautiful place, but you have to visit Waterfront Promenade during sunset or by night. Check the time of laser show and you will have for free a spectacular performance. Chill out in Starbucks , or other restaurants, bars and coffeeshop. Some nights young artists or bands use to perform in a open stage."
,,Brilliant Place for a Walk,4.0,,"Great place for a walk , you need good footwear and its hard if its hot , lots of restaurants and bars , we went during the day and it was very hot so we dropped into a few of the bars to help us along our way"
,,lots of restaurants,5.0,,but they are expensive..you can try them out for a beer and snack.. beer is expensive in Singapore.. I don;t know for what reasons.
,,Nice to amble around,5.0,,"Good to walk around this place, maybe in the evenings, as its so hot. well connected by the MRT so you can leave when you want to"
,,Wear Good-Quality Walking Shoes,3.0,,"This area is considered a showcase by Singapore natives, with excellent views of some of their best tourist attractions, modern architectural landmarks, shopping, a casino, and arguably one of the most famous hotels in Asia -- perhaps the world (Marina Bay Sands). It is sincerely a smorgasbord of top rank photo and video ops. However, it is also stone-paved and to see everything, you will be doing *lots* of walking. Likely for hours. Without exaggeration, mountain climbing is easier on your feet and ankles. With the right footwear, you'll be fine. Without, you will be suffering for the next 3 days. Best be prepared."
,,Electric scooter,5.0,,Grab an electric powered scooter and cruise around for an hour to get the best photographs of the bay
,,Taste of Singapore on the go,4.0,,"A nice place for a long walk, enjoying the skyline and perceving at a glance the soul of Singapore city. Most of the financial district is visible from here and also attractions are available in the area, including ferry boats to go on the river."
,,Great Opportunity for a Walk,5.0,,Perfect alternative to spending time inside or shopping. There were people around but not crowded and the promenade gave great views of the city and shoreline. I walked during the day and in the evening and both lovely.
,,Pleasant experiance,5.0,,"Clean and calm, the magic starts in the evening with buildings lighting up providing an awesome view of Singapore skyline at night. It is a great experience."
,,Quite a walk,5.0,,"Really nice walk, you see the entire skyline and enjoy the breeze. There are tens of tourists and locals joiing you and the atmosphere is unbeatable."
,,Amazing at night and for sunsets - prepare yourself for loads of tourists,5.0,,This is a must-visit sight - it is near shopping complexes and restaurants so you are not short of things to do. This is a great picture taking opportunity as you can see all of Marina Sands Bay connecting to the rest of Singapore.
,,Relaxing.,5.0,,"This promenade makes for a lovely relaxing walk by the waterfront whilst offering great views of the city. There tend to be quite a few people in the area of the Merlion but other parts of the waterfront are very quiet.
Love it or hate it, The famous Marina Sands Hotel dominates the skyline in one direction!"
,,Most mesmerizing sights of Singapore,5.0,,The Waterfront Promenade is a must visit place during the day as well as in the night. The view is beautiful and mesmerizing.
,,Do you like to look out to calm water at night? Here's the place,4.0,,The day can get really hot so come back at night to see the calm waterfront and watch the world go by
,,"Just walk along, see all the buildings lit up - lovely.",5.0,,"Depending of where you are staying just meander along and pick a restaurant or bar, very busy in some parts but lovely seeing the city lit up."
,,You have to see it during the DAY and then go back at NIGHT .,5.0,,"Incredible perspective of Singapore you can see and admire this beautiful modern city from this beautiful promenade always clean and safe to walk on at any time of the day AND NIGHT, enjoy the daily Laser LIGHT Show coming out from the"" Marina bay Sands"" to the Bay... and don't forget to stop by the MERLION simbol of Singapore."
,,San pan in the evening,5.0,,We had an evening cruise on a sam pan boat for about 40mins it was lovely to see all the hotels with their lovely lights on. Would recommend.
,,What a treasure,4.0,,"Been to Singapore many times and just discovered this treasure. Well patronised the evening we went with great views, reminds me a bit of Hong Kong boardwalk . Excellent addition to river precinct"
,,Good Fireworks in the evening,5.0,,"Place to be visited in the evening to view the fireworks and laser show. Very beautiful, can sit and watch and enjoy the show"
,,Relaxing,4.0,,Great to walk around the waterfront & see all the sites. Enjoyed people watching and finding new places along the way
,,amazing,5.0,,"went to the tower to see the amazing view on top, it was awesome..entrance fee is okey, not so pricey..great place to visit"
,,Great location however no light show,5.0,,"we went to seer the light show but then found out if was not on anymore,,, shame but we stick enjoyed the merlion photos,, lovly was around the rivers to get here"
,,Beautiful,4.0,,Really nice at night with all the lights. Interesting about the reclaimed land and the quality of the water in the man made lake
,,skyline,5.0,,Great way to see the Singapore skyline and the nearby attractions like the Marina Bay Skypark and the Singapore Flyer
,,Twinkling nights,4.0,,"Its an awesome sight at night! impressive building left and right,architectural designs so unique you'll marvel upon seeing marina bay hotel from a far...with all its light and granduest shape...more so,you feel safe in their.."
,,Nice walk specially at Night,4.0,,"One of the best Iconic places in the city to have a nice walk especially at dusk, the walk is calm you can experience the beauty of the city, it's a warm experience."
,,Fascinating area,5.0,,This whole precinct combines very modern with the more 'traditional' architecture in a great way. It is very interesting to talk to local people about the changing landscape there and they seem to be quite proud of it. As with the buildings there is a great variety of people around. I visited only in the day time but was told many times that the area is vibrant at night as well.
,,Great walking experience.,5.0,,Great walking experience. Savour the lights and sounds. Enjoy the cityscape and concerts featured almost every night by the Esplanade. Easy walk taking around 90 minutes.
,,A Stroll in the NIght - Super,4.0,,"I would recommend this on a nice night to experience the light and colour the promenade has to offer. It is always a buzz and a good spot for people watching if that is your thing. Of course no on a rainy night.

The second choice for this place would be a day stroll if you are alright with some heat and humidity. Dress light and as always, comfortable footwear.

Yes, there are some eateries but I see them as a little pricey. I guess it is as the saying goes, ""To each, her/his own.'"""
,,Must visit for tourists,5.0,,"Keep a few hours for the Marina hotel and the area around it, which includes this. Especially if the weather is nice, its very enjoyable"
,,Excellent,5.0,,Excellent place to see especially at night. Strolling around the waterfront is very relaxing. Great to visit after dinner for a casual stroll.
,,Free laser show!,4.0,,This 15-20 minutes laser show was a good choice if you had no places to go in the night or you're not into shopping. You just sit and watch! The laser show was near spectacular attractions like Marina Bay and ArtMuseum.
,,Relaxing walk,4.0,,With a breeze coming off the Bay this a nice way to get between The Marina Bay Sands and the CPD. The views of the Bay and the modern buildings make it worth it.
,,Perfect to chill out,5.0,,"If you are tired after walking around, you can chill with a cold beer at the Promenade. There are many nice shops dotting the walkway. Some shopping areas as super cool offering local produce."
,,Nice Walk at Night,5.0,,Great place to Sit and take in the views and have something to eat Price is very reasonable and loads to choose from
,,Must visit at night,5.0,,"I have always loved sitting by the lake at Merlion Park at night, watching light show by Marina Bay Sands from across the lake, enjoying evening breeze. It is a must visit for you to end your city tour and get your tired feet all stretched up."
,,Free amazing walk.,4.0,,Walking around the artificial lake with all the architectonial buildings is very nice. The boat is a special sight from all directions. Behind this building are the gardens of Dreams...
,,"Must see, just stand and stare at the lights all around you.",5.0,,"Singapore by night, down at the bay. Awesome views. We had a super clear night, lovely breeze. Grab a coffee and just sit and relax. Stunning City."
,,Feed your eyes!,5.0,,Singapore's greatest infrastructure is all here 360 degrees of great architectural works that your eyes will thank you for.
,,Best at night,5.0,,Found this area so interesting with a variety of things to see & do. Many photo opportunities. However we did it in the daytime & as there was a lot of walking & it's so hot I would recommend going at night.
,,A must do,5.0,,Amazing at night with a huge number of restaurants to choose from. Some are a bit pricey but you are paying for the location. There's a lazer show each night and it's worth paying to travel up and down the canal on a boat. Great atmosphere
,,The Plave to Be !,5.0,,The waterfront is spotlessly clean and safe. plenty of bars and restaurants to choose from each one has something different but serves great quality food. Just grab a nice table and enjoy the view..
,,Slow walk with view of iconic buildings,4.0,,"If weather permits and you're free in the evening, a stroll along the waterfront promenade is usually one of the must-do things on the list of primary tourists."
,,a very bustling city lights view,5.0,,"a nice lazer show to view and also the skyline of singapore at night , the best time to go here is in the night,"
,,Perfect for walks,4.0,,"The waterfront is a great way to take in the city and the promenade is always full of activity, whatever time of the day you go."
,,Great Views especially at night,5.0,,"This was an evening out. The view is awesome and just a quaint place to relax and take a stroll. A must do when in Singapore, very safe"
,,Stunning views,5.0,,"We were lucky enough to be in Singapore for the last night of the art light show, beautiful quirky art structured with light, a floating blown up zoo. Loads of places to eat a couple of bands on the esplanade and finishing it off with a spectacular light show. WOW Singapore really know how to take it to the next level"
,,"A must do while in Singapore, the night skyline is something to see",5.0,,"A must do while in Singapore, after dark gives excellent views of the tall buildings and the Singapore attractions. There is no shortage of places to eat or drink while taking in the view"
,,Beautiful morning walk...,4.0,,"On a five day holiday and enjoyed multiple morning walks on the promenade. Always reasonably busy with bikes, joggers, tae kwon do training and people cleaning the tiles!!! Needs more bars and restaurants to capitalise on the skyline views."
