id,uid,title,score,date,content
,,Stroll around at night,4.0,,"Great place to walk by the marina and mall. Street shows and and food stalls all around the place, music playing in a circus - all a nice experience. Nice outside food court just behind the mall, really close to the water."
,,There are some high end shops and the view is ok,3.0,,The prmendate is easy to get to and you can access it by the MRT and there are numerous shops and restaurants and a shopping centre around. The views of Singapore city are ok but nothing special from here. Its ok for a walk around to kill an hour or so if you are looking for something free to do
,,Great place for evening time,5.0,,"Cover the garden by the bay, take the street towards marina sands, cross the hotel and the mall, take the exit and you are here at the waterfront. In the evening, great view of the water front, highrises with glittering view. There is a light and sound show here at 8PM and 9:30 PM, definitely recommended."
,,An amazing view,4.0,,Waterfront promenade is a place full of energy and lights (during the evening). Its a beautiful walk and a great place full of eateries. You can enjoy the street food as well as restaurant dining while soaking the culture and enjoy different activities suitable for all ages.
,,Good spot to relax,4.0,,"Waterfront cafes, phenomenal shopping (especially if you are wealthy) and a quite stunning panorama of the marina and city skyline. Ten minutes walk from the gardens and one minute to the Arts and Science museum. Evening light show we found quite disappointing, with not much use of the laser or fountain technology to create a wow factor and too much back projection of cutesy images of people onto a 'screen' of water droplets as the mainstay of the show. 2016 and Singapore could do so much better."
,,Fantastic views,5.0,,Probably best to do this in the evening as there is not much shade during the day. There is so much to see and many viewpoints for excellent photos.
,,Impression of Singapore,5.0,,"Absolutely beautiful-especially at the sunrise and night time. It has great choices for places of interest, such as gardens by the bay and Merlion park. The light show is spectacular and can not be missed."
,,Go for wonderful light & Laser show,4.0,,"Just behind the MBS is this place which gives you breathtaking views of Merlion & skyscrapers behind it.You can easily spend few hours here without moving a muscle in your body, alternatively you can also opt for leisurely walk, jog or a bit of cycling.The wonderful light & laser show which takes place around 9 pm is the highlight of this place.On you way back, indulge in a bit of window shopping & cherish the memories."
,,Go at night,5.0,,a perfect evening stroll along the water to see the impressive (and growing) Singapore skyline. Also may catch the odd performance along the water
,,Nice place to spend in evening in singapore,4.0,,"Nice place to spend in evening in singapore. Good view of the merilion, fullerton hotel and skyscrapper . Near to branded shopping malls. Must see in singapore"
,,wonderful for a evening walk,5.0,,"This is a stunning location to explore day and night, but due to the heat, night time is the best time to explore"
,,Nice experience,4.0,,Good to see but no more than once. Food and drink VERY expensive if you are not on a business card ( £65 .00 for two burgers small wine and small beer)
,,Such a great night walk!,5.0,,"Loved the nightlife in this part of town. Beautiful views, beautiful bridges. Plenty of great spots to eat and drink."
,,Great walking areas,4.0,,"The whole area is built on reclaimed land, and they have done a wonderful job of it. There is great view of the city from here and the place is kept very clean, as is the rest of the city."
,,Great Walk,3.0,,"Our hotel room overlooked the Promanade which we walked many times. The Waterfront itself is not clean but every effort is made to keep it so with boats collecting debris on a regular basis. The bars and restaurants along the Promenade are many with a good selection of wines, beers and eats. Happy House are prevalent daily. This is also a popular exercise area for local and tourists who jog and cycle this area. It is a safe walk also to major shops. We stayed at the Grand Copthorne Waterfront Hotel."
,,Free and a nice way to spend the evening,4.0,,Lots of people out for a stroll. Nice to do especially if you are within striking distance of it. Would recommend about 1 hour there.
,,Worth the walk,4.0,,Another spectacular place at night in Singapore to view the lights. Would suggest now in hindsight not as spectacular as Shanghai or Hong kong.
,,Great city views,4.0,,"There’s a nice walkway all around Marina Bay with great views of the city, Merlion, Marina Bay Sands, Singapore Flyer and Lotus Flower. Impressive architecture, especially the big “banana” at the top of the hotel. Walk over the Helix Bridge and stop off for some lunch at the food court in the Marina Bay Shoppes, that is once you have decided what to eat because there are so many choices!"
,,Cool oasis,5.0,,An early morning promenade gave me lots of good photos. The walk is interesting and a contrast to the bustle and hustle of Singapore.
,,Very colourful sight,4.0,,"We didn't spend a lot of time on the Waterfront Promenade as we ran out of time, we actually saw it from the other side, at night the buildings were very colourful and we were upset that we had missed a light show that they put on for visitors, just means we have to go back as so much to see"
,,Perfect place to view laser light show,5.0,,"Your can really enjoy laser light show from here, its free show runs everyday, there is plenty of space to watch"
,,Nice pictorial place,4.0,,Nice pictorial place to visit in Singapore. They have water-laser show at scheduled time in the evenings.
,,Nightly light shows.,5.0,,Enjoy the amazing light art festival in the Marina Bay during March.Share everyone's delight in the night light lazor display across the city.
,,A nice place,5.0,,Provides a good walk. Has a very beautiful architectural design. Promenade is very clean and well kept.
,,what a view.,5.0,,worth a stroll but take water and look out for shade. The view is amazing in most directions and the place is easy to get to. Can be a jostle for photo op sites but that is to be expected. It may be cooler at night but I find the difference hard to tell - it is always hot. - The esplanade over Jubilee Bridge is a peaceful and cultural spot with air con.
,,Good for long walk,4.0,,There is not much view here. But the place is really good for long walk or sit down watching the water.
,,Take a walk,5.0,,The walkway is adjacent to The Fullerton Bay Hotel and a stroll at night after dinner when its a bit cooler is a must. see all the sights lit up at night-spectacular
,,Nice area to take in the atmosphere of this special part of town,4.0,,"One Saturday back in April I had a free day to explore the better parts of Singapore - mostly by foot. The Waterfront Promenade is a nice place to unwind and take in the views. There is always movement on the water and it's nice just to do some quiet, relaxing people watching.

Having spent a large part of the day strolling around it was nice just to sit down, plug in my music and relax."
,,Relaxing walk,4.0,,Great walk around the bay area. Being refurbished in places but all getting better. Good for cycles too and a few tour groups going round. Take plenty of water as it's hot work walking anywhere here with heat and humidity.
,,"Great for romantic dinner setting, or hanging out with friends",5.0,,Amazing to visit at night. Beautiful high-tech waterfront truly expresses the future that is Singapore. Absolutely stunning architectural feat.
,,Sight and sound extravaganza on Marina Bay,5.0,,"Recommended by a local friend...saw the 8pm show tonight.

It commences with a fanfare from speakers behind the crowd, after a few minutes mist rises from small barges/fixtures on the water followed by a laser show with rainbows and animated holograms through the mist.

Great entertainment....kids and adults of all ages will be enthralled."
,,Nice view of Singapore at night,4.0,,"After reading about this before we left it was one of the attractions we made sure we went to. We were looking forward to this ""amazing light show"", however, it wasn't all that exciting. By all means go, we went just before sunset and it was beautiful to watch the buildings come alive with colour and light, however, the light show itself was very ""average"". We enjoyed the night having drinks at the Waterfront and taking a leisurely stroll around the harbour. It was very romantic."
,,Great View & Show,4.0,,A great place to hangout. The view is just awesome. Their water & light show is a must see. Kids will love it. Its free. It starts by 8pm & another show at 10:30 pm I guess.
,,great place to hangout,5.0,,"NIce place to sit in the evening and relax , after a day of of running around with shopping bags. Has a lot of lounge type seating area all around."
,,promenade with a great view,4.0,,"the waterfront promenade is located close to the marina bay sands hotel.it is a great place to hang out in the evening if you have nothing special planned for that day. you can occupy one of the benches, or sit at one of the many cafes sipping a coffee. at about 8 u can end your eve with the laser show which is best viewed from the marina bay sands rooftop cafes"
,,great lighting,5.0,,"Wonderful ray of lights and water display, A must see when you are at Marina Bay. Its starts around 8.00 pm weekdays. You can use the BUS or MRT to get there"
,,A great place to relax enjoy the view!,5.0,,"We often go for a walk along the waterfront promenade when in Singapore. There are some nice cafe's and restaurants in the area and we sometimes call in and have some refreshments at the Fullerton Bay Hotel and sit out on the front veranda and enjoy the views of the waterfront area. Along the promenade you will see the Merlion; three interesting; huge flower structures which are ideal for a good photo; two silver coloured panda bears sitting on the lawn near the Fullerton Bay Hotel; people exercising in groups in the park area and along the waterfront walk, and beautiful views day and night. As you walk closer to the Marina Bay Sands hotel coming from the Merlion area you will see some giant fans which also double as weather protection. These are solar powered and only come on when someone comes near them...very clever! Close to those fans is an entrance to underground shops and cafes. It goes for miles underground."
,,Night relaxing spot,5.0,,Cool place to hangout when night come. Nice view and windy place. Have many cafes around to sit down and drink. Good place to brings family and takes photo.
,,IBrilliant,5.0,,We had come back to Singapore after a long time and found the marina Bay Area fantastic.The marina bay hotel is so iconic and the light show is good especially watched from a bar overlooking the bay.
,,Kept coming back.,4.0,,"We made a number of visits during our stay, both in the day and mostly the night. Visit either side or stroll around, the view is different from every angle. Take in the music/light show twice a night, but make sure you view it from both sides of the bay."
,,Amazing for running's scenery,5.0,,"I was there for mini marathon and it is a great place for running according to path design and scenery. If you have a chance to visit Singapore, try to run at this place."
,,Views plus great cafes,4.0,,"We enjoyed walking along the Promenade, you can sit and people watch, enjoy the sights including the Boats on the River & if it is at night there's a great free laser show from the top of the Sands Hotel -the one that looks like a ship!!"
,,Lovely Promenade with an excellent view of the Marina,5.0,,"Singapore tour cannot be complete with a cliche picture of the world-famous Merlion! My friend and I randomly decided to trek the whole way from the Gardens of the Bay to the Merlion. (Good way to work out and save on the taxi money ;) )
Took us about half an hour but totally worth the mesmerizing views. We stopped at the starbucks on the way ( just a little before Merlion) and spent a nice evening catching up while gazing at the amazing view."
,,Came here to relax at night,4.0,,The night view from here is amazing for chilling. It is worth to come here if you are finding something quieter to do at night.
,,Nice riverfront walk,5.0,,"Nice water side walk, when we went there were some interesting flower sculptures along the path. Don't forget to see the Maerlion!"
,,Stunning view at Night,5.0,,"We spend our last day here such a perfect place to stroll around together with your love ones and friends. It is surrounded by beautiful lights, uniquely designed buildings and famous attractions. You can also Dine in and have some drink. Great spot to end your night."
,,Dazzling Waterfront....Marina Sands Bay...,5.0,,"Water front promenade is the epicentre of SG attraction with surround are the some of SG iconic structures and attractions, the waterfront get its life at night where the spectacular laser effects ,spot lights and lwater sprays combined with. Orchestrated musical show is performed daily ..visitors throng this place to catch up this spectacular show...its a fabulous show to watch for 12-14 mins...The waterfront is well illuminated withe Decorative colourful nights and the iconic Merlion at night with water pouring out from its mouth is another attraction, apart from the the entire place is serene with tall buildings and giant structures, the Helix bridge glitters and changes its colour..SG flyer can be seen at a distant as we walk along the pavements we can feel the plesant atmosphere of the ambience sit and relax at the evenings and at night..during day time the place is not so crowded ,you can tourist jus taking pictures near Merlion Park and Marina Bay Sands building....it's a lovable place to hangout and enjoy the waters....I strolled down the parents with bicycle around it..."
,,Perfect Evening @ Singapore!!,5.0,,Got to spend this evening at the waterfront promenade in Singapore; Also catch the one of its kind unique laser and sound show from the foot of Marina Bay Sands shopps area; Very Enjoyable; Highly recommended...
,,Three Buildings meh..,4.0,,"Three big building with half a banana or a bend ship on top of it, I still call it half a banana.It is an impressive building with very expensive hotel and high end culinary places in it.. that's it."
,,Take a short walk to see Singapore,4.0,,"Although it is hot to walk through the waterfront promenade, it worth as we can see more about modern Singapore. Beautiful view."
,,Great view,4.0,,The waterfront by the lion fountain is without a doubt the best place to see the water fountains and the pyrotechnic display from the hotel. Get there early and get a seat in one of the bars facing the hotel to really enjoy the show.
,,Singapore is an amazging city,4.0,,"The water front is an amazing space, defiantly worth checking out. Every night they have a free concert on & there's always multiple laser shops from the top of Marina Bay Sands."
,,Great laser show,5.0,,"Lovely place to walk along at night, the city lights are amazing! They do a laser show at 8pm and again at 9pm very night."
,,One of the few places with great view,5.0,,"This is One of the few places with great view. We were there on the Nichol Higway side and viewed the musical fireworks at MBS from Waterfront Promenade.
I think there are two free show every day. The fireworks are not as nice as at Sentosa but hey its free."
,,Great any time of the day,5.0,,"We have been in the morning, afternoon and at night. Great place to people watch, something always on and a free light show in the evening"
,,The first place I visit when I arrive in Singapore,5.0,,"An evening stroll along the promenade before going to drinks / dinner is like a rite of passage and always brings home how pleasant life in Singapore is, no matter what the critics say. Yes, the drinking establishments and (some) eateries are expensive but the environment is in proportion."
,,Amazing views across the bay,5.0,,"Fantastic area just to stroll around day or night, great laser show at 7pm in the evening, lots of boats on the bay with the marina bay sands hotel dwarfing the area, will miss this place"
,,Beautiful View of the city,4.0,,"The waterfront is a great place for an after dinner stroll. Its very hot and humid in Singapore and is a little more temperate at night. There are a lot of pretty views of the Marina Bay Sands, Fullerton Hotel, colonial area, etc. If you get worn out, taxi stands are easy to find at the hotels or shopping areas."
,,So much to see,5.0,,As the sun goes down Singapore lights up along the waterfront there is lots of stalls restaurants and just so many people that you can flit away a few hours and not even notice. 1 hour or 5 you will find something to do along this great walk
,,A very colourful evening visit.,5.0,,"A very attractive harbour view that can be extended by walking along the Olympic Walk to the Marina Sands Luxury Shopping Mall, the Science Museum and the Double Helix Bridge."
,,AMAZING !!!!,5.0,,Absolutely fantastic you just can't stop looking at this place we took loads of photos how they built this hotel is just mind blowing and the shopping mall underneath just needs to be seen simply wonderful and that's an understatement
,,Great for evening stroll,5.0,,"The waterfront promenade along Marina Bay is a great place for an evening stroll, with cooling sea breezes, city skyline lights, and interesting bars and food outlets along the Fullerton Hotel and Marina Bay Sands areas."
,,New Year's Eve 2015,4.0,,This is a great place to take a stroll. Close to some restaurants and malls. My husband and I came here to watch the firework display for New Year's Eve 2015 and WOW! It was one of the best we've seen. We were right along the water and got an up close view of the fantastic display. Loved it.
,,must visit in night!,4.0,,It is one of the biggest attraction in Singapore. it have water and light show every half an hour probably after 7pm(if I am not wrong) but its just amazing! it have a near by luxury mall.
,,Awesome,4.0,,"It is awesome during the day time as well as the night time, just so wonderful to walk around. There is a fountain show in the evening"
,,great walk,4.0,,best walk after drink at mbs walk all the way to lau pasat hawker centre and eat satays on satay street - great outing
,,Breathtaking cityscape,5.0,,"To walk along the promenade around Singapore's bay area is to see one of the most awe-inspiring city skylines in the world. On one side you have the sky scraping financial district with it's mix of towers that originate from the 70s till today. On the other, you have the iconic Marina Bay Sands hotel that gleams and inspires from any angle around the bay. Don't miss the Clifford Pier and Esplanade areas for a short drink stop. The views are worth it!"
,,Comes alive at night,4.0,,Visit this place late in the evening and enjoy the fantastic light age water fountain show later in the night. Beautiful place to hang around and enjoy the lively ambiance.
,,Very good at night,5.0,,This place gets very busy and on the evening there is a laser show from 20.00. Take your camera and enjoy the sights of the Merlion and all the lights around.
,,Beautiful,5.0,,"Its beautiful, do not miss the lighting show. It starts at 6.30 Pm - 7,00 PM and againg at like 8.00 PM. Thats just magical"
,,Take A Stroll,4.0,,"Worth taking the stroll after a dinner the enjoy the nightlights at the river, the commercial buildings, colonial building and MBS"
,,A prime example of how Singapore does it better than everywhere else,5.0,,Beautiful area during the day but this really is a must do at night when the whole area comes alive!! The light show and fireworks are something else!! Visit a rooftop bar for the very best views
,,Best at night,5.0,,"Buzzing with people and even running groups. Places to eat are over budget, but a walk around is definitely worth it."
,,Hugely entertaining,4.0,,"Great area to chill and take in the sights around the bay. Can be very busy and the myriad of people taking selfies can be a distraction"" However great fun nonetheless. Take your pocket book though......"
,,Visit at Night,5.0,,"We watched the light show at night and stayed at the promenade walking around till late. Singapore is a very safe place to roam around at night, and you can catch the last train or bus home around 11:30ish."
,,Walk over by dusk,4.0,,Its better to start your walk by dusk and the nights would look so beautiful. You can enjoy the laser show if you time it right. The lasers used are very powerful and its a beautiful scene.
,,Beautiful views.,5.0,,Beautiful sights from here.Do a night cruise on the bay and see this from the water.Fireworks each night.
,,Amazing views and great day out,5.0,,"A great place to visit for a whole day out, superb views, great bars/restaurants and such friendly people"
,,Good place to chill,4.0,,This is a good place to chill after dinner and watch the skyline of Singapore at night which is extremely beautiful.
,,Fantastic Atmosphere,5.0,,We spent a few evenings strolling the river enjoying the night life inside and outside of the different restaurants and clubs. Always plenty going on.
,,Best Tourist Spot,4.0,,"Even though I have been here many times, I always enjoy the Marina Bay Sands promenade area. This time I went there taking a first timer and she was impressed by what can be achieved by utilizing technology (laser and water show) and area (bayfront and buildings)."
,,Nigh light show,5.0,,"Waited on the promenade for the light show, was good but very short as it only went for 15 minutes and you could not here the music from the light show as the restaurants had there music up to loud but still a good night"
,,A Pleasant Walk,4.0,,"This is a lovely place to stroll with plenty of bars and restaurants, but very pricey. Try going during happy hour which is around 4 pm as a beer can set you back £10.00!"
,,NIGHT TIME LIGHTS,5.0,,"We went at night to see the lights of all the buildings, they all looked great, with all the different lights. Daytime it does not look the same but then you have the Hotel Marine Sands to look at."
,,Night Lights Display is Fantastic,5.0,,"This is just a great area to walk and see the Merlion, Marina Bay Sands Hotel, the Helix Bridge and so much more. Nighttime comes alive with a food area that is absolutely packed with people and atmosphere. The night light experience is just so, so good. Do not miss this."
,,Relaxing Place,4.0,,You can sit here and enjoy the light and sound show by Marina Bay Sands at 8 p.m. Nice place to relax.
,,Singapore-Superb view,4.0,,Must see in Singapore. Superb 360 degree view. Best in afternoon till lights come in evening. laser show superb.
,,Lightshow... see it from both sides.,5.0,,"Walking around the waterfront at nighttime is really special.

From the Merlion side you have a fantastic view of Marina Bay Sands hotel, including a really good look at the lightshow every night.
From the Marina Bay Sands side, you have a fantastic skyline of Downtown Singapore, as well as the water-fountain part of the same lightshow. Both sides of the water are definitely worth a visit."
,,Lovely area to vist,5.0,,"So beautiful to see Singapore by day and night the views of the city are fantastic. We went in the evening to watch the laser show think we more interested in the locals doing a Father and Son completion , this is a beautiful city with a lovely atmosphere."
,,Fantastic Singapore at its best,5.0,,You have to come here at sunset/night if you visit Singapore. It's fantastic! Best views of Singapore - the marina sands hotel/ Singapore flyer etc
,,Laser and Water,5.0,,come to this place on 8 PM and you will see a good attraction Wonderful Light and Water Show. the best view is in front of the shoppes at marina bay sands
,,great for evening walk,5.0,,"if you have a free evening and a walking mood, you should try this walking path. it is comfortable, easy to walk around the lake/river, great views."
,,Excellent non rainy day activity,5.0,,"Great stroll by the water while enjoying the nightly lazer, music and light show from MBS. Or go over to Gardens by the Bay for the light and music show at the Super trees:)"
,,Great place to visit especially in evening,5.0,,Excellent location to have a good walk and a heaven for night photography. We were lucky to have clear weather for all 7 days in Singapore. Spend at least one evening late into night here.
,,Awesome,4.0,,"Excellent views, just walking around is a nice experience. Be aware of the heat and humid weather of Singapore, take with you enough water and hit the street for a nice walk."
,,"Amazing look , be it day or night",4.0,,A nice place to be around be it day or night. More better if it has just rained as the sun in Singapore is Toxic. Lion mersmerising as ever.
,,"Great place to visit day, night or lunchtime",5.0,,"The Marina Bay complex is a excellent place to explore day or night.
Wear comfortable footwear, take camera and water bottle.
You may need a number of visits to explore in depth
Plenty of indoor shopping mall for protection from sun and rain.
Easy to reach via a couple of MRT routes and some buses or water taxi."
,,So sorry we missed the light show!,4.0,,"The Waterfront Promenade is clean, safe and a great place to wander round and soak in the sights of sounds of Singapore. Only being there for a very short time are just sorry we missed lightshow which has had great reviews on Tripadvisor. This said though, the waterfront during the day is a great place to spend a few hours and, compared to the hustle and bustle of the commercial areas, is a very calm and relaxing area."
