id,uid,title,score,date,content
71435204,lynch,,3,2016-03-08 12:55,新加坡的CHINATOWN，离克拉码头很近，地铁一个站就到，有各种各样的商品和摊位，夜晚人很多。个人感觉走走就好，没必要花太多时间在这里。
71435242,96****268,,4,2016-03-08 12:50,就是每个国外的唐人街，我们也照例到此一游，但带着孩子塔的兴趣不大，匆匆走了一圈坐地铁回酒店
71356616,潼大爷他爹,,3,2016-03-03 13:05,牛车水也就是新加坡的唐人街，没啥好说的，东西都是地摊货，纪念品也都是粗制滥造的国内小作坊生产，赢在便宜，吃没啥东西，如果单纯纪念品的话，还不如在机场过了海关去免税店购买，特产啥的都有，不过在旁边不远的地方有一处新加坡人下班吃饭的大排档，便宜，实惠，味道好，走路过去用不了十分钟，在别处3.5的饮料在大排档1.5，站在牛车水附近，在大众点评搜天天海南鸡饭，根据地图导航走过去就好
71355881,李白,,5,2016-03-03 12:14,新加坡的唐人街，中国商品最多的地方，到处有旅行社，美食和中国的银行，商场里面有兑换各国钱币的地方。
71348609,VG****0,,4,2016-03-02 22:36,为了天天的海南鸡饭去的牛车水，一出地铁就看到各种卖中国元素的路边摊还有各种中国餐馆，钥匙扣啊明信片啊各种纪念品貌似买的人还蛮多。这里的价格的确比金沙那边便宜很多。
84178736,霾都狗_,三天三夜>花样狮城>新加坡之旅,4,2016-02-27 22:38,牛车水是新加坡华人聚集最多的地方，拥有中国各地的小吃，是在新加坡的华人非常喜欢的地方。&#x0A;沿着干道一路走看到许多建筑颇具特色的庙宇，且由于正值春节末梢，道路上一片张灯结彩之景~&#x20;小街道里挤满了行人，各个摩肩接踵而过，在时下时续的阵雨天气里也是走出一身汗来。&#x0A;这里的美食丰富，虽说是华人街，放眼望去洋人面孔也不少~&#x20;街上的摊位多是棚顶下几张桌椅，走累了便坐会，买个椰子来吸~
71275079,制高点俯瞰,,5,2016-02-27 17:25,每次都是來吃火鍋的&#x20;思念美食的時候才會來這裡&#x20;其實坡縣哪裡都和天朝差不多啦
71268019,YIYI环游世界,,5,2016-02-27 11:11,牛车水其实就是新加坡的chinatown，在这里可以品味当地美味。不容错过的美食【林志源】就在牛车水。
84182581,Neva,三色之国新加坡,4,2016-02-26 09:21,晚上和朋友去牛车水chinatown吃的晚饭，是一家四川餐馆，但口味却出人意料的正宗，想必这里的其他餐馆应该也都是吃货天堂
71246340,鄧肯,,5,2016-02-25 21:34,就是買手信的好地方，藥油很值得買，還有一些小玩意也可以買一些。
71239484,天天成长,,3,2016-02-25 14:16,这翻译也是醉了，新加坡的chinatown，可以乘坐捷运过来，pagoda街里面有原貌馆，集中展示，便于了解
71218187,Snrgef1,,5,2016-02-24 11:00,在那里买了很多小纪念品，尤其是冰箱贴，价格不贵，回来还可以留个纪念，人不少，尽头还有个印度庙
71213730,tangbei78,,5,2016-02-23 23:37,有点像我们天津的大胡同，但他们的美食街还可以，进去直走左边第二家是卖各种海鲜小炒的，老板很nice，我们在他家吃饭顺便把我们国内兑换的1000元新币给兑换成了许多小面额的，方便我们后面的购物，非常好的商家。
71194995,米工头_,,4,2016-02-22 23:21,牛车水也就是华人街，简直是中国菜市场、感觉一般般不是很好玩…
71057411,hw9586,,5,2016-02-21 22:39,就是唐人街，规模很大，里面的中国商品价格还算公道，吃饭也不贵，还可以讨价还价，就像在国内一样
71300928,草原900,酷航来了--七彩缤纷星洲之旅,4,2016-02-21 14:36,牛车水夜市灯火辉煌，有点像中国的庙会，所不同的是簇簇攘攘的人群包括了世界各国各种肤色的游人。1月16日起，是2016&#x20;年牛车水农历新年庆典活动开幕典礼与亮灯仪式拉开序幕。这里将一个月多沉浸在鲜艳明亮的灯饰中。传统与现代设计的结合的气氛让人忘情迷醉于此。
71008820,hawkyu,,4,2016-02-21 07:36,相当于国内的小商品市场，全是华人的小店
70997347,Huanghh,,4,2016-02-20 15:29,相比现代化的新加坡，这可以看到一定原始风貌的新加坡。这里以卖小商品、本地药品、饮食、旅游产品为主，环境拥挤，象深圳改造前的东门和现在香港的女人街。文物建筑保留的不错，大部份东西一般，一些本地老字号的东西除外。
70984759,boboshu,,4,2016-02-19 23:00,到了唐人街稍许感觉亲切一点了，和在国内一样，无论是卖的东西还是熙熙攘攘的人群。在这里可以买到美珍香和林志源的肉铺。林志源的店铺少而且更独特一点，所以队伍排地老长的，只好选择买排队人少一点的美珍香。另外还逛了一下小摊，和国内小商品市场一样。在这里冰箱贴，10块钱新币可以买12个，比纪念品商店便宜不是一点点。在唐人街还能看见一个新加坡最大的印度寺庙，比小印度里的那座还要气派。脱鞋进去参观，印度寺庙和佛教寺庙完全是不同的风格，供奉的神灵的造型更凶猛和夸张一点，信徒祭拜的方式和风俗也有所不同，我们只是看看就好了。
70968484,138****3432,,5,2016-02-19 11:20,周边大部分居民和商户也都说汉语尤其喜欢里面那个卡片，它是新加坡最古老的印度教寺庙
71256100,jeremy401,星岛的风,3,2016-02-19 09:40,饭后，向北转到东西向的CROSS&#x20;ST，一路向西，及至看到了牛车水地标建筑珍珠大厦，经左转，便已是立时身处老旧沧桑的唐人街了。因为临近春节，满街的大红灯笼和红色的福字，到处喜气洋洋。两人漫无目的地闲逛，随着人流，经过了摊档鳞次栉比，人群摩肩接踵的狭窄的庙街，再转到小巧精美的佛牙寺，就又回到了丹戎巴葛路。
84104419,背包客nic,【新加坡派】狮城印象,4,2016-02-18 13:42,现在的牛车水是新加坡华人聚集最多的地方，拥有中国各地的小吃，是在新加坡的华人非常喜欢的地方。夜市的牛车水灯火辉煌，有点像中国的庙会。
70942407,cj****1,,4,2016-02-18 10:03,被称作当地的中国城，感觉比较破旧，像深圳的东门，有点失望
84070981,E01****98,再.见狮城,4,2016-02-17 14:43,牛车水俨然就是南京路，湘菜川菜馆很多。老巴刹、怡丰城、金沙美食城的美食都很丰盛。
70911015,HFHR2013,,5,2016-02-16 22:07,中国人很多，但是感觉里面还是比较坑啊，这到底是坑国人还是新加坡人呢，东西卖的都挺贵
84013537,zzzzzhing,#春节在路上#2016春节新加坡6日游记（含环球影城、水上探险乐园、摩天轮、滑车、退税攻略）,4,2016-02-16 17:12,搭地铁到牛车水，很热闹，虽是中国城但别有南洋风味。随便逛了一下
70900359,元丰九年,,4,2016-02-16 14:50,牛车水是新加坡的唐人街，店铺林立，感受历史，是游人必到的地方。
70879288,xkbmw,,4,2016-02-15 22:05,牛车水的英文名字是China&#x20;Town，实际就是新加坡的唐人街，由几条纵横交错的小巷组成，全是华人经营，主要卖些小商品和当地特色餐饮，也有大陆过去的中国人开的中国各地美食，味道也还不错。有地铁直达。
70804172,超人姐姐,,4,2016-02-13 00:43,特别有中国特色，不愧叫唐人街！第一次去新加坡的话要去逛逛，或者要买林志源肉铺的话要去那排队。美珍香不用排队。其他东西，真的没啥看头，就拍拍照片到此一游，就像上海的七浦路，乱哄哄滴，可能快过年了，人特多，摊头林林总总很多各种东西，不感兴趣。排队买买了林志源肉铺就走人了。距离克拉拉码头地铁一站路，来回票3.2新币。
70754463,红粉巫婆,,5,2016-02-10 23:16,中国人很多，春节气氛很浓，服务态度很差，交通灰常方便
70750239,devilcry,,3,2016-02-10 20:25,在除夕晚上去的。由于除夕，新加坡的大商场和饭店基本不营业或是关门比较早，就造成了除夕那天牛车水人山人海。各国旅游者全都汇集到了牛车水，到了寸步难行的地步。说实话要不是除夕就是为了图个热闹，牛车水真不值得去。环境在新加坡来说属于脏乱差了，没什么可看的，吃的也很一般！去的时候是除夕，图热闹，不在乎，要是平常去的话感受会更差吧。
70716264,旅游交友,,4,2016-02-08 21:30,过新年，牛车水是华人的最热闹的景点
70702711,286****917,,4,2016-02-08 00:07,新加坡的唐人街，有林志源的猪肉脯卖
70691608,_CFT01****3196911,,3,2016-02-07 12:23,在牛车水（Chinatown）感受浓浓的中国年！街道犹如城隍庙，红色新年挂饰满大街！老字号店门口大家排队买着年货！在美食城吃点东西，老板拿来厚厚菜单，里面囊获川菜、粤菜、湘菜、东北菜，新疆菜、各地菜肴都有！
70689005,139****0874,,5,2016-02-07 08:07,临近过年了，那里又有中国城，年味特别浓重，好吃的东西便街都是，挑花了眼，上图你们自己看。
70681113,200****072,,4,2016-02-06 17:06,新加坡的中国城，很中国，过年期间年味比国内还浓，有条美食街，基本上新加坡的当地美食都能找到。购物的话有点国内批发市场的感觉，很多条胡同都是小店铺，属于老百姓的首选，不像乌节路那样高大上。
70644655,Ivan,,5,2016-02-05 12:08,这是最早华人社区，也是新加坡的唐人街，每当春节或者中国的传统节日，都一片热哦闹
70526319,185****3669,,3,2016-02-02 08:35,环境不太好，有点乱，真是喜欢不起来，楼上的熟食中心还不错，里面的华人很多，沟通不是问题
70521772,winson,,5,2016-02-01 21:10,牛车水的美食街很值得去，尤其是卖蟹的这一家，味道特别棒，一定要尝一尝。
70504965,旅行-增添生活色彩,,4,2016-01-31 20:09,有地铁牛车水站，出站就是一个小商品市场和一个牛车水博物馆，周边值得逛逛。
70502254,天使在游荡,,5,2016-01-31 16:03,做为新加坡唐人街的牛车水，这个名称的由来是因为当时没有自来水，牛车运水情景是在唐人街非常普遍所以叫牛车水。现在牛车水是新加坡华人聚集最多的地方，拥有中国各地美食是在新加坡的华人最喜欢的地方夜市的牛车水灯火辉煌有点庙会的意味。在这里吃吃喝喝看看很有意思.
70496055,_WeCh****58503,,4,2016-01-31 08:45,夜晚牛车水的外景哦！值得来看看，就是人多的让人窒息
70487930,ai****50,,4,2016-01-30 17:11,牛车水新加坡的唐人街，绿颜色外墙的珍珠大厦里可以买到各式来自国内东西。
70485191,185****3669,,5,2016-01-30 13:43,属于新加坡的唐人街，非常繁华热闹，买伴手礼可以讲价的，这里面小吃也很多。
70437851,Toyan,,4,2016-01-28 12:04,應該很多人不知到在唐城坊裡面還有一個中文圖書館吧，裡面全是中國書籍，是一個鬧中帶靜的好地方
70414030,gykxxx,,5,2016-01-26 21:57,华人在外国的团结友爱，共同抵御外抵，如乡随俗的融入好当地。
70398564,maychen,,4,2016-01-25 20:45,牛车水是新加坡的华人区，进入牛车水区域的标志就是一栋大楼—珍珠坊。牛车水的房子都大约只有两三层高，保留了福建、台湾地区的建筑风格，也称为“骑楼”，一楼营业、二楼住人，楼下走廊遮阳又避雨，很是适用
70434669,弱冠年华,带着家人去旅行！新加坡、圣淘沙5天4晚度假之旅！,4,2016-01-24 14:02,下午老妈想去感受新加坡人的本地生活，自然不能错过牛车水，这里一带是新加坡唐人街的所在。酒店楼下有地铁站，两站便到了，非常方便。如果想要买当地特产和手信，在这里再适合不过了，&#x20;这里也是最便宜的！可以买一些冰箱贴，非常便宜。
70360479,e01****90,,5,2016-01-22 17:03,牛车水地铁站一出来就是一条很有风情的小街，不仅仅是中国风，更像是各种风情的大融合，色彩斑斓完全胜过小印度。也就是大家熟悉的唐人街啦，要买手信什么的可以来这
70360611,动力,,3,2016-01-22 16:33,在新加坡的第一晚住牛车水，这里是唐人街，早上去外面小店-吃早饭，店铺的老板基本都会国语，交流没有问题。里面的集市也值得一逛，人气还是很旺的。
70348431,精灵背包游侠,,5,2016-01-22 14:48,俺们中国游客绝不会不来的景点，这里就是最有中华特色的购物老街区了，虽然新加坡是华人国家，但这里才最有中国文化味道。
70339026,爱爱李,,4,2016-01-22 09:39,牛车水是这里的一个风情街，这里的购物和美食是新加坡最好的，购物的时间很充裕，安排了一整天时间购物，这里有快餐和自助餐厅，可以自由选择。
69763186,欢乐英雄,,4,2016-01-19 13:50,牛车水就是新加坡的唐人街，以前没有自来水，唐人街大多用牛车运水，便称唐人街为牛车水。到这里主要是逛各种商铺，吃点小吃，也可以买礼物带回国送人。到牛车水这边还可以参观佛牙寺龙华院，马里安曼兴都庙&#x20;(Sri&#x20;Mariamman&#x20;Temple)&#x20;和詹美回教堂&#x20;(Jamae&#x20;Mosque)。
69688825,无心快鱼,,4,2016-01-13 19:52,是新加坡的唐人街，混居着诸多种族。这里有许多大商场、小店铺，到了夜晚，就是餐厅、酒吧最热闹的时候。
69685383,grac****103,,4,2016-01-13 15:52,这里是新加坡的唐人街，可以购物一些小商品
69659472,chongLIchong,,4,2016-01-11 20:36,华人聚集地，可以在这里尝试到相对正宗的粤菜和福建菜。当然这里也是基本广东人和福建人为主
69649928,_bbc****05384,,5,2016-01-11 11:00,离鱼尾狮不远，这里是华人聚集区，食物很便宜
69641287,138****7652,,5,2016-01-10 16:51,这里人太多，好热闹，就像中国的步行街一样
69628841,LYYYYL,,4,2016-01-10 10:45,从地铁口出来就是原貌馆和幸运牛车水，沿小街可以达到麦士威熟食中心，所谓天天海南鸡饭就在其间。但个人认为不算好吃。&#x0A;街道不宽，小商品店林立，建筑特色让人喜欢。
69599696,陆五花,,5,2016-01-08 11:19,很多华人在这里，有很多好吃的在这里，还可以买伴手礼
69607007,老粗人,"""下南洋“之狮城之旅（性价比超高的新加坡自助旅行）！",3,2016-01-07 22:20,"&#x20;我们升级到了47层，离57层的空中花园很近。寄存万行李，再乘坐地铁去今天要去的景点----圣淘沙海洋馆。蓝线到牛车水（chinatown),转紫线到港湾（harbourfront),同样电梯到顶楼乘坐捷运专线到达圣淘沙。"
69592385,玉之晶莹,,4,2016-01-07 20:23,牛车水（Chinatown）是指新加坡唐人街的意思。牛车水名字的由来是当时没有自来水，牛车运水情景在唐人街非常普遍，便称唐人街为牛车水。现在的牛车水是新加坡华人聚集最多的地方，拥有中国各地的小吃，是在新加坡的华人非常喜欢的地方。夜市的牛车水灯火辉煌，有点像中国的庙会。牛车水街边的冰淇淋推车值得试试但价格比码头附近高20分
69152310,旅行-增添生活色彩,,4,2016-01-06 22:54,据说是新加坡华人最集中的地方，其实是华人最初奋斗的地方，有牛车水地铁站，有华人生活博物馆和各种店铺。
69134088,曲线射门,,4,2016-01-05 22:20,新加坡华人聚集最多的地方了，大排档小吃品种也相当地多，虽然是大排档，但是很干净，没见到一只苍蝇，确实干净的很
69116043,sa****t,,5,2016-01-04 19:18,中国城Chinatown，全世界各地的中国城都是乱，热闹，Low，这里也不例外，可以看到很多年前祖辈们下南洋的身影，现在很多川菜馆子
69100366,_WeCh****69614,,5,2016-01-03 21:39,这里就是唐人街啦！各式各样的中华料理！还有各种旅行社，飞机票啦！生活用品啦！什么小物件啦！都是有的，在新加坡配钥匙比较难找，在牛车水就有的，而且价格便宜！
69090914,wxx1026,,3,2016-01-03 11:56,还可以吧，2014年春节去新加坡旅游时跟着导游坐车来的，晚上在灯光的照射下整个街道过年的味道很浓，让人觉得很温暖，虽然坐在双层车顶风吹着很冷。下车后我们找了家餐馆品尝了有名的肉骨茶。
69057751,阿巧桥,#发现旅行中的丝涟# 暴走吃货北京妞的轻奢新加坡之旅！,5,2015-12-30 21:45,我觉得牛车水还好啦，就是几条卖中国杂货的街啦，和其他Chinatown没什么区别，除了林志源肉脯和一些比较经济实惠的小餐厅外加对外币比较划算，感觉没什么“游玩”的地方，没时间真的可以不去。（不过如果是一月份的到可以去牛车水感受一下国外唐人街过春节的热闹氛围）
68991002,灰姑娘的南瓜车,,5,2015-12-30 19:41,"牛车水就是著名的中国街，SONGFA肉骨茶真的跟传说中一样好吃,牛车水Chinatown的灯，东南亚的暖风、人来人往人流穿梭不息,还有沿街的开放式酒吧."
68990723,Samanthazx,六天五晚穷游狮城,4,2015-12-27 22:33,&#x20;坐地铁到牛车水，出了地铁，在牛车水市场里大概逛了一下，就去佛牙寺对面的麦士威尔美食中心了，因为是下午去的，不是吃饭的时间，人不多，大名鼎鼎的天天海南鸡饭就在这里。个人觉得这里的鸡饭没什么特别，SGD5&#x2F;份，不过这家对面的饮品店里的牛油果奶昔很好喝，味道浓，而且量大，一杯只要SGD3，真是价廉物美。吃饱喝足后就去佛牙寺逛了一圈，进佛牙寺不能穿着过于暴露，里面有免费的披肩供穿着不合适的游客使用。牛车水市场里有著名的冯满记药油，那里的肩颈舒是比较有名的，一瓶SGD12。牛车水还有著名的林志源猪肉脯（招牌肉干SGD15&#x2F;300克，金钱肉SGD13.8&#x2F;300克）。味道很不错，不过储存时间不长，只能放十天。
68942821,向你投翔,,4,2015-12-27 15:48,就是唐人街啦。这边的建筑还算有特色吧，有很多彩色的雕塑，环境很好，有很多外国人在这。来回做地铁也很方便
68856036,yyhyh,,5,2015-12-24 22:12,特地去的牛车水，据说这里蛮出名的，是一个很有特色的地方，这里确实是很热闹，蛮值得去逛逛的
68388469,190****692,,4,2015-12-23 22:23,牛车水是新加坡的文化保护区之一，这里是华人的居住区，就是唐人街。在这里玩用普通话交流就行了。
68914001,小小莎老师_,云端上的旅行梦——翱翔狮城,4,2015-12-23 20:07,选择住在牛车水，那是一种在陌生国度对熟悉文化的信任与安全感，而且那里还有不少便宜的住宿，适合独行的穷游者。坡国地铁很方便，四通八达。从机场也可以直接乘坐地铁到达中国城。
68911121,e29****42,新加坡、澳门自助游,4,2015-12-22 17:20,新加坡给我最大的感觉就是干净，几天来，所到之处都是干净整洁，没有卫生死角，从高空看下去，风景如画，没有乱搭乱建的棚子，没有乱七八糟的地方。至于钱，可以带人民币现金去新加坡牛车水换，牛车水一楼有一家天天排长队换钱，他家的汇率最合适。新加坡的小吃很好吃，各种东南亚小吃，经济又实惠，有炒虾米粉、肉骨茶、榴莲饼等等。
68357850,zeniahx,,4,2015-12-21 19:06,牛车水其实就是新加坡的唐人街，在这里用中文沟通也可以。但是没有特别好玩。
68333505,_bbc****05384,,5,2015-12-19 21:28,吃东西非常好的地方，有很多便宜的美食，但是买纪念品就算了，全是义务货
68296459,肥肥安大王,,5,2015-12-16 22:04,聚集餐饮，纪念品，美甲纹眉等等，很多老招牌的店
68909035,chi****08,#我的2015#(不一样的体验)新加坡原生态5天自然之旅,4,2015-12-16 21:21,去完小印度，就去牛车水，也在附近（地铁紫线NE4)。牛车水其实没太多可看，我主要是为了完成任务，去冯满记买豆蔻膏，这个是专门资料蚊叮虫咬的，4元一瓶。另外白树油说的很厉害，什么都行，也买了一瓶，3元。冯满记好像没有网址，不过产品网上很多介绍。除了蚊叮虫咬，跌打类的也有，听说都很管用。
68292252,动力,,3,2015-12-16 15:40,唐人街，很繁华，中文交流没问题，各种小商品都有。
68290154,wenjun,,4,2015-12-16 13:39,新加坡的唐人街，那里有条河，两边都有一些酒吧，下午已经有些外国游客坐在那里喝酒聊天了。我和老公在那里逛了一圈，觉得建筑外墙很有特色，适合拍照呢，不过没在那用餐，觉得有点小贵。
68175144,妞V给大爷笑一个,,5,2015-12-10 22:22,新加坡的唐人街，我还看到了海底捞和小辉哥火锅，好亲切呢。所有人都说中文，哈哈哈哈。感觉好亲切呢，其实里面就是一个小商品市场。类似上海的城隍庙，哈哈哈
68908119,老吴,新加坡5日完美自由行、亲子游的首选,5,2015-12-10 13:36,Street）：牛车水最值得推荐的莫过于这条地道风味的露天餐饮街。最出色的小吃有鱼丸面、薄皮卷、炒粿条、萝卜糕和Rojak等。摊位大多从早晨11:00开至晚上23:00，价格非常实惠。
67739483,zuika,,5,2015-12-07 23:57,有好多好吃的店，唐人街附近还有寺庙，很值得一去！
67715165,旅行-增添生活色彩,,4,2015-12-05 17:15,中国的摊贩店铺多些，居然还有卖中国钱币文玩的市场，不妨逛逛。
67710888,peggy11111,,5,2015-12-05 10:45,其实就是新加坡的唐人街啦&#x20;满眼望去都是华人&#x20;听到的都是家乡话&#x20;很是亲切&#x20;还可以品尝家乡美食小吃
68894392,jasmine,狮城的十二道风味,4,2015-12-03 22:48,第一站牛车水&#x20;因为是China&#x20;town，不太陌生，所以不作过多停留。觉得这个路名翻译很传神，谐音又会意。
67689426,muggu,,5,2015-12-03 06:50,牛车水人很多，很热闹，有很多便宜的小商品，还有很多好吃的美食，感觉很棒。
67686406,Slyling,,4,2015-12-02 21:36,牛车水是新加玻市中心很多中国人聚居的地方，晚上会有大排档。感觉就像香港的庙街。
67684794,15****382,,5,2015-12-02 20:20,土生土长的华人居住区，有点像广州的上下九步行街，有吃有礼物卖。
67675960,哞哞724,,4,2015-12-01 21:43,chinatown就是新加坡的唐人街，但为什么中文名叫牛车水还真没搞懂，其实作为中国人不怎么爱逛这里，仿佛有种进了古文化街的感觉，街边很窄，两旁都是店铺，也有很多中国餐馆，在这里90[%]都是华人，可以说中文
67676076,chengse12135,,5,2015-12-01 21:31,很热闹的一条街道，有很多的小商品卖，如果时间充足你可以悠闲的在这里逛逛，很不错的选择
67669514,M11****030,,5,2015-12-01 10:56,其实中国很强大，走到哪里都有唐人街，新加坡的唐人街叫做牛车水，很惊讶的是很多中国传统的小吃，小时候看见的，国内几乎没有了的在这里特别受欢迎。那条街上有一间糖水店，味道口感很好，可惜不记得名字了。必须要提一下，打心里觉得那里的工艺品都出自义乌，&amp;#128516;
67660554,ruby,,5,2015-11-30 23:15,就是中国城，地铁出口就是，周边还有几个特色寺庙，有观音堂，有印度的寺庙等等，从小吃到小商品，应有尽有，不过国人也就买些吃的为主，其他东西国内差不多都有
67604398,134****4152,,5,2015-11-28 21:37,牛车水是新加坡的唐人街，很多中国人，很多摆摊的，衣服，小商品，小玩意儿很多货品，很少有大品牌，也有旅行社，很多人买机票也在这儿，我的中国住在新加坡的朋友寄钱回国也在这
67384412,m16****835,,5,2015-11-27 22:31,是新加坡唐人街的名字，在这里可找到最美味的本地小食，比如炒粿条、萝卜糕。
66742961,Effie-Qian,,4,2015-11-24 20:23,牛车水就是所说的唐人街，两边中文招牌林立很熟悉的感觉。
66713009,sxsd-,,4,2015-11-22 12:49,其实很一般，可能不是吸引中国人的地方。大多外国游客。建筑还是很不错的
66706025,Darling-dyt,,4,2015-11-21 18:00,唐人街，有各种小玩意儿，吃的小餐厅也很多，还能看到海底捞（火锅店）
66689324,E17****85,,5,2015-11-19 21:51,去牛車水的時候剛好是中秋節，路上掛滿了燈籠，很有氣氛
66686924,潇潇潇潇,,5,2015-11-19 16:01,是当地很出名的地方，也就是俗称的中国城，人很多，而且有很多买小商品的店，很热闹。
66318857,94664934962464,,5,2015-11-18 23:05,中国城，说实在的没看出中国风格，为了去吃天天海南鸡饭特地跑去的
66746627,ga****uo,菓爸菓妈迟到两年的新加坡之旅 美食与爱不可辜负之旅,4,2015-11-17 22:22,PARK&#x20;COMPLEX），牛车水著名的购物中心，都是一些个体小摊位，出售各种商品。比较有意思的是珍珠坊和珍珠大厦里都有不少摊位出售各种珠石，新加坡人用来DIY耳环、手链等各种小首饰。国内也很流行这种DIY的小首饰，不过珠石种类远没有这里丰富。
65492808,百合窝,,3,2015-11-16 20:32,很像北京的小商品批发市场，正好看到了这个建筑，还算是比较好！
