id,uid,title,score,date,content
5128468,林小冷,,4,2014-05-30 10:49,新加坡的chinatown-牛车水。牛车水是购物中心、特色小店、百年老店和各种小贩聚集中心。美食、手信让人眼花缭乱。吃饭加逛购物街，买纪念品回去送朋友。
5080065,云游四海翁,,4,2014-05-15 20:08,牛车水是新加坡的唐人街，面积不大，有很多四通八达的小巷，有时间的话，可以四处逛逛。需要注意的是，最好选择傍晚来牛车水观光，因为大多数商铺白天都不营业。不过，白天可以逛妈祖庙和一些清真寺。
10717166,Bjqiqiwendy,狮城深度行（新加坡3晚四天游记）,3,2014-05-10 22:31,中国人的聚集地，乘地铁过来很方便，珍珠坊，佛牙寺，很有特色，商品街里的东西还不错！&#x0D;&#x0A;挺热闹的，周边店很多，离天天海南鸡饭也不远。地铁站下面有个很大的超市，东西很划算。
4625512,25310520,,4,2014-05-09 15:35,吃的不错，吃了椰子两只，沙爹鸡串和羊肉串。很典型的东南亚风味，甜甜的透着炭烤的香味。
4613177,清清维,,5,2014-05-07 10:39,这里很有中国过去那种古老的感觉，很多的华人都住在这里的，有很多的小商品店，游客也比较的多，当然还有很多的美食拉，
4600466,阿笨星,,4,2014-05-05 12:49,就是新加坡的唐人街了，路边小店林立，但工艺品和纪念品都做得很粗糙，在这里买了一些肉骨茶包和新加坡产的药膏，很灵的。
11875711,孫羽孜,漫游东南亚之后花园——新加坡四日悠闲,4,2014-04-30 23:21,毕竟算是在新加坡能够找到比较有异域风情的地方之一了
58448093,都是花菜,熙熙走天下之第一次出境游------2014年春季新加坡马来西亚新山7天6晚亲子游,3,2014-04-30 09:15,在牛车水大厦二楼，才能感受一些当地人生活特色，这里算老华人聚居地，二楼都是食厮小铺，食客大都华人，中老年居多。老人面前摆着几瓶啤酒，煲仔饭，米线，小炒，基本是闽南特色。我在楼下拐角看到一个骑着板车的老人，神情疲惫。晚上返回酒店路上又遇到一个运着一车纸箱板车老人，在他们脸上我感受到是生活的沉重。或许这个人均月收入三万人民币的城市里也不全是灯红酒绿。
10725879,Crystal喜宝儿,阳春三月走狮城----两位青年暴走新加坡,3,2014-04-23 11:10,从亚坤吐司顺着华人步行街方向走，就是牛车水，牛车水这地儿实在是没什么可去的，感觉就跟我这蜜友的名字一样！！忒没劲！！！！！不去也罢，还不如秀水呢，就是蒙老外的地儿
70689716,fairy微微,大手牵小手&开启环球之旅@13天六站,4,2014-04-21 00:00,打车去牛车水，直奔林志源肉干店，真的好吃，可以尝，我们买了肉干和鱼松、肉松，孩子很喜欢！味道超棒，但也真的不便宜~&#x0A;&#x0A;顺着林志源店我们来到了牛车水购物一条街，都是些地摊货，没什么好逛的，走走看看就可以了~
52955171,nazimi,梦开始的地方 新加坡5日自由行,5,2014-04-19 17:56,之后到牛车水的maxwell&#x20;food&#x20;center&#x20;吃晚饭&#x20;大家都提到的天天海南鸡饭果真排好长的队&#x20;而且很快就卖完了&#x20;不过真的很好吃！&#x20;还吃了薄饼&#x20;番薯蛋&#x20;豆花&#x20;酸柑水。豆花最好吃！
52955020,perilyn,美丽新加坡的6天5夜自由行,4,2014-04-13 00:46,牛车水，其实就是新加坡的唐人区，都有卖中国饰品和中国餐馆，我们在那里尝到了东北凉皮~我也不知道算不算正宗，因为我也从来没吃过正宗的东北凉皮~另外，新加坡的水果挺便宜的，特别是榴莲，各种不同的品种，价格也各异，超市里的蓝莓遇上打折，一盒才3新币都不到~
11924186,皎皎小姐,新加坡印尼渡个小假！,4,2014-04-11 12:11,走出Chinatown地铁的瞬间惊到说不出话来&#x20;匆匆镜头下没拍出的那种味道&#x20;是要走进这个世界才能体会的！有意思！
4153831,sarielxie,,5,2014-04-08 14:49,其实可以想象成香港的庙街。。也是卖一些小东西的街边摊。。。逛了一圈。。啥也没买到
11920203,老板de娘,天“马”“新”空-我们的游乐场,5,2014-04-07 22:11,很有年味的唐人街。欢天喜地迎新春。牛车水美食街。
58350848,xmy_king,懒人的新加坡5晚6日自由行,3,2014-04-05 00:00,熟悉的中国元素随处可见。并且意外的见到了攻略中的马里安曼兴都庙和詹美清真寺，（后来看攻略才知道原来龙华佛牙寺也在边上）天气不好，人也不多，我们穿的短裤拖鞋就没进庙，在外面拍几张留念。
3443131,151****5836,,5,2014-03-25 18:00,Chihfuiftijg
3440894,好斌斌,,5,2014-03-23 20:18,牛车水是唐人街的意思，大致意思就是这里一带的华人用牛车运水，最后简称这条街叫牛车水，可能因为我们来自中国，所以觉得这条街没有什么特色，旁边有些中药店之类的，感觉有点像香港，牛车水还有一座有名的寺庙，可以参观一下外观。
52955281,东萍涵,新加坡、民丹岛5晚6天自由行,5,2014-03-18 14:26,因为NE线要经过牛车水，我们临时决定到牛车水的中国城转一转。在中国城把晚餐解决了，逛了一下夜市，买了点网友评价比较好的林志源肉干。
3428428,比尔吉沃特,,4,2014-03-16 21:04,有很多小吃，这里的店铺还有建筑也有过去中国那种古老的感觉，牌子都是竖着的像老香港老上海
3426055,highooo,,4,2014-03-14 22:27,牛车水也是新加坡的常规景点之一，很多的华人都住在这里的，小吃也是很多。
3421928,蓝木的旅行态度,,4,2014-03-12 13:16,这里已成为一个古老华人社会的缩影，可听到地道的方言，尝到纯正的风味食品，买到传统的唐人日用品。
3414470,冰龙斯卡萨,,4,2014-03-07 14:28,本来没打算去这里的，在机场咨询台问路的时候有个也是中国的工作人员介绍去这，去了之后发现中国同胞果然没骗我，确实不错。中国气氛很足
58350217,小小鹿_Joy,那些天，我们一起玩转的新加坡,3,2014-03-02 00:00,牛车水是指新加坡唐人街夜市的意思。个人不是很推荐这个地方，比较乱，街边都是各类的小摊贩。
3404755,牛牛jack,,4,2014-02-28 21:53,这里就是唐人街，一般去新加坡市区游览的话总会安排到这里逛逛，有不少特色的小纪念品以及可以品尝到如薄皮卷类的街头美食
3404730,i游走的虎,,4,2014-02-28 21:43,很多中国游客都会去的景点，游客很多，也很热闹。特别是每当夜幕降临，餐馆的老板把桌椅都摆放到街上，坐满了来自世界各地的游客在这里大快朵颐地吃着当地美食，实在是太爽了。
3400370,210****762,新加坡5日快乐亲子游,3,2014-02-27 09:37,个人觉得没什么意思，就是个卖小商品的地方
3399562,鹄立头,,4,2014-02-26 16:35,著名的唐人街，很多在中国见不到的老手艺，在这里也都能见识到，小吃也很多。
11949310,118****090,漫步狮城,4,2014-02-24 16:49,China Town又称牛车水。据说此名由来跟当年这里无生活用水，聚居在这里的华人劳工多用牛车往这里拉水用有关。我更喜欢它的中文名：牛车水。6号线牛车水站出来也是一座不高的建筑，低楼小商品铺子、吃食铺子较多，有卖鸭脖子的、各式生活用品的，质量不高、价格也不高。从车站出来，有几条街上都是熙熙攘攘的人群，因为今天是年三十，这个中国人的节日在中国人聚居地地方当然是更有气氛。街上挂着好多灯笼，真是万马奔腾，各家饭店居然都已订满，想在这里吃年夜饭的我们最后不能忍受拥挤的人群、嘈杂的声音打车去了Clarke Quay。想去那里的“珍宝”吃海鲜，到了被告知客满，无奈上了二楼的“陈福记”，不过也很好吃。要了一份斯里兰卡大螃蟹，清蒸，一个炒牛柳，一个炒芥兰，一份鱼和豆腐汤，一扎啤酒，可口。
3389723,mmm212,,5,2014-02-23 11:01,很喜欢这里复古又怀旧的气息
3391533,MOCHA,,4,2014-02-23 00:15,小商品摊位聚集的街道倒是逛逛看看就好，没感到什么特别，反而走街串巷在附近找到不少香港的老字号。意外收获。
52956398,小苹果在江湖,新加坡四天三晚自由行（2013.4.26-29）,3,2014-02-22 22:58,感&#x20;去牛车水的时侯已经快到中午时间，天气开始热起来了。牛车水这个地方小人又多，而且看起来乱糟糟的，没什么感觉。店铺一家挨着一家，要找到计划中要去的那些店也不太容易了。所以，就只专注找到了林志源，在一家看起来蛮大的药材店买了一些新加坡出名的药品还有一些调料。
3385937,210****627,,5,2014-02-21 14:33,的很大，晚上和另一半来就更好了。还有专门可以吃饭的车厢。可以来看看&#x0A;
3383450,喜欢闲游的小资女人,,3,2014-02-20 16:31,我是去红点展览馆时途经牛车水。找了两天换钱的地方，终于在那里找到了。而当我穿行在牛车水两旁商铺林立的狭窄街道上，居然意外地发现一块巨大的石头钱币，号称是“世界最大的钱币”，当属一个惊喜，还拍了照放到我的游记里。
52956420,懒猴猴s2, 片刻的停留，体会新加坡的美,4,2014-02-18 22:23,&#x20;在牛车水看到印度妹纸用朱砂在画纹身。去不了印度，就在这体验下吧。我觉得这纹身画在印度人黝黑的皮肤上更美哦。按图案复杂程度不同价格也不同，花了5新币画了个。可以保持5天左右，话说我意大利回来还没洗掉呢~
3362080,m62****08,,4,2014-02-12 13:26,推荐春节的时候去，又不少活动，很热闹。过一个不一样的新年也不错
57597361,181****1903,玩转新加坡之旅程,4,2014-02-09 00:00,把小印度和唐人街作为这次狮城之旅的最后一站是为了让姑娘体会到不同种族、不同阶层的不同生活同时感受到华人在国外的团结和勤奋这些在国内逐渐缺失的民族精神反而在这里体现得淋漓尽致向所有新加坡的华人同胞致敬
3357857,yufenggt,,3,2014-02-08 22:20,唐人街人气很足，八道馆的将军蟹很好吃，不过，春节假期林志源店休市了，有点可惜，下次再去。
58535888,529559598如意,马年游新马-亲子自由行记,4,2014-02-05 00:00,5分钟路程有家自助洗衣店，在牛车水大夏。想着洗衣还要5坡币，不如自己在酒店洗好后烘干就好了，太多衣服了，花了8坡币烘的还不是很干，回来再凉凉。贵着呢。。8点多了才吃晚餐。就在酒店过去一点。很方便。晚餐当然少不了攻略上推荐的辣椒螃蟹。。晚上10点左右才出发到鱼尾狮公园。。呵呵，一到放假，我们家都是欧洲时间。。晚睡晚起。。
52961846,67****890,一家五人的春节新加坡5日自由行,3,2014-02-04 20:14,&#x20;到牛车水太早了，才9点不到，冷冷清清的没什么人，店铺也没开。
68893779,车夫的杂谈,一起玩转新加坡(下)(2),5,2014-02-04 00:00,本来想在中国城找点好吃的，结果只找到了牛车水大厦内的大排档。这里都是老人，吃饭真便宜，在别的地方海南鸡饭5新元，这里只有2新元。一顿饭合人民币才10来块钱，比在中国都便宜。这才是当地普通老人的生活。
3343725,182****5333,,5,2014-01-29 07:15,现在只有在唐人街才有春节的气氛
3332801,蓝色的郁金香88,,4,2014-01-26 12:57,2000年之前的6年经常去这里吃中国食物，最喜欢的臭豆腐一段时间在这里很风靡，也引起这里居民的非议。喜欢在这里买香水，同意的牌子便宜很多。
3330435,Oliverni,,3,2014-01-23 17:50,看见括号里写的唐人街就觉得很好玩，没有人会这么叫新加坡的chinatown啦。很奇怪的。这里是义乌小商品市场，质量没有保证。不过有很多很多很多很多火锅和川菜店。是每周末聚会的好地方。
52962088,维尼小熊2,【新加坡】花园国度吃喝玩乐全攻略,5,2014-01-14 14:23,牛车水是新加坡的唐人街，是当地华人聚集最密集的地方，也是现代购物中心、各色小贩和百年老店毗邻而居。漫步在小巷中，会看到手工艺人制作的各种古色古香的工艺品，从中可以了解中国的传统艺术，如书法、雕刻、木偶、佛像和香烛制作等，中药店保持着传统风貌，一格格的小抽屉多得让人眼花缭乱。
3322840,爆笑猪,,4,2014-01-12 21:17,好吃好玩好热闹。中国人的聚集地。可以买到很多小礼品带回国送人，价格也不是很贵，美珍香在那里有两家。旁边的麦斯威尔熟食中心有好吃的海南鸡饭。
52962108,爱吃甜食的June,2013圣诞节新加坡之行,3,2014-01-10 20:44,边看边走，走过艺术博物馆和国会大厦，还有路过一个有意思的印度教的庙，不知不觉走了30多分钟，到了China&#x20;Town，&#x20;牛车水。牛车水是一家连一家的小商店，卖各种中国产的服装、工艺品和小摆件，&#x20;还有中国中药店和中菜馆。&#x20;逛了一圈，不觉得有趣，就买了个大椰子解渴，打车回酒店睡个午觉休息。
3306904,之昂,,4,2014-01-02 10:23,就是一个华人聚集地啊！有很多中国的老人，由于我去的时候临近春节，感觉过节的气氛好浓重！甚至比北京还让人觉得有年味儿~最近几年才新增加的博物馆，主要是展览新加坡华人的早年生活，牛车水那条街以前烟馆很多
52962222,_wb2****0785,新加坡六日游,5,2013-12-31 23:22,甜点过后，我们又散步到了佛牙寺。佛牙寺龙华院位于牛车水中心地区，展现了新加坡宗教艺术与文化的方方面面，是一座仍然焕发着生机的文物古迹，供奉了佛教徒的圣物——佛牙舍利，置于由信徒捐资打造的重达&#x20;
3298932,ZHANG七七,,4,2013-12-30 12:10,亮哦点就是买猪肉脯哈哈&#x20;好热闹的街&#x20;逛逛吃吃慢愉快的&#x20;每次去都要溜达一下
57597363,sunnyhansey,13~14...逃亡Singapore,4,2013-12-30 00:00,芒果饮料和薏米饮料。。。这是去新加坡我必喝的。。。另外街边卖和路雪雪糕的那个车忘记照了1&#x20;SGD一个的雪糕超级好吃的。。。
3294304,_喜裾_,,3,2013-12-27 13:25,比较普通，不过这里交通、吃饭都很方便，建议可以住在这附近。
3283109,AIian,,4,2013-12-24 15:27,牛车水原貌馆位于新加坡的唐人街，是一间经过翻新的三层店屋。通过馆内的各种展览品和口述历史，游客可身临其境、清楚地了解早期华族移民的生活情形及他们的辛酸经历。
3277766,pose摆伐好的抹茶麻麻,,4,2013-12-18 21:26,新加坡的唐人街，在这里可以吃到很多中国的美食，可以买到各种纪念品。
3275902,张大枪,,4,2013-12-17 14:01,新加坡的CinaTown&#x20;各种美味小吃，有名的林志源猪肉干和天天海南鸡饭都在这里
3267580,YanLeeC腌鱼,,3,2013-12-11 19:34,就是新加坡的唐人街了，满街的都是福建话和广东话，当然也有华文，也就是普通话啦。
11886762,TripleLi_,新加坡 边出差边旅行,4,2013-12-09 14:31,看到了很多熟悉的美食&#x20;味道不知道怎么样&#x20;各种小商品店&#x20;也有很多名品店&#x20;没觉得比国内便宜&#x20;溜达溜达就出来了&#x0D;&#x0A;牛车水
11886765,我是琦xiao范,走近新加坡,4,2013-12-09 14:31,牛车水&#x0D;&#x0A;中国城，去就一个字，吃！吃不惯新加坡食物的朋友们，就去中国城吧。各种中国菜汇聚一地儿！
11886725,喵喵-佘佘,新囧之旅,4,2013-12-09 14:31,新加坡牛车水&#x0D;&#x0A;新加坡的唐人街---1819年以前，老华工们都住在新加坡河出海口一带，从事着繁重的码头搬运工作。为了清扫尘土飞扬的街道，每天用牛车载水冲洗，故此，这地区被称为“牛车水”。
3263977,眼睛就是照相机,,2,2013-12-07 22:24,好多人推荐，于是选了一个晚上去玩，感觉就是脏乱差，真的没什么，难道全世界的唐人街都是这么脏的，真的有损国人形象啊，其实我们国内都比那些个街干净~
11886903,_cb409****963029,新加坡5日自由行·经典自由行 上海进出 即跟随F1环游世界之新加坡夜战篇,3,2013-12-04 12:08,牛车水&#x0D;&#x0A;中国城里面有好多以前我们国内老式药材铺，南洋风味很重。据说治疗跌打很有用。适合送人。
3258348,天涯海角gogo,,5,2013-11-29 10:09,是一条历史悠久的老街，这里中国人很多。有福建人。感到很亲切的可以来这里购物。和饮食都不错。
11886687,一点墨儿,To刘小欣—新加坡一日不完全游记指引,4,2013-11-21 20:43,牛车水&#x0D;&#x0A;没走两步就印度范儿了&#x0D;&#x0A;有个印度的庙，脱鞋脱袜进入，没进去，叔叔阿姨有兴趣的话可看看
11913939,颖,20130522新加坡,4,2013-11-21 20:43,很难想象最初到新加坡的华人，生活在拥挤闷热的木质小阁楼中，居然一步步使国家强盛到四小龙的地位
11886677,飘飘是个仙女儿,Singapore逛逛,4,2013-11-21 20:43,我觉得这个就是Chinatown的一部分吧，因为一楼市场全是中国餐馆的样子&#x0D;&#x0A;牛车水中国城的早餐，难吃而且有点脏：
3249880,猫猫小格格,,5,2013-11-20 13:07,不得不推荐一下我住的这家青旅，位置非常好，距牛车水地铁站大概步行2分钟，周围就是Chinatown各种好吃的各种小店。订的6人女生宿舍，房间很干净，我喜欢上铺，不太吵。每床都有阅读灯和通用插座，公共浴室也很干净方便，前台有会中文的MM，不过英文在狮城绝对通用，还是会说比较好^_^
3248244,落绪纷飞,,4,2013-11-18 13:11,在这里可以听到熟悉的闽南话，在新加坡的华人大多会说，很有南洋风情和中国味的一条街~
10723334,雍容makiori,腐败中穷游，最新2013年版3天2夜新加坡速战速决走马观花攻略,3,2013-10-22 17:46,由于去的太早，上午10点大部分的店都没有完全开门&#x0D;&#x0A;我们就慢慢逛……推荐位于10号摊位的“天天海南鸡饭”和31号摊位的“中国街兴兴”。&#x20;简单归纳下，牛车水可以逛的地方主要在平行的三条街中间这一块。地铁出来是出名的宝塔街，然后与它平行的庙街、史密斯街，其中，史密斯街上有不少吃的，看起来还比较经济实惠，可以解决午饭问题。
11887180,公孙小白,行摄新加坡,4,2013-10-15 07:02,位于China&#x20;town&#x20;的文东记吃它家著名的海南鸡饭，感觉跟白斩鸡没有太大区别，肉质很嫩&#x0D;&#x0A;China&#x20;town&#x20;新加坡芽龙&#x20;（GEYLANG），据说有全新加坡最好的榴莲，还是一条小吃街，但同时它也是全世界都有名的红灯区
3192521,Quincy启越,,5,2013-09-30 17:29,新加坡华人比例占总人口的74%，华人最早居住的区域称为“牛车水”，也就是现在的中国城。南洋的中国文化得以在牛车水集中体现。
3189958,CJ-Design,,3,2013-09-19 22:04,这个地方适合走马观花一游的地方，白天拍拍照还是不错的，或者进庙里拜拜，晚上可以吃美食街还是可以的~&#x0A;牛车水的鞋子很便宜，$15-20&#x2F;双尺码换算&#x20;china37＝新加坡38，＝新加坡7号（机场和中国的尺寸一样）
53203654,帅得经常被打,第一次亲密接触  【新加坡 马来西亚 五天旅行】,3,2013-08-28 09:43,很多国家都有华人聚居的地方在新加坡有个叫牛车水的地方就是唐人街这次没有去到不过在新加坡到处都能看到华人的店铺和他们住的地方
52962334,i独品,狮城66小时慢生活,5,2013-06-20 10:29,我这次住了两家酒店，前两天住在牛车水的Hotel&#x20;81，属于国内如家汉庭速8类型的经济快捷酒店，但是费用是SGD120&#x2F;晚，合人民币600元了，这已经算是便宜的了，最后一晚为了防止赶不上早班飞机，就住到了东海岸去，结果这个Venue&#x20;Hotel&#x20;酒店是又便宜又好！推荐给大家，Booking.com订的，含税才SGD94&#x2F;晚。
52962338,紫陌ZIMO,一日看尽长安花——漫游城市国家新加坡,4,2013-06-06 10:30,呵呵，开始购物了。新加坡的商业是非常发达的，有一些闻名遐迩的大的购物区，如市中心的乌节路一条街，新达城、牛车水，武吉士一带等，这些主要购物区里商厦比比皆是。在靠近住宅区和地铁站附近也有很多购物中心，如北面的兀兰区域中心、纳福坊、碧山第八站购物中心，东边的白沙购物中心、淡滨尼购物中心、东福坊，西边的裕廊坊、裕廊娱乐中心等。
52962390,seabreeze1979,2013年新春新加坡6日行,3,2013-06-04 19:11,&#x20;下午牛车水的人并不是很多，也许是春节期间。晚上再出来是才感觉人多了不少，原来是夜生活丰富。
52962427,心晴Jessie,自由狮城慢生活（海图）,4,2013-05-31 15:41,&#x20;牛车水就是新加坡的唐人街，今天一早来到这里，最初的目的是帮妈咪买油，我们自小就喜欢用新加坡的红花油、狮子油、万金油、驱风油等等，久而久之，慢慢变成一种传统，总觉得家里要备好几支才有安全感，也许，这是另一种思乡情结，估计只有土生土长的广州人才会明白。
10723397,荒野女巫,新加坡一个人的完美LonelyPlanet之旅（详细攻略）,3,2013-05-27 15:44,佛牙寺不古老，2002年才建，但因为供奉释迦牟尼的遗牙，所以还是很有气场的。&#x0D;&#x0A;规模不小，5层，层层金碧辉煌，香火必定很旺。
68893761,Doctor_Garfield,印象狮城,4,2013-05-26 00:00,了解一下南洋华裔的艰辛发展历程牛车水，其实就是新加坡的唐人街。因广州有＂新牛车水酒家＂，所以这个名字对于我来说并不陌生。刚才说站在小印度的地铁站就知道自己没走错，到了这里也是一样的。一走出地铁车厢就看到到处都是中国各地的风景名胜宣传，身边的人也都是黑眼睛黄皮肤的人，到处弥漫着汉语普通话，甚至还能听到不少人在说广东话。走出A出口，满眼都是大红灯笼以及中文的餐饮招牌，不过失望的却是商店里卖的东西还是缺少一点中国的特色，大部分都是像国内的跳蚤市场那样，卖一些低价手工粗糙的旅游纪念品而已。
3171973,123-traveller,,4,2013-05-12 14:00,牛车水最热闹的时候是春节的时候，买卖年货的很多。牛车水是新加坡的唐人街，是华族祖先飘洋过海来到新加坡，自1821年逐渐形成的聚居地。
52962494,亮点liangpoint,邮轮初体验——20130325-0329皇家加勒比“海洋神话号”东南亚航线（三）,3,2013-04-11 22:32,看完激光表演回到牛车水，想找家甜品店竟然都打烊了，去麦当劳吃了个甜筒回客栈休息，明天得赶早班机回厦门呢。
52962517,用户4495048,新加坡自由行详细攻略（非常有用哦）,4,2013-02-20 16:44,牛车水百年老店冯满记万金油：属虎标的最出名的产品，对蚊虫叮咬、鼻塞、头痛等颈肩舒：对颈肩僵硬或者紧绷酸痛有很好的效果冯满记推荐：千里追风油：对四肢寒冷、腰酸背疼、风湿肿痛、跌打损伤（这个油其实南洋牌的也不错）红花油：它家的当家产品豆蔻膏：对小儿伤风感冒肚痛效果很好回春膏：是针对香港脚富贵手的
52962563,加菲猫rick,2013年春节，6天4晚，悠闲新加坡,3,2013-02-18 09:29,&#x20;出Maxwell&#x20;FC，走Smith&#x20;路，就是闻名遐尔的牛车水美食街。可惜，一般般。就以在前辈攻略中倍加推崇的“明发鱼圆汤”为例，我觉得味道一般，就一个还过得去的实心鱼丸，比较Q弹而已，还不如刚才Maxwell&#x20;FC吃的福建鱼丸，价格还贵。总之，这条所谓美食街是为游客服务的，劝诸位不要去，还不如去一街之隔的Maxwell&#x20;FC。
58349490,coranges,如期而至-巴厘 新加坡,5,2013-02-15 00:00,在牛车水市场的熟食中心吃饭，这里是实实在在的平民食肆，价格便宜，美食也很多，可以借此融入当地生活。这云吞捞面才3坡币
52963394,用户4322681,到温暖的地方窝冬——春节新加坡留念,3,2013-02-14 22:40,&#x20;抵达酒店休息了一会，我们去了牛车水。新加坡多雨，上午抵达时阳光灿烂，在牛车水没走多久就开始下雨了。正值2月8日，好多人来办年货，伞加上人加上本就不宽的步行街，想抽空拍个照都难。&#x20;
3167103,苗苗爱旅行,,3,2013-02-04 15:44,对于中国人来说，牛车水如同鸡肋，就跟香港的旺角差不多，可去可不去。附近有一个类似小贩中心的地方，东西便宜好吃。
3166742,用户4411705,,2,2013-01-27 20:26,太乱了，没什么好东西，都是地摊货，又脏又不健康不如不吃，还很吵，酒店还说的过去，至少有一些好吃的
